name,city,address,key_skills,sal_from,sal_to,currency,company,experience,schedule,published_at,description,alternate_url,id
Android developer (SberDevices),,,"['Kotlin', 'Java', 'Android', 'Git', 'ООП']",,,,СБЕР,between3And6,fullDay,2022-08-18T14:53:32+0300,"<p><strong>SberDevices </strong>— молодая команда и уникальное IT-пространство в Сбере. Мы занимаемся разработкой голосовых продуктов, умных устройств и виртуальных персонажей. Например, мы разработали голосового ассистента Сбера, SberBox, SberPortal, приложение Салют и продолжаем их развивать. А на подходе новые, еще более амбициозные продукты и устройства. В работе мы используем современные технологии, приветствуем в команде любые интересные идеи и каждые игрок команды может вложить в устройство что-то свое.</p> <p>Мы ищем <em><strong>Android разработчика </strong></em>в одну из команд, которые занимаются развитием существующих и разработкой новых сервисов.</p> <p><strong>Наши преимущества:</strong></p> <ul> <li>Возможность влиять на продукт не только с точки зрения разработки, но и с точки зрения концепции самого продукта;</li> <li>Работа на стыке разных технологий (например, WebRTC, AOSP, управление голосом и другие);</li> <li>Разработка всех компонентов Android для обеспечения взаимодействия разных приложений;</li> <li>Возможность встраивать системный код в приложения;</li> <li>Разработка для всех платформ android - телефоны, планшеты, телевизоры с окружением и даже Headunit автомобиля;</li> <li>Задачи, которые редко встречаются в других компаниях (сложные, интересные, нестандартные);</li> <li>Разнообразие продуктов и команд, возможность решения задач разного уровня.</li> <li>Сильное комьюнити.</li> </ul> <p><strong>Круг задач будет включать:</strong></p> <ul> <li>Разработку фичей и компонентов приложений для устройств или экосистемы Сбера с красивым UI, удобным UX и современным техлологическим стеком (Kotlin, Coroutines, MVVM, Android Architecture Components);</li> <li>Оптимизацию затрат ресурсов, поиск узких мест и их устранение;</li> <li>Обеспечение надежности и стабильности разработанных компонентов (благодаря хорошей продуманной архитектуре, юнит-тестам, различным метрикам);</li> <li>Взаимодействие со смежными командами: тестирование, бекенды наших сервисов, прошивки устройств и т.п.;</li> <li>Вместе мы будем создавать новый пользовательский опыт и примем участие в рождении уникальных в своем роде продуктов для многомиллионной аудитории, пройдем путь от реализации идеи до внедрения и последующей ее эволюции.</li> </ul> <p><strong>Что мы ждем от кандидатов:</strong></p> <ul> <li>Опыт разработки Android-приложений от 2-х лет;</li> <li>Отличное знание Kotlin (или желание его очень быстро освоить, в случае если сейчас основной язык - Java);</li> <li>Умение применять на практике классические структуры данных и алгоритмы, общее представление о том, как они устроены;</li> <li>Опыт разработки многопоточных приложений;</li> <li>Умение писать тестируемый код;</li> </ul> <p><strong>Мы предлагаем:</strong></p> <ul> <li>Атмосфера стартапа и надёжность большой компании;</li> <li>Конкурентая зарплата и хорошие премии;</li> <li>Работа в команде профессионалов, возможность разрабатывать уникальные и крупные проекты масштаба нашей страны;</li> <li>Возможность посещения (как в качестве слушателя, так и в качестве выступающего) всероссийских и международных IT-конференций;</li> <li>Гибкий график, возможна удалёнка, никакого дресс-кода и прочей бюрократической ерунды;</li> <li>ДМС и различные «плюшки» от нас и наших партнеров.</li> </ul>",https://hh.ru/vacancy/68929178,68929178
Senior/Lead Android Developer,,,"['Kotlin', 'Java', 'Android']",,,,CM Games,between3And6,fullDay,2022-08-18T15:46:47+0300,"<p>Мы –<strong> CM Games</strong>, независимый разработчик игр. Компания основана в 2010 году и базируется в Таллине. Мы создали новый жанр мобильных игр и превратились в студию, признанную во всём мире. Более 400 миллионов игроков открыли для себя игры, опубликованные CM Games. Наша миссия – быть прекрасным домом для талантов мирового класса и создавать отличные игры.</p> <p>Мы ищем Android engineer на околоигровой проект, посвященный заботе о психическом здоровье. У тебя есть возможность присоединиться к проекту на самой начальной стадии и внести вклад в продукт на основе уникальной технологии, аналогов которой нет на рынке.</p> <p><strong>Будущему коллеге мы готовы предложить следующие задачи:</strong></p> <ul> <li> <p>работа над быстрыми итерациями;</p> </li> <li> <p>прототипирование мобильного mental-health приложения;</p> </li> <li> <p>формирование и развитие технической команды в перспективе.</p> </li> </ul> <p><strong>Для успешного выполнения задач тебе понадобятся:</strong></p> <ul> <li> <p>более 5 лет опыта разработки Android приложений;</p> </li> <li> <p>отличное знание Java, Kotlin;</p> </li> <li> <p>опыт профилирования и оптимизации приложения;</p> </li> <li> <p>понимание принципов проектирования архитектуры приложения;</p> </li> <li> <p>знания алгоритмов и структур данных;</p> </li> <li> <p>ответственность, целеустремленность, желание и умение решать нестандартные задачи;</p> </li> <li> <p>желание перейти или имеющийся опыт в GameDev;</p> </li> <li> <p>наличие pet-проектов.</p> </li> </ul> <p><strong>Будет плюсом:</strong></p> <ul> <li> <p>опыт работы с .NET технологиями;</p> </li> <li> <p>technology-agnostic подход к развитию;</p> </li> <li> <p>опыт работы с Unity.</p> </li> </ul> <p><strong>Мы предлагаем:</strong></p> <ul> <li> <p>работу в игровой студии, трижды вошедшей в рейтинг Top 50 Developer по версии PocketGamer;</p> </li> <li> <p>интересные и амбициозные задачи;</p> </li> <li> <p>активное участие в создании игр, которыми наслаждаются миллионы игроков по всему миру;</p> </li> <li> <p>обучение и персональную программу развития;</p> </li> <li> <p>профессиональное community внутри компании для обсуждения идей и обмена опытом;</p> </li> <li> <p>культуру открытости, прозрачности и здравого смысла;</p> </li> <li> <p>отличное железо, ДМС, курсы английского, консультации с психологом и подарки к твоему дню рождения.</p> </li> </ul> <p><strong>Можем предложить полностью удаленное сотрудничество!</strong></p> <p><strong>Будем рады твоему отклику!</strong></p>",https://hh.ru/vacancy/68932427,68932427
ИТ-рекрутер,Санкт-Петербург,проспект Добролюбова,"['Подбор персонала', 'IT Recruitment', 'ИТ рекрутмент']",,,,Газпром ЦПС,between3And6,fullDay,2022-08-18T14:24:26+0300,"<strong>Основой функционал:</strong> <ul> <li>Ведение полного цикл подбора персонала (преимущественно IT специалисты: back-end Java-разработчики, Java/Kotlin Full-stack разработчики, Front-end разработчики (React, Vue), DevOps-инженеры, QA): от снятия заявки у руководителя до организации выхода успешного кандидата на работу;</li> <li>Ведение профиля работодателя в соцсетях (Telegram, Habr, и т.д) и на официальном сайте в части публикации вакансий.</li> </ul> <strong>Мы ожидаем, что вы:</strong> <ul> <li>Имеете опыт работы в IT рекрутменте от 3-х лет в IT компаниях, КА или Финтехе (в идеале, если закрывали не только ИТ вакансии);</li> <li>Закрывали IT позиции разного уровня, хорошо понимаете предметную область и специфику IT рынка;</li> <li>Используете в своей работе не только hh.ru, но и Linkedin, Habr, AmazingHiring, Telegram, Github и др.</li> </ul> <strong>Условия:</strong> <ul> <li>Конкурентная заработная плата, размер обсуждается на собеседовании;</li> <li>Комфортный офис в центре города (5 минут от м. Спортивная);</li> <li>Корпоративные мероприятия и спортивные активности.</li> </ul>",https://hh.ru/vacancy/68018116,68018116
QA Automation Engineer (Java),,,"['TeamCity', 'Java', 'SQL', 'Ansible', 'Selenium', 'Linux']",,,,Nexign (АО Нэксайн),between1And3,fullDay,2022-08-17T07:10:27+0300,"<p><em>Nexign — IT-компания, разрабатывающая системы поддержки бизнеса и платформы IoT. C помощью нашего ПО операторы связи обслуживают около 200 млн абонентов в 16 странах. Мы успешно реализовали более 120 проектов по всему миру и продолжаем развиваться!<br /><br />В нашей команде 1800 человек. Мы работаем над сложными, высоконагруженными системами с высокой отказоустойчивостью. Быть частью Nexign — значит каждый день бросать себе вызов, искать нестандартные решения, создавать технологии будущего.</em></p> <p>Продукт «Центр уведомления клиентов (CNC)» предназначен для автоматизации процесса нотификации контрагентов о затрагивающих их событиях и получения от них обратной связи, обеспечивает возможность настройки правил Контактной политики и контролирует соблюдение этих правил. Предоставляет единую точку конфигурирования процесса нотификации. Позволяет сконцентрировать все нотификации в едином хранилище.</p> <p>Продукт состоит из 3 частей: UI для конфигурирования, Core для обработки потока по заданным правилам, Integration Layer для интеграции с внешними системами.</p> <p><strong>ВАМ ПРЕДСТОИТ:</strong></p> <ul> <li> <p>Разработка и ревью тест-дизайнов</p> </li> <li> <p>Ревью тех-дизайнов (разработка тех-дизайнов при желании)</p> </li> <li> <p>Разработка авто-тестов, встройка в CI</p> </li> <li> <p>Задачи DevOps, использование Kotlin DSL</p> </li> <li> <p>Доработка авто-инсталляторов на Ansible</p> </li> <li> <p>Редко ручное тестирование (не более 10%)</p> </li> <li> <p>Описание тестов в TestRail, формирование протоколов тестирования</p> </li> <li> <p>Участие в отгрузке дистрибутива (очередной версии продукта)</p> </li> <li> <p>Консультации коллег из смежных команд</p> </li> </ul> <strong>МЫ ОЖИДАЕМ, ЧТО ВЫ:</strong> <ul> <li>Обладете опытом разработки тест-дизайна</li> <li>Обладаете опытом разработки тестов на Java, Spring Boot, TestNG/Junit, Spring Data JPA</li> <li>У Вас есть опыт использования SQL</li> <li>Владете Selenium/playwright</li> <li>Linux (опыт регулярной работы)</li> <li>У Вас есть понимание принципов RESTful (API)</li> <li>Обаладете опытом работы с Ansible/Puppet</li> <li>Знакомы с TeamCity/Jenkins</li> <li>Знакомы с принципами микросервисной архитектуры</li> </ul> <p><strong>ЖЕЛАТЕЛЬНО:</strong></p> <p> </p> <ul> <li>Знание Oracle, PostgreSQL, playwright</li> <li>Знание Python</li> <li>Знание основ DevOps, Kotlin DSL</li> </ul> <p><strong>РАБОТАТЬ В NEXIGN – ЭТО:</strong></p> <ul> <li>приходить в комфортный офис, где есть кухни с кофе и печеньками;</li> <li>управлять временем: у нас гибкое начало дня, иногда можно работать из дома. Корпоративное такси для тех, кто задержался в офисе до 22.00;</li> <li>постоянно развиваться: участвовать в конференциях и митапах, прокачивать hard и soft skills в Nexign Academy;</li> <li>совершенствовать английский язык за счет компании;</li> <li>заботиться о здоровье: у нас есть ДМС со стоматологией, страхование от несчастных случаев, полис для выезжающих за рубеж;</li> <li>пользоваться программой «Кафетерий»: сотрудники за счет компании могут компенсировать расходы на отпуск, обучение, покупку билетов и абонементов на культурные и спортивные мероприятия, снаряжение для туризма и активного отдыха.</li> </ul> <p> </p>",https://hh.ru/vacancy/68861890,68861890
Senior Android разработчик,Санкт-Петербург,Невский проспект,"['Kotlin', 'Java', 'Android']",,,,МойОфис,between3And6,fullDay,2022-08-16T14:16:15+0300,"<p>Мы разрабатываем МойОфис — безопасные офисные решения для общения и совместной работы с документами.</p> <p>К нам в команду &quot;Андроид.Документы&quot; мы ищем сильного самостоятельного разработчика, который будет не только писать код и решать архитектурные задачи, но и делиться опытом и развивать потенциал других членов своей команды.</p> <p>Приложение является редактором текстовых, табличных документов и презентаций, средством просмотра PDF и других форматов. Задача команды: реализовать полнофункциональное приложение, имеющее единообразный интерфейс в Windows, Linux, MacOSX, Android, iOS, KasperskyOS, Sailfish, etc, соответствующий гайдлайнам операционных систем. Мы делаем собственный продукт с нуля, следим за стандартами качества кода. В команде дружественная и демократичная атмосфера, мы поддерживаем традиции проектной взаимопомощи.</p> <p><strong>Чем предстоит заниматься:</strong><br />У нас есть большой спектр технологически разноплановых задач на выбор:</p> <ul> <li>общая архитектура и рефакторинг;</li> <li>новые UI фичи и анимации;</li> <li>улучшение системы рендеринга редактора;</li> <li>разбиение монолитных компонентов на модули;</li> <li>CI и автоматизация рутинных процессов;</li> <li>работа с C++, JNI и Kotlin Multiplatform.</li> </ul> <strong>Для нас важно:</strong> <ul> <li>знакомство со стандартным набором: Java, Kotlin, RxJava, Room, Retrofit, Dagger2, etc;</li> <li>понимание ценности архитектуры ПО и умение находить баланс между сложностью, понятностью и расширяемостью;</li> <li>умение проектировать и писать код, который легко читать и поддерживать;</li> <li>умение критически анализировать современные инструменты, библиотеки и подходы;</li> <li>склонность к аргументированным экспериментам.</li> </ul> <p><strong>Мы предлагаем:</strong></p> <ul> <li>проект многогранный, поэтому - возможность развиваться во многих направлениях (UI, анимация, архитектура, автоматическое тестирование, рефакторинги, С++, Kotlin multiplatform) ;</li> <li>открытость к обсуждению реализации задач и внедрению новых технологий;</li> <li>адекватное и технически грамотное руководство;</li> <li>поддержку участия в жизни профессионального сообщества (написание статей на Хабр и участие в конференциях (Mobius, appsconf) в качестве слушателей и спикеров ).</li> </ul> <p><strong>Мы работаем над созданием среды, в которой вы сможете получать удовольствие от работы и быть эффективными. Для этого у нас есть:</strong></p> <ul> <li>гибридный формат работы (3 дня офис\2 дистанционно)</li> <li>офис в центре города (5 мин. от ст. м. пл. Восстания и Маяковская);</li> <li>конкурентный уровень белой заработной платы (обсуждается индивидуально)</li> <li>компенсация питания</li> <li>гибкое начало рабочего дня;</li> <li>корпоративные уроки английского языка с профессиональными педагогами или носителями языка;</li> <li>ДМС со стоматологией после испытательного срока.</li> </ul>",https://hh.ru/vacancy/68842008,68842008
