name,city,address,key_skills,sal_from,sal_to,currency,company,experience,schedule,published_at,description,alternate_url,id
Backend разработчик Java/Kotlin,Санкт-Петербург,улица Савушкина,[],,,,Okko,between3And6,fullDay,2022-08-16T11:55:48+0300,"<p><strong>Okko</strong> — один из крупнейших российских VoD-сервисов. Проект стартовал в 2011 году и сегодня представлен на всех ключевых платформах: Smart TV, mobile (IOS и Android), Apple TV, PlayStation 3, 4 и 5, web (ПК).<br />Пользователи Okko могут купить и скачать понравившийся фильм в высоком качестве (8K, 4K, HDR), арендовать контент на 48 часов или купить подписку и смотреть его на любой популярной платформе. В коллекции сервиса — более 100 тысяч единиц популярного контента таких мировых киностудий, как Walt Disney Pictures, Paramount Pictures, 20th Century Fox, Warner Bros, Sony Pictures, Universal Pictures, а также ведущих европейских и российских производителей фильмов и сериалов.</p> <p>На платформе Okko также доступен сервис спортивных трансляций Okko Спорт.</p> <p>В техническую команду сервиса требуется <strong>Backend-разработчик </strong><strong>Java/</strong><strong>Kotlin</strong></p> <p><em>Так как наши офисы находятся Москве и Санкт–Петербурге, мы рассматриваем кандидатов на удаленную занятость или на релокацию из других городов. Мы готовы взять на себя помощь в организации переезда наших новых сотрудников.</em></p> <p><strong>Задачи:</strong></p> <ul> <li> <p>Поддержка и разработка нового продуктового функционала;</p> </li> <li> <p>Оптимизация имеющихся компонентов в соответствии с реалиями сегодняшнего дня;</p> </li> <li> <p>Дальнейшие перспективы расширения задач в любые части сервиса.</p> </li> </ul> <p><strong>Требования:</strong></p> <ul> <li> <p>Уверенное знание Java SE;</p> </li> <li> <p>Уверенное знание SQL;</p> </li> <li> <p>Понимание принципов проектирования клиент-серверных интерфейсов (REST);</p> </li> <li> <p>Опыт работы со Spring Framework, Postgres DB.</p> </li> </ul> <p><strong>Будет плюсом:</strong></p> <ul> <li> <p>Знание Kotlin;</p> </li> <li> <p>Опыт использования или интерес к работе с NoSQL базами данных (Cassandra, Couchbase, Hadoop);</p> </li> <li> <p>Опыт работы с Redis, nginx, RabbitMQ, Kafka;</p> </li> <li> <p>Опыт настройки мониторинга Java-приложений;</p> </li> <li> <p>Опыт Frontend-разработки.</p> </li> </ul> <p><strong>Условия:</strong></p> <ul> <li>Топовое оборудование и весь необходимый софт;</li> <li>Официальное трудоустройство, достойная и полностью белая заработная плата;</li> <li>ДМС со стоматологией, офисный врач, доплата больничного листа, компенсация мобильной связи, корпоративные скидки;</li> <li>Льготные условия ипотеки в рамках зарплатного проекта;</li> <li>Бесплатная подписка на сервисы партнеров;</li> <li>Совместные занятия спортом: йога, футбол, волейбол;</li> <li>Насыщенная корпоративная жизнь.</li> </ul> <p> </p>",https://hh.ru/vacancy/49052678,49052678
Android разработчик,,,"['Android SDK', 'Kotlin', 'Java', 'Android', 'XML']",,,,Шаповалов Сергей Андреевич,between1And3,fullDay,2022-08-08T09:22:37+0300,"<p>Мы молодая и прогрессивная команда разрабатывающая мобильные приложения, игры и сервисы на блокчейне TON (The Open Network). Сейчас у нас есть несколько крутых перспективных проектов и мы будем рады пригласить в нашу команду самого лучшего <strong>Android - разработчика!</strong></p> <p><strong>Чем предстоит заниматься:</strong></p> <ul> <li> <p>Разрабатывать приложение на базе Android для продуктов нашей компании;</p> </li> <li> <p>Активно участвовать в процессе разработки, начиная с планирования, проектирования архитектуры и заканчивая запуском и поддержкой;</p> </li> <li>Активно взаимодействовать с коллегами, обсуждать варианты реализации задач;</li> </ul> <p><br /><strong>Мы ожидаем:</strong></p> <ul> <li> <p><strong>Опыт коммерческой разработки приложений для Android;</strong></p> </li> <li> <p>Уверенное владение Java/Kotlin и Android SDK;</p> </li> <li> <p>Знание основ REST, HTTP, XML, JSON;</p> </li> <li> <p>Знание архитектурных паттернов (MVP, MVVМ, MVI);</p> </li> <li> <p>Опыт работы с внешними библиотеками Dagger2, RxJava2;</p> </li> <li> <p>Желание брать на себя ответственность и добиваться результата;</p> </li> <li> <p>Соблюдение сроков и своевременное сигнализирование о проблемах;</p> </li> <li> <p>Внимание к деталям и забота о качестве;<br /><br /><strong>Будет плюсом:</strong></p> </li> <li>Наличие в портфолио законченных приложений, опубликованных в GooglePlay или активное участие в разработке опубликованных проектов;</li> </ul> <p><br /><strong>Мы предлагаем: </strong></p> <ul> <li> <p>Конкурентную заработную плату, которую обсудим на интервью;</p> </li> <li> <p>Комфортный и уютный офис в шаговой доступности от м.Маяковская/Восстания <strong>(вакансия предполагает full time работу в офисе)</strong>;</p> </li> <li> <p>Завтраки, обеды и ужины от шеф-повара;</p> </li> <li> <p>Такси каждому от дома до офиса;</p> </li> <li> <p>Бонусы команде (выделаем 20% от прибыли и по сути каждый является акционером компании);</p> </li> <li> <p>В офисе есть полноценная ванна и комната отдыха и сна;</p> </li> <li> <p>PS5 и Oculus Quest2 для игр;</p> </li> <li> <p>Мини зал для кино на удобном диване;</p> </li> <li> <p>Балкон для вредных привычек и турник-брусья-пресс для полезных;</p> </li> <li> <p>Безлимитный RedBull:)</p> </li> </ul>",https://hh.ru/vacancy/68548493,68548493
"Разработчик Android (проект ""Обсуждения"")",Санкт-Петербург,Херсонская улица,"['Java', 'Kotlin', 'Android']",,,,VK,between3And6,fullDay,2022-08-16T16:44:55+0300,"<p>Обсуждения в ОК ― это возможность оставлять комментарии под разными типами постов и контента. Ежедневно обсуждениями пользуются миллионы на всех платформах (web, mob.web, Android, iOS). В обсуждениях используется не только текст, но и стикеры, фото, видео, GIF, а также музыкальные аттачи.</p> <p>Наша команда развивает все механики, связанные с обсуждениями, а также алгоритмы рекомендаций интересных обсуждений.<br /><br /><strong>Твои задачи:</strong></p> <ul> <li>Разработка новых фич для обсуждений ― у тебя будет свобода придумывать и реализовывать новый функционал.</li> <li>Поддержка существующего функционала и борьба с багами.</li> <li>Улучшение производительности сервиса, которым пользуются миллионы.</li> <li>Анализ статистики, паттернов поведения и реализация пожеланий пользователей.</li> </ul> <p><strong>Мы ожидаем:</strong></p> <ul> <li>Опыт профессиональной разработки c использованием Java/Kotlin.</li> <li>Понимание многопоточности и управления памятью.</li> <li>Знание шаблонов проектирования.</li> <li>Опыт разработки клиент-серверных приложений.</li> <li>Понимание сетевых технологий.</li> <li>Умение оптимизировать приложение с точки зрения быстродействия и работы с сетью.</li> </ul> <p><strong>Какой стэк мы используем?</strong></p> <p>Android-версия ОК построена на языках Java и Kotlin c помощью RxJava и Coroutines, а для DI мы взяли Dagger, данные храним с помощью Room.</p> <p><strong>Мы предлагаем:</strong></p> <ul> <li>Сложные и интересные задачи: мы создаем высоконагруженные быстрорастущие сервисы.</li> <li>Команду: с нами работают профессионалы экстра класса, каждый из которых готов поделиться своей экспертизой.</li> <li>Профессиональное развитие: митапы, конференции, семинары и тренинги, куда открыт доступ каждому сотруднику, а также участие в топ-конференциях.</li> <li>Комфортный офис с парковкой, душем и зонами отдыха в паре минут от м. «Площадь Александра Невского».</li> <li>Выбор режима работы: удаленный, гибридный или в офисе.</li> <li>Спорт: компания компенсирует затраты на спортивные активности — занятия в фитнес-клубе, индивидуальные тренировки, участия в соревнованиях.</li> <li>Регулярно пересматриваемая зарплата, годовые бонусы, социальный пакет с первого дня (ДМС, английский язык).</li> </ul> <p>Мы будем рады твоему отклику и, при взаимном интересе, предложим условия и проекты, от которых не захочется отказываться.</p>",https://hh.ru/vacancy/51268814,51268814
Middle android developer (Kotlin),,,"['Kotlin', 'Git', 'Английский язык', 'Scrum', 'ООП', 'SQL', 'HTML', 'REST']",,,,the_covert,between1And3,fullDay,2022-08-11T13:17:12+0300,"<p><strong>The_covert</strong> международная компания, мы входим в группу IT-компаний, занимающихся разработкой собственных продуктов и сервисов более 10 лет.</p> <p>Нашими продуктами для реализации и упрощения бизнес процессов пользуются тысячи людей по всему миру. Мы предоставляем сервисы крупным финансовым B2B и B2C платформам, кроме того у нас есть линейка продуктов, связанных с финансовой аналитикой, и запущено несколько глобальных медиа-проектов.</p> <p>Сейчас мы запускаем fashiontech-стартап, поэтому мы ищем опытного <strong>Android developer</strong>, который будет заниматься созданием проекта мирового уровня. Мы находимся в stealth режиме — важен быстрый запуск и сильная команда. Среди нас: основатель с экзитом, опытный CTO и продакты, зарубежный VC, закрывший раунд финансирования.</p> <p>Если ты хочешь иметь возможность самостоятельно выбирать технологии и работать с опытной командой, которая дает структурированные задачи — это то, что ты ищешь.<br /><br /><strong>Наш стек: </strong>Jetpack Compose, MVVM + StateFlow, Kotlin Coroutines + Flow, Hilt, Gradle (Kotlin DSL).<br /><br /><strong>Важно: </strong>Обязателен релокейт из РФ (есть офис в Ереване, помогаем открыть ИП, компенсируем налоги). Возможно любая другая страна, также поможем с открытием ИП и компенсируем налоги.</p><br /><strong>Обязанности:</strong> <ul> <li>Написание и поддержка кода приложения на Kotlin;</li> <li>Умение правильно оценивать задачи по времени и структурировать их;</li> <li>Взаимодействие с Backend-инженерами, UX/UI-дизайнерами, product-менеджерами и QA;</li> <li>Проектирование и документирование мобильного приложения;</li> <li>Покрытие кода unit-тестами;</li> </ul> <strong>Требования:</strong> <ul> <li>Опыт коммерческой разработки Android от 2х-лет;</li> <li>Знание ООП, паттернов и принципов проектирования ПО;</li> <li>Умение писать Clean Code (SOLID, KISS, DRY);</li> <li>Знание архитектурных паттернов MVVM/MVI;</li> <li>Опыт с DI (Dagger, Koin);</li> <li>Опыт использования Kotlin Coroutines;</li> <li>Опыт разработки многопоточных приложений;</li> <li>Отличные навыки работы с системой контроля версий;</li> <li>Понимание протоколов HTTP, WS;</li> <li>Знание моделей и способов взаимодействия между клиентом и сервером (REST API, JSON);</li> <li>Понимание цикла разработки, гибких методологий (Scrum/Kanban);</li> <li>Опыт работы в таск-менеджерах (Asana, JIRA, Redmine - в идеале JIRA);</li> <li>Умение работать в команде;</li> <li>Опыт работы Gradle.</li> </ul> <p><strong>Будет плюсом: </strong></p> <ul> <li>Опыт работы с CI/CD;</li> <li>Опыт разработки приложений &quot;с нуля&quot;;</li> <li>Опыт работы в продуктовой команде;</li> <li>Наличие кода на GitHub/GitLab/BitBucket;</li> <li>Английский язык уровня Advanced (С1).</li> </ul> <strong>Условия:</strong> <ul> <li>Зарплата в долларах без привязки к курсу рубля;</li> <li>Zero-legacy, стартап-культура;</li> <li>Возможность релокации;</li> <li>Работа в американской компании-стартапе;</li> <li>Возможность для быстрого роста;</li> <li>Официальное оформление и белая зарплата;</li> <li>При желании: уютный офис в Ереване.</li> </ul>",https://hh.ru/vacancy/68239001,68239001
Разработчик Android приложений,,,"['Kotlin', 'Android', 'ООП', 'GraphQL', 'Работа в команде']",,,,Премьер Консалт,between1And3,fullDay,2022-08-12T17:45:04+0300,"<p>Крупнейшая федеральная служба доставки блюд японской и итальянской кухни приглашает на работу разработчика Android приложений в команду разработки и интеграции продуктов. Нам предстоит создавать и развивать приложения с широкой аудиторией по всей стране вместе с другими профессионалами своего дела. Мы работаем на результат, добиваемся лучшего, гарантируем адекватность и большие перспективы развития</p> <p><strong>Обязанности:</strong></p> <ul> <li>Разработка новых и поддержка существующих мобильных приложений для платформы Android;</li> <li>Взаимодействие с бэкенд разработчиками и смежными подразделениями по вопросам работы мобильных приложений</li> </ul> <strong>Требования:</strong> <ul> <li>Опыт коммерческой разработки на Kotlin;</li> <li>Знание ООП, паттернов проектирования и понимание Clean Architecture;</li> <li>Знакомство с системами контроля версий;</li> <li>Опыт разработки клиент-серверных приложений;</li> <li>Опыт работы с Firebase SDK, Dagger, Kotlin coroutines, Databinding;</li> <li><strong>Желателен</strong> опыт работы с Graphql.</li> </ul> <strong>Условия:</strong> <ul> <li> <p>По желанию удаленная работа;</p> </li> <li> <p>Скидки на продукцию;</p> </li> <li> <p>Ежегодный оплачиваемый отпуск;</p> </li> <li> <p>Молодой коллектив и перспективы профессионального роста.</p> </li> </ul>",https://hh.ru/vacancy/67704448,67704448
"Разработчик Android (проект ""Мессенджинг"")",Санкт-Петербург,Херсонская улица,"['Java', 'Kotlin', 'Android', 'Android SDK']",,,,VK,between3And6,fullDay,2022-08-12T15:43:43+0300,"<p>Проект “Месседжинг” ― это общение в Одноклассниках и в мессенджере ТамТам, благодаря которому миллионы людей по всему миру остаются на связи с близкими ежедневно.</p> <p>Android-версия месседжинга ОК построена на языках Java и Kotlin c помощью RxJava и Coroutines, а для DI мы взяли Dagger, данные храним с помощью Room.</p> <p><strong>Твои задачи:</strong></p> <ul> <li>Разработка новых фич для месседжинга ― у тебя будет свобода придумывать и реализовывать новый функционал.</li> <li>Поддержка существующего функционала и борьба с багами.</li> <li>Улучшение производительности сервиса, которым пользуются миллионы.</li> <li>Анализ статистики, паттернов поведения и реализация пожеланий пользователей.</li> </ul> <p><strong>Мы ожидаем:</strong></p> <ul> <li>Опыт профессиональной разработки c использованием Java/Kotlin.</li> <li>Понимание многопоточности и управления памятью.</li> <li>Знание шаблонов проектирования.</li> <li>Опыт разработки клиент-серверных приложений.</li> </ul> <p><strong>Мы предлагаем:</strong></p> <ul> <li>Сложные и интересные задачи: мы создаем высоконагруженные быстрорастущие сервисы.</li> <li>Команду: с нами работают профессионалы экстра класса, каждый из которых готов поделиться своей экспертизой.</li> <li>Профессиональное развитие — митапы, конференции, семинары и тренинги, куда открыт доступ каждому сотруднику, а также участие в топ-конференциях.</li> <li>Комфортный офис с парковкой, душем и зонами отдыха в паре минут от м. «Площадь Александра Невского».</li> <li>Выбор режима работы: удаленный, гибридный или в офисе.</li> <li>Спорт: компания компенсирует затраты на спортивные активности — занятия в фитнес-клубе, индивидуальные тренировки, участия в соревнованиях.</li> <li>Регулярно пересматриваемая зарплата, годовые бонусы, социальный пакет с первого дня (ДМС, английский язык).</li> </ul> <p>Мы будем рады твоему отклику и, при взаимном интересе, предложим условия и проекты, от которых не захочется отказываться.</p>",https://hh.ru/vacancy/54821218,54821218
