name,city,address,key_skills,sal_from,sal_to,currency,company,experience,schedule,published_at,description,alternate_url,id
Младший инженер-тестировщик / QA Engineer (Junior),,,"['Python', 'Linux', 'Mac Os', 'QA', 'English']",,,,Беамр имэджинг РУ,noExperience,fullDay,2022-09-01T09:20:41+0300,"<p>Компания Beamr является мировым лидером в области ПО для кодирования и оптимизации видео и изображений. Офисы Beamr расположены в США, Израиле и России. Заказчиками компании являются известные киностудии, сервисы видео-стриминга, каналы телевидения, крупнейшие мировые медиа, социальные сети, сайты электронной коммерции и издательства.</p> <p>Мы объявляем о вакансии младшего инженера-тестировщика / QA Engineer (Junior) в Санкт-Петербургском офисе. Мы ищем талантливого инженера, готового влиться в команду QA и работать над повышением качества наших продуктов.</p> <p><strong>Обязанности:</strong></p> <ul> <li> <p>Ручное и автоматизированное тестирование ПО для кодирования/оптимизации изображений и видео</p> </li> <li>Разработка скриптов для автоматизированного тестирования</li> <li>Работа с тестовой документацией</li> <li>Занесение информации в базу дефектов и проверка их исправления</li> <li>Анализ результатов тестирования, составление отчетов</li> </ul> <p><strong>Требования:</strong></p> <ul> <li>Высшее образование в области программирования, IT или математики</li> <li>Профессиональное владение компьютером, опыт работы с различными операционными системами (Windows, Linux, MacOS)</li> <li> <p>Умение работать с командной строкой (cmd, bash), с файл-менеджерами (FAR,Total Commander, и т.п.)</p> </li> <li> <p>Опыт разработки на языках программирования: Python, Perl, C/C++, и т.п.</p> </li> <li> <p>Уровень владения английским языком Intermediate и выше</p> </li> <li> <p>Умение выполнять задачи в соответствии со сроками и приоритетами</p> </li> <li> <p>Коммуникативность, готовность работать в команде</p> </li> </ul> <p><strong>Плюсом будет:</strong></p> <ul> <li>Опыт работы в сфере IT (программирование, тестирование)</li> <li>Знание основ кодирования видео; опыт работы с ПО для кодирования (FFMPEG, x264/x265 и т.п.)</li> </ul> <p><strong>Мы предлагаем:</strong></p> <ul> <li>Интересную работу в компании, являющейся одним из лидеров индустрии</li> <li>Стать частью команды, более 25 лет работающей на рынке коммерческого ПО</li> <li>Официальное трудоустройство, белая зарплата, отпуск и больничные согласно ТК РФ</li> <li>Социальный пакет: ДМС, корпоративные мероприятия, удобный офис с парковкой</li> <li>Гибкий рабочий график, возможность удаленной работы</li> <li> <p>Конкурентная заработная плата, премирование по результатам труда</p> </li> <li> <p>Бесплатное обучение английскому языку в офисе компании</p> </li> <li> <p>Чай, кофе и снэки в офисе, предоставляемые компанией</p> </li> <li> <p>Дружный коллектив, творческая атмосфера, отсутствие формализма и бюрократии</p> </li> <li> <p>Метро Пл.Ленина в 10 минутах ходьбы</p> </li> </ul>",https://hh.ru/vacancy/68866990,68866990
Технический пресейл,,,"['Аналитическое мышление', 'Аналитические исследования', 'C++', 'MS Access', 'Системное мышление']",120000,150000,RUR,SearchInform,noExperience,fullDay,2022-09-01T14:43:23+0300,"<p><strong><em>Компания СёрчИнформ, являясь лидером на рынке корпоративных систем безопасности в РФ, расширяет штат и приглашает на постоянную работу технического пресейла.</em></strong></p> <p><strong>Требования к соискателям:</strong></p> <ul> <li>специальности: информационные технологии, прикладная математика, компьютерная безопасность;</li> <li>понимание основных принципов работы ИТ технологий и продуктов: Доменная структура, сетевое взаимодействие, клиент-серверная архитектура, хранение и выборка из БД, основные компоненты и роли системного ПО и прикладного ПО;</li> <li>аналитический склад ума;</li> <li>желание учиться и разбираться в продуктах.</li> </ul> <p><strong>Обязанности:</strong></p> <ul> <li>анализ рынка существующих решений и изучение конкурирующих решений;</li> <li>общение с внутренними и внешними сотрудниками, общие технические консультации;</li> <li>консультации, обучения сотрудников компании по стратегиям конкурентной борьбы, техническим аспектам собственного и сторонних решений;</li> <li>тесная коммуникация с техническими подразделениями по вопросам разработки функционала.</li> </ul> <p><strong>Мы предлагаем:</strong></p> <ul> <li>работу в команде профессионалов с опытом работы более 5 лет;</li> <li>возможность совершенствовать знания получая практический опыт в рамках действующих проектов;</li> <li>конкурентоспособную заработную плату;</li> <li>профессиональный рост.</li> </ul> <p> </p> <p> </p>",https://hh.ru/vacancy/69380900,69380900
Инженер-программист АСУ ТП,,,"['C/C++', 'Linux', 'SQL', 'Python', 'MATLAB']",,,,Газпром нефть,noExperience,fullDay,2022-08-30T09:17:04+0300,"<p><strong>Обязанности:</strong></p> <ul> <li>Разработка программно-технических комплексов, встраиваемых решений и киберфизических систем на основе IIoT-технологий: датчики, устройства сбора данных, программируемые контроллеры, шлюзы, сетевая платформа, платформа приложений;</li> <li>Анализ применимости технологий и продуктов для применения в промышленных системах;</li> <li>Тестирование функциональности продуктов и экспертная оценка решения;</li> <li>Взаимодействие с проектной командой для уточнения целей и функциональных требований для новых или модифицированных продуктов</li> </ul> <p><strong>Требования:</strong></p> <ul> <li>Высшее техническое образование в области компьютерных наук, киберфизических систем, управления в технических системах или эквивалентное;</li> <li>Опыт комплексной разработки систем управления на основе ПЛК/РСУ (проектирование, программирование, подключение, наладка).;</li> <li>Опыт разработки встраиваемых систем на микроконтроллерах/микропроцессорах;</li> <li>Опыт разработки проектно-конструкторской документации;</li> <li>Знание методов монтажа, регулировки и наладки оборудования АСУТП/IIoT;</li> <li>Знание основных промышленных протоколов передачи данных;</li> <li>Знание ГОСТ, норм ЕСКД/ЕСПД;</li> <li>Знание одной из САПР CAD/CAM (Eplan, Solid Works, Компас или др.)</li> <li><strong>Желательно:</strong></li> <li>Хорошее понимание экосистемы Linux и опыта работы с сервером;</li> <li>Знание и навыки работы с TCP/IP, опыт работы с инструментами сетевой отладки и устранения неполадок</li> <li>Опыт работы со SCADA-системами.</li> <li>Опыт использования баз данных SQL (Oracle, MySQL, PostgreSQL)</li> <li>Знание протоколов прикладного уровня IoT (MQTT, MQTT-SN, AMQP, CoAP, LWM2M)</li> <li>Знание базовых языков программирования (C/C++ или Python)</li> <li>Опыт моделирования в специализированных программных средах (MatLab, Simulink и т.п.)</li> <li>Опыт обработки сигналов</li> </ul> <p><strong>Условия:</strong></p> <ul> <li>Работа в стабильной, динамично развивающейся компании;</li> <li>Перспектива профессионального роста;</li> <li>Социальный пакет (ДМС);</li> <li>Уровень заработной платы обсуждается с финалистами;</li> <li>Режим работы пн.-пт. с 9 до 18</li> </ul>",https://hh.ru/vacancy/68461141,68461141
"Инженер-конструктор, ПБ ""Автоматика""",Санкт-Петербург,улица Академика Харитона,"['MATLAB', 'Математическое моделирование', 'AutoCAD', 'C/C++', 'C++']",44000,,RUR,Климов,noExperience,fullDay,2022-08-29T16:30:49+0300,"<p><strong>АО &quot;ОДК-Климов&quot; - динамично развивающееся высокотехнологичное предприятие с вековой историей. Ведущий разработчик перспективных авиационных двигателей приглашает</strong></p> <p><strong>Инженера-конструктора в ПБ &quot;Автоматика&quot;.</strong></p> <p><strong>Мы предлагаем:</strong></p> <ul> <li>Стабильную заработную плату</li> <li>Премии по итогам работы</li> <li>Доплаты за выслугу лет, доплата к отпуску, ежегодная индексация</li> <li>Полный соц.пакет, ДМС</li> <li>Профессиональный рост: повышение квалификации, получение более высокого разряда</li> <li>Столовая на территории предприятия, частичная компенсация питания</li> <li>На АО «ОДК-Климов» действует один из лучших в Санкт-Петербурге Коллективных договоров</li> <li>Корпоративный транспорт от станций м. Пионерская, м. Проспект Просвещения</li> </ul> <p><strong>Основные задачи: проектирование системы автоматического управления (САУ) авиационных двигателей.</strong></p> <p><strong>Обязанности</strong>:</p> <ul> <li>Разработка математических моделей объекта управления и его САУ;</li> <li>Отладка и тестирование алгоритмов и программ цифровой САУ;</li> <li>Разработка алгоритмов управления и диагностики;</li> <li>Программирование на языках высокого уровня;</li> <li>Прочие расчётные работы по САУ изделия;</li> <li>Выпуск доказательной документации по САУ изделия;</li> <li>Сопровождение испытаний.</li> </ul> <p><strong>Требования:</strong></p> <ul> <li>в/о техническое (специальность, связанная с ГТД и/или гидроавтоматикой, математическим моделированием, программированием);</li> <li>владение расчетными комплексами (С, С++, MATLAB, Fortran)</li> </ul>",https://hh.ru/vacancy/48615579,48615579
Стажер по направлению DevOps,Санкт-Петербург,Артиллерийская улица,"['Git', 'Linux', 'Python', 'Docker', 'Bash']",,,,ИнфоТеКС,noExperience,flexible,2022-08-29T09:41:35+0300,"<p>ГК &quot;ИнфоТеКС&quot;, входящая в ТОП-5 компаний России в сфере защиты информации, лидер в разработке средств защиты информации набирает на стажировочную площадку по направлению <strong>DevOps</strong> для работы в проекте TIAS.</p> <p>В этом проекте разрабатывается самая умная часть комплекса Intrusion Threat Detection and Prevention (ITDP) – сервер аналитики.<br />Сервер собирает, агрегирует и анализирует данные о сетевых и хостовых событиях с большого числа сенсоров. В результате формируются инциденты сетевой безопасности, которые отображаются пользователю-аналитику ИБ для расследования и передаются во внешние системы.</p> <p><strong>Интересные задачи:</strong></p> <ul> <li>Перевод проектов на основной дистрибутив Debian;</li> <li>Настройка сборочного пайплайна и оптимизация данного процесса;</li> <li>Интеграция как внутренних, так и внешних компонентов в проект;</li> <li>Внедрение практик DevSecOps;</li> <li>Возможность исследования новых технологий;</li> <li>Разбор и решения различных инцидентов.</li> </ul> <p><strong>Ожидания от квалификации: </strong></p> <ul> <li>Уверенный пользователь GNU Linux;</li> <li>Знание основных этапов загрузки в GNU Linux;</li> <li>Понимание для чего нужна виртуализация или опыт работы с Virtualbox и Docker;</li> <li>Знание одного из скриптовых языков: Python3, Bash, PowerShell;</li> <li>Базовый уровень C/С++ или хотя бы знание в чем разница между статической и динамической линковкой;</li> <li>Git.</li> </ul> <p><strong>Будет плюсом</strong><strong>: </strong></p> <ul> <li>JAVA/maven;</li> <li>C#/nugget;</li> <li>Packer/Ansible;</li> <li>Cmake/Conan/make;</li> <li>CI/CD;</li> <li>Vsphera/VMware;</li> <li>QEMU/KVM;</li> <li>Teamcity/Gitlab.</li> </ul> <p><strong>Условия работы:</strong></p> <ul> <li>Обучение на реальных задачах и получение практического опыта работы в большой, сильной компании;</li> <li>Изучение технологий и получение знаний, которые не дают в ВУЗе;</li> <li>Работа в офисе в Санкт-Петербурге возле м. Чернышевская (только очный формат);</li> <li>Трудоустройство по договору ГПХ;</li> <li>Длительность стажировки 3,5 месяца (октябрь-февраль);</li> <li>20-ти часовая рабочая неделя, возможность совмещения в т.ч. с учебой в ВУЗе;</li> <li>Ежемесячная стипендия 35 000 руб.</li> </ul>",https://hh.ru/vacancy/68350355,68350355
Junior DSP-программист,Санкт-Петербург,Кушелевская дорога,[],50000,90000,RUR,Специальный Технологический Центр (ООО СТЦ),noExperience,fullDay,2022-08-22T15:46:29+0300,"<p>Крупный холдинг, занимающий лидирующее место на отечественном рынке разработки и производства средств связи, телекоммуникаций и навигации, приглашает на работу талантливых сотрудников, в том числе студентов на должность &quot;Junior DSP-программист<strong>&quot;</strong></p> <p><strong>Обязанности:</strong></p> <ul> <li>Проведение исследований в области цифровой обработки сигналов</li> <li>Реализация современных алгоритмов обработки сигналов</li> <li>Разработка кроссплатформенного программного обеспечения</li> </ul> <p><strong>Требования:</strong></p> <ul> <li>Высшее техническое образование</li> <li>Знание теории цифровой обработки сигналов</li> <li>Знание C++11/14/17</li> <li>Система контроля версий Git/SVN</li> <li>Опыт работы с MATLAB/LabVIEW</li> <li>Умение внимательно читать стандарты, статьи и чужой исходный код</li> <li>Английский язык на уровне чтения технической документации</li> </ul> <p><strong>Будет плюсом:</strong></p> <ul> <li>Опыт реализации демодуляторов (OFDM, QAM, TCM, PSK, FSK, …)</li> <li>Опыт реализации эквалайзеров (LMS, RLS, Turbo equalization, …)</li> <li>Опыт оптимизации приложений по скорости и потреблению ресурсов</li> <li>Опыт реализации эффективных многопоточных алгоритмов</li> <li>Знание технологий (OFDM, DSSS, FHSS)</li> <li>Опыт работы с Qt</li> </ul> <p><strong>Мы предлагаем:</strong></p> <ul> <li>Интересные задачи и молодой дружный коллектив</li> <li>Возможность совмещать работу и учебу</li> <li>Возможность для профессионального и карьерного роста</li> <li>Высокую заработную плату; определяется по результатам интервью</li> <li>Премирование по результатам работы + премия по итогам года в размере 100% оклада</li> <li>Оплачиваемый отпуск 28 календарных дней</li> <li>Оформление по ТК РФ</li> <li>Гибкий график работы</li> <li>Комфортный офис в бизнес-центре (г. Санкт-Петербург)</li> </ul>",https://hh.ru/vacancy/69045889,69045889
Тьютор программист,Санкт-Петербург,Московский проспект,"['Грамотность', 'Организация мероприятий', 'Веб-программирование', 'Умение работать с детьми', 'С++', 'Знание языков', 'Желание обучаться', 'Желание работать и зарабатывать']",,,,KIBERone (ИП Максимов Денис Викторович),noExperience,fullDay,2022-08-22T12:11:50+0300,"<ul> <li> <p><strong>Обязанности:</strong></p> <p>- Транслирование программ КиберШколы по методическим материалам и передача практического опыта для детей 6 - 14 лет.</p> <p>- Участие в IT-мероприятиях и конференциях</p> <p><strong>Требования:</strong></p> <p>- Знание базовых основ компьютерной грамотности;</p> <p>- Знание любого современного языка программирования;</p> <p>- Умение разбираться с методикой и платформами в соответствии с инструкцией;</p> <p>- Высшее или неоконченное высшее образование в сфере IT</p> <p>- Обучаемость, желание получать новые знания</p> <p>Условия работы и оплаты:</p> <p>- Занятия в выходные дни;</p> <p>- Гибкий график, возможность совмещения с основной работой;</p> <p>- Заработная плата, зависит от количества проведенных занятий;</p> <p>- Участие в мероприятиях федерального и международного уровня</p> <p>- Время работы: с 10.30 до 18:00 сб., вс. (на выбор или оба дня)</p> </li> </ul>",https://hh.ru/vacancy/69030632,69030632
