name,city,address,key_skills,sal_from,sal_to,currency,company,experience,schedule,published_at,description,alternate_url,id
C++ Developer (С++ разработчик),,,"['Git', 'Английский язык', 'Android', 'iOS']",,,,Social Quantum,noExperience,fullDay,2022-08-23T14:56:41+0300,"<p><strong>Обязанности:</strong></p> <ul> <li> <p>Участие в проектировании и разработке архитектуры модулей игровых приложений</p> </li> <li> <p>Разработка и поддержка игрового фреймворка</p> </li> <li> <p>Соблюдение и поддержка стандартов кода компании</p> </li> <li> <p>Разработка и поддержка unit-тестов</p> </li> <li> <p>Совместная работа в проектной команде</p> </li> </ul> <strong>Требования:</strong> <ul> <li> <p>Уверенной владение C++ от двух лет (11/14 стандарты)</p> </li> <li> <p>Понимание основ разработки под мобильные платформы (iOS/Android)</p> </li> <li> <p>Знание линейной алгебры</p> </li> <li> <p>Знание базовых алгоритмов и структур данных</p> </li> <li> <p>Умение работать с системами контроля версий (Git)</p> </li> <li> <p>Технический английский</p> </li> </ul> <p><br /><strong>Будет плюсом:</strong></p> <ul> <li> <p>Опыт работы в игровой индустрии</p> </li> <li> <p>Опыт разработки на Python/Lua</p> </li> <li> <p>Знание UE4/Unity</p> </li> <li> <p>Знание OpenGL/DirectX/Vulcan/Metal</p> </li> <li> <p>Умение проводить Code Review</p> </li> <li> <p>Владение UML в объеме, достаточном для документирования собственных идей и понимания чужих схем</p> </li> </ul>",https://hh.ru/vacancy/68087825,68087825
Программист С++/Qt (junior),Санкт-Петербург,Заставская улица,"['C/C++', 'ООП', 'SQL']",60000,,RUR,Аргун-Софт,noExperience,fullDay,2022-08-22T18:24:53+0300,"<p><strong>Обязанности:</strong></p> <ul> <li>Разработка и поддержка ПО на C++ (QT) под Windows, Linux.</li> </ul> <p><strong>Требования:</strong></p> <ul> <li>профильное высшее-техническое образование;</li> <li>знание структур данных и алгоритмов;</li> <li>знание принципов объектно-ориентированного программирования (ООП);</li> <li>знание принципов SOLID;</li> <li>знание библиотеки STL;</li> <li>знание библиотеки Qt;</li> <li>желателен опыт работы в Visual Studio 2015/2017 (С++);</li> <li>желателен опыт работы в QtCreator;</li> <li>желателен опыт работы с TCP/IP;</li> <li>желателен опыт разработки многопоточных приложений.</li> </ul> <p><strong>Дополнительно приветствуется:</strong></p> <ul> <li>технический английский язык.</li> </ul> <p><strong>Преимущества работы в ООО &quot;Аргун-Софт&quot;:</strong></p> <ul> <li>официальное трудоустройство с первого дня работы, оформление согласно ТК РФ;</li> <li>стабильность (в т.ч. в выплате заработной платы) - работаем с гособоронзаказами, которые финансируются из бюджета;</li> <li>своевременные выплаты 2 раза в месяц;</li> <li>премии в конце календарного года;</li> <li>работа в выходные дни в командировках оплачивается согласно ТК РФ;</li> <li>возможность обучения и повышения квалификации за счет компании;</li> <li>индивидуальный зарплатный рост, карьерный рост;</li> <li>дружный коллектив, лояльное руководство;</li> <li>четкая система наставничества;</li> <li>ДМС: оформляется в конце испытательного срока;</li> <li>хорошее оснащение рабочих мест;</li> <li>корпоративные мероприятия;</li> <li>график работы 5/2: с 9:00 до 18:00 или с 10:00 до 19:00.</li> </ul>",https://hh.ru/vacancy/69053987,69053987
Стажер-исследователь ОТИ (С++),Санкт-Петербург,Артиллерийская улица,"['Python', 'Linux', 'C/C++']",,,,ИнфоТеКС,noExperience,flexible,2022-08-29T09:41:35+0300,"<p>ГК &quot;ИнфоТеКС&quot;, входящая в ТОП-5 компаний России в сфере защиты информации, лидер в разработке средств защиты информации набирает в том числе студентов на Стажировочную площадку по направлению &quot;Исследователь ОТИ&quot; в отдел технологических исследований, который занимается задачами минимизации рисков для разработки новых продуктов или функций.</p> <p><strong>Интересные задачи:</strong></p> <ul> <li>Применение технологий виртуализации (SDN, NFV) в продуктах компании;</li> <li>Апробация нового алгоритма обработки зашифрованных соединений TLS;</li> <li>Оптимизация архитектуры решения межсетевого экрана нового поколения;</li> <li>Исследование нового производителя процессора.</li> </ul> <p><strong>Ожидания от квалификации:</strong></p> <ul> <li>Знакомство с сетями передачи данных;</li> <li>Знания в области устройства операционных систем;</li> <li>Навыки программирования на одном из языков C/C++/bash/python.</li> </ul> <p><strong>Будет плюсом:</strong></p> <ul> <li>Знания в области устройства аппаратной части ПЭВМ;</li> <li>Интерес к сфере информационной безопасности;</li> <li>Желание связать свою профессию со всем вышеперечисленным.</li> </ul> <p><strong>Условия работы:</strong></p> <ul> <li>Обучение на реальных задачах и получение практического опыта работы в большой, сильной компании;</li> <li>Изучение технологий и получение знаний, которые не дают в ВУЗе;</li> <li>Работа в офисе в Санкт-Петербурге возле м. Чернышевская (только очный формат);</li> <li>Трудоустройство по договору ГПХ;</li> <li>Длительность стажировки 3,5 месяца (октябрь-февраль);</li> <li>20-ти часовая рабочая неделя, возможность совмещения с учебой в ВУЗе;</li> <li>Ежемесячная стипендия 35 000 руб.</li> </ul>",https://hh.ru/vacancy/68350238,68350238
Инженер-программист,Санкт-Петербург,13-я линия В.О.,"['Английский язык', 'CODESYS', 'Modbus', 'C/C++']",,,,Ленпромавтоматика,noExperience,fullDay,2022-09-01T13:39:27+0300,"<strong>Обязанности:</strong> <ul> <li>разработка, тестирование и сопровождение прикладного программного обеспечения для промышленных контроллеров WAGO I/O, FASTWEL I/O с использованием среды разработки CoDeSys (ST);</li> <li>конфигурирование и сопровождение SCADA-систем;</li> <li>написание сопроводительной документации к ПО и руководства пользователя;</li> <li>работа с графическими редакторами под Windows (отрисовка мнемосхем);</li> <li>работа с технической литературой.</li> </ul> <strong>Требования:</strong> <ul> <li>уверенный пользователь ПК;</li> <li>знание CoDeSys;</li> <li>написание скриптов на C/C++;</li> <li>знание промышленных сетевых интерфейсов (Modbus RTU, Modbus TCP/IP);</li> <li>программирование и создание интерфейсов HMI;</li> <li>знание английского языка на уровне чтения технической литературы</li> </ul> <p><strong>Условия:</strong></p> <ul> <li>40-часовая рабочая неделя (при производственной необходимости - оплата сверхурочных).</li> <li>Оплата больничного листа.</li> <li>Соцпакет (ДМС‚ накопительная пенсионная программа, спортзал).</li> <li>Корпоративные праздники в отличной компании.</li> <li>Заработная плата= оклад + премии по результатам проекта.</li> <li> </li> </ul>",https://hh.ru/vacancy/69087698,69087698
Инженер-программист встроенных систем,Санкт-Петербург,улица Маршала Говорова,"['Linux', 'ООП', 'C/C++', 'C++', 'Debian', 'Ubuntu Server']",,100000,RUR,Корпорация Оборонные технологии,noExperience,fullDay,2022-08-18T16:37:31+0300,"<p>АО НПП «Авиационная и морская электроника» занимается разработкой систем управления, связи, радиоэлектронной, радиотехнической и гидроакустической аппаратуры, оборудования информационно-телекоммуникационных сетей.</p> <p>Предприятие является ведущим российским производителем систем обработки и отображения информации радиоэлектронных систем различного назначения, устанавливаемых на объектах стационарного, корабельного и авиационного базирования.</p> <p> </p> <p><strong>Обязанности:</strong></p> <ul> <li>Разработка клиент-серверного приложения, обеспечивающего функционирование объектов морского транспорта.</li> <li> <p>Разработка программного обеспечения под ОС GNU Linux.</p> </li> </ul> <p><strong>Требования:</strong></p> <ul> <li>Знание стандартов С++ 11/14/17;</li> <li>Знание протоколов обмена данными TCP, UDP;</li> <li>Знание утилит qmake, cmake;</li> <li>Знание основ ООП;</li> <li>Базовые знания по работе в ОС семейства Linux (Debian, Ubuntu, Astra Linux);</li> <li>Умение писать чистый и понятный код;</li> <li>Умение документировать написанный код.</li> </ul> <p><strong>Условия:</strong></p> <ul> <li>Официальное оформление с первого дня работы.</li> <li>Режим работы: пн-пт с 8.30 до 17.00 или с 9.00 до 17.30.</li> <li>Полностью &quot;белая&quot; заработная плата, выплата на карту дважды в месяц без задержек.</li> <li>Местоположение офиса - ул. Маршала Говорова (территория завода &quot;Волна&quot;).</li> <li>Служебная развозка от ст.м. Кировский завод;</li> <li>Оплачиваемый отпуск 28 дней.</li> <li>Полис ДМС после одного года работы в компании.</li> <li>Корпоративный футбол.</li> </ul>",https://hh.ru/vacancy/54929033,54929033
Младший разработчик,,,[],40000,70000,RUR,Бизнес Технологии,noExperience,fullDay,2022-09-01T14:36:16+0300,"<p>Вакансия для начинающих разработчиков с небольшим или отсутствующим опытом работы. Мы всему Вас научим, от Вас требуется максимальная скорость освоения материала и высокая обучаемость.</p> <p><strong>Обязанности: </strong></p> <ul> <li>Реализация задач среднего уровня сложности по разработке комплексной корпоративной информационной системы под руководством разработчика</li> <li>Постоянный рост квалификации</li> </ul> <p><strong>Требования:</strong></p> <ul> <li>Понимание принципов структурного программирования, желательно теории реляционных баз данных.</li> <li>Приветствуется опыт работы с базами данных, знание языка запросов SQL.</li> <li>Понимания принципов объектно-ориентированного программирования, знание одного или нескольких языков высокого уровня (C++, pascal).</li> <li>Ответственность, самостоятельность, инициативность</li> <li>Коммуникабельность, умение и желание работать в команде</li> <li>Высокая обучаемость.</li> <li>Желательно знание Pl/sql, опыт работы с Oracle или PostgreSQL</li> <li>Просьба в заголовке письма указывать код вакансии: Project05</li> </ul> <p><strong>Условия:</strong></p> <ul> <li>Работа в стабильной, динамично развивающейся компании</li> <li>Комфортные условия труда</li> <li>Отсутствие формализма и бюрократии</li> <li>Обширные возможности для профессионального и карьерного роста</li> <li>Заработная плата по итогам собеседования</li> <li>Оформление по ТК, оплачиваемый отпуск согласно трудовому законодательству.</li> </ul>",https://hh.ru/vacancy/68570539,68570539
Математик-алгоритмист,Санкт-Петербург,набережная Обводного канала,"['Математическое программирование', 'C++']",,,,Котлин-Новатор,noExperience,fullDay,2022-09-01T09:33:03+0300,"<strong>Обязанности:</strong> <ul> <li> <p>Разработка алгоритмов программно-математического обеспечения для авиационных пилотажно-навигационных комплексов: решение задач по обработке (комплексированию) информации на основе методов оптимальной статистической фильтрации случайных процессов, решение задач построения оптимальных программ полета, решение задач навигации и управления (стабилизации движения), решение специальных задач;</p> </li> <li> <p>Разработка, согласование и сопровождение технической документации в области пилотажно-навигационных комплексов: логики и алгоритмов работы, методики проверки режимов комплекса, программы функционирования;</p> </li> <li> <p>Проведение математического моделирования работы режимов пилотажно-навигационных комплексов и имитация различных условий функционирования;</p> </li> <li> <p>Работа с различной документацией по эксплуатации пилотажно-навигационных комплексов, с описаниями входящих систем, с протоколами информационного взаимодействия, с комплексом правил и норм в соответствии с ГОСТ;</p> </li> <li> <p>Организация работы и ведение рабочей переписки с организациями соисполнителями;</p> </li> <li> <p>Участие в полунатурных и летных испытаниях при отработке и проверке задач комплексов;</p> </li> <li> <p>Участие в работах в рамках НИОКР..</p><br /><strong>Требования:</strong></li> </ul> <ul> <li> <p>Образование – высшее (математика, инженерные и технические науки), высокий средний балл;</p> </li> <li> <p>Аналитический склад ума;</p> </li> <li> <p>Наличие военного билета (для военнообязанных);</p> </li> <li> <p>Опыт - приветствуется;</p> </li> <li> <p>Свободное владение ПК (MS Office, MS Power Point, MS Visio);</p> </li> <li> <p>Уверенные знания теории обработки сигналов, теории вероятностей и математической статистики, дискретной математики;</p> </li> <li> <p>Базовые знания теории управления, теории устойчивости, теории алгоритмов;</p> </li> <li> <p>Базовые знания С/С++, Мatlab, Maple;</p> </li> <li> <p>Техническая грамотность и правильность письменной речи;</p> </li> <li> <p>Ответственность, обучаемость;</p> </li> <li> <p>Язык - английский базовый, английский технический.</p> </li> </ul> <strong>Условия:</strong> <ul> <li>Стабильная работа на крупном предприятии;</li> <li>Конкурентный уровень заработной платы;</li> <li>Оформление, предоставление льгот и гарантий в полном соответствии с ТК РФ;</li> <li>График работы: понедельник-пятница<br />с 8-00 до 16-30;</li> <li>Собственный бесплатный тренажерный зал;</li> <li>Наличие кафе на территории предприятия (доступные цены и разнообразное меню);</li> <li>Охраняемая авто и велопарковка;</li> <li>Современный офис;</li> <li>Работа в районе станции метро «Площадь Александра Невского» (наличие корпоративной развозки).</li> </ul>",https://hh.ru/vacancy/68502587,68502587
СV Engineer,,,"['Linux', 'C++', 'Python', 'Git', 'Mercurial']",,,,DSSL,noExperience,fullDay,2022-09-01T13:17:33+0300,"<p><strong>Наша команда разрабатывает систему видеонаблюдения Trassir.</strong></p> <p><strong>Это профессиональная программа для построения многоуровневых систем безопасности. В ней есть не только возможность управлять камерами и писать с них архив, но и огромное количество дополнительных возможностей. В рамках системы мы развиваем много проектов, связанных с видеоаналитикой, среди которых:</strong></p> <ul> <li> <p><strong>Межкамерный трекинг.</strong></p> </li> <li> <p><strong>Распознавание автомобильных номеров.</strong></p> </li> <li> <p><strong>Распознавание лиц.</strong></p> </li> <li> <p><strong>Общие задачи object detection.</strong></p> </li> <li> <p><strong>Аналитика поведения человека.</strong></p> </li> </ul> <p>В настоящий момент мы ищем СV Engineer Senior в нашу команду.</p> <p><strong>Кратко о том, что будет:</strong></p> <ul> <li> <p>Постановка задач по сбору и разметке данных и взаимодействие с командой разметки.</p> </li> <li> <p>Разработка и поддержка прототипов бизнес решений.</p> </li> <li> <p>Реализация различных решений в CV (детекция / распознавание объектов, трекинг, оптимизация моделей).</p> </li> <li> <p>Достижение заданных метрик качества в прототипах.</p> </li> <li> <p>Оптимизация скорости работы прототипов и inference моделей.</p> </li> </ul> <p><strong>Мы найдём общий язык, если у вас:</strong></p> <ul> <li> <p>Есть знание математики для понимания научных публикаций по CV.</p> </li> <li> <p>Есть опыт реализации подходов, описанных в научных публикациях.</p> </li> <li> <p>Есть опыт разработки CV систем.</p> </li> <li> <p>Есть способность довести сложную задачу до результата.</p> </li> <li> <p>Чистый и аккуратный код на python.</p> </li> <li> <p>Есть знания linux, git flow.</p> </li> <li> <p>Есть знание английского языка на уровне чтения статей.</p> </li> </ul> <p><strong>Будет плюсом:</strong></p> <ul> <li> <p>Знание С++.</p> </li> <li> <p>Опыт работы с npu.</p> </li> <li> <p>Знание ML/DL вне CV.</p> </li> <li> <p>Опыт работы с различными сенсорами камер (радары / лидары / мультиспектральные камеры).</p> </li> <li> <p>Наличие публикаций по смежным темам.</p> </li> </ul> <p><strong>Какие технологии мы используем:</strong></p> <ul> <li> <p>pytorch / numpy / opencv / sklearn</p> </li> <li> <p>onnruntime / tensorrt</p> </li> <li> <p>git / mercurial</p> </li> <li> <p>python / c++</p> </li> <li> <p>wandb</p> </li> </ul> <p><strong>Мы предлагаем:</strong></p> <ul> <li> <p>УДАЛЕННАЯ работа. При желании можно работать в уютном офисе с современным мощным оборудованием в Москве;</p> </li> <li> <p>Гибкий график работы (можно начинать работать в 12, если так лучше работается);</p> </li> <li> <p>Полностью белая заработная плата;</p> </li> <li> <p>Возможности роста и развития внутри компании (корпоративный университет);</p> </li> <li> <p>ДМС с первого рабочего дня.</p> </li> </ul> <ul> <li> <p>Достаточное количество железа для крупномасштабного обучения.</p> </li> <li> <p>Мощное железо для локальной разработки.</p> </li> <li> <p>Молодая и дружная команда .</p> </li> <li> <p>Открытость к изменениям любого рода и масштаба .</p> </li> </ul>",https://hh.ru/vacancy/67371228,67371228
