name,city,address,key_skills,sal_from,sal_to,currency,company,experience,schedule,published_at,description,alternate_url,id
Программист-разработчик игр (Senior),Санкт-Петербург,18-я линия Васильевского острова,"['Информационные технологии', 'Разработка компьютерных Игр']",4000,8000,USD,ГравиЛинк,moreThan6,flexible,2022-09-01T18:33:07+0300,"<p>Мы расширяем свою gamedev-команду и ищем заинтересованных программистов для разработки компьютерных игр под различные платформы на нашем собственном языке.</p> <p><strong>У нас вы получите возможность</strong>:<br />- получать зарплату по курсу 75 рублей за доллар, если биржевой курс опускается ниже 75, и по биржевому курсу, если он больше или равен 75<br />- применять все знания и опыт в сфере IT для разработки уникальных продуктов, которыми можно гордиться<br />- принимать архитектурные решения по создаваемым продуктам<br />- участвовать в полном цикле разработки и предлагать любые улучшения<br />- получать справедливую оплату, соразмерную вашему вкладу</p> <p><strong>Нам важно, чтобы вы</strong>:<br />- имели твёрдые фундаментальные знания математики и информационных технологий<br />- имели отличные знания и реальный опыт программирования на языке C, C++ или Rust (не в учебных проектах)<br />- имели отличные знания и опыт программирования для GPU (работы с шейдерами)<br />- имели опыт работы с базами данных, в том числе их проектирования<br />- хорошо ориентировались в сетевых технологиях и протоколах<br />- умели работать с системами контроля версий и ишью-трекерами<br />- хорошо понимали, во что превращается ваш код, и как он работает на низком уровне<br />- не боялись сложностей и получали удовольствие от решения нестандартных задач</p> <p><strong>Мы обрадуемся</strong>, если вы также имеете опыт/навыки работы с Unix, Android, web-программирования, знаете принципы построения компиляторов.</p> <p>У нас возможна удалённая работа по любому удобному вам графику.<br />Оплата производится не за количество проведённых за компьютером часов, а за завершённые задачи. Все задачи оцениваются перед выполнением.</p>",https://hh.ru/vacancy/51540865,51540865
Senior C++ developer,,,"['ООП', 'C++', 'C/C++', 'STL', 'Базы данных']",3000,4000,USD,Jing Technology,moreThan6,remote,2022-09-02T10:45:48+0300,"<p><strong>Обязанности:</strong></p> <ul> <li>Разработка и сопровождение компонентов многофункциональных кроссплатформенных приложений</li> <li>Техническое развитие продукта</li> <li>Сопровождение существующей кодовой базы</li> <li>Создание критически важных, высококачественных программных продуктов</li> </ul> <p><strong>Требования:</strong></p> <ul> <li>Свободное владение C++ (от 11 и выше, STL, Boost, Clang, MSVC)</li> <li>Глубокое понимание принципов ООП и принципов разработки программ</li> <li>Хорошее знание алгоритмов и шаблонов проектирования</li> <li>Опыт разработки многопоточных приложений</li> <li>Опыт разработки сетевых приложений (TCP, UDP, sockets, REST)</li> <li>Опыт работы и проектирования реляционных баз данных</li> <li>Владение основными средствами разработки и контроля версий</li> <li>Умение разобраться в чужом коде, умение работать в команде</li> <li>Умение и желание работать в команде, аккуратность, ответственность</li> <li>Нацеленность на долгосрочное сотрудничество</li> </ul> <p><strong>Преимущества работы в нашей компании:</strong></p> <ul> <li>Возможность развития своих навыков программирования</li> <li>Работа в команде профессионалов с опытом работы более 6 лет</li> <li>Работа идет только над собственной линейкой продуктов</li> <li>Возможность творческого подхода при решении поставленных задач</li> </ul> <p><strong>Условия:</strong></p> <ul> <li>remote, fulltime</li> </ul>",https://hh.ru/vacancy/68777079,68777079
С++ Developer,,,"['Английский язык', 'SQL', 'Linux', 'C++', 'Python']",5000,7000,USD,"Hi, Rockits!",moreThan6,fullDay,2022-08-16T18:59:35+0300,"<p>В поиске <strong>Senior С++ разработчика</strong> <strong>со знанием английского языка </strong>в международную инвестиционную компанию<strong> с возможностью релокации в страны присутствия</strong>.</p> <p>Компания занимается количественными инвестициями, строит систематические стратегии торговли на бирже инвестиций.<br /><br /><strong>Cтек:</strong> С++</p> <p><strong>Чем предстоит заниматься:</strong></p> <ul> <li>Создание программного обеспечения, позволяющего проводить крупномасштабные количественные исследования, которые управляют платформой компании.</li> </ul> <strong>Требования:</strong> <ul> <li> <p><strong>знание английского языка на уровне разговорного</strong>;</p> </li> <li>Опыт разработки крупномасштабных распределенных систем;</li> <li>Глубокое понимание структур данных и алгоритмов;</li> <li>Минимум 5 лет написания кода производственного качества на C++;</li> <li>Высокая самоорганизация;</li> </ul> <p><strong>Будет плюсом:</strong></p> <ul> <li>Разработка систем для управления и выполнения вычислений на крупномасштабных графических данных;</li> <li>Системы потоковой передачи / передачи данных;</li> <li>Планирование / оптимизация запросов;</li> <li>Теория языка программирования;</li> <li>Опыт разработки на Python также является плюсом;</li> <li>Кандидатам не обязательно иметь предыдущий опыт работы в сфере финансовых услуг;</li> </ul> <strong>Что предлагаем:</strong> <ul> <li> <p><strong>обязательную релокацию вас и вашей семьи в Армению</strong> (после испытательного срока в индивидуальном порядке может быть рассмотрена релокация в другие страны);</p> </li> <li> <p>возможность удаленной работы;</p> </li> <li> <p>конкурентоспособный компенсационный пакет, который включает годовые премии и ежегодное повышение заработной платы;</p> </li> <li> <p>гибкое начало рабочего дня;</p> </li> <li> <p>отпуск по уходу за ребенком, творческий отпуск после 5 лет работы;</p> </li> <li> <p>расширенный социальный пакет: медицинское страхование со стоматологией и страхование от рака для сотрудников и членов их семей, страхование жизни сотрудников, программа поддержки сотрудников и их родственников по психологическим, юридическим и финансовым вопросам;</p> </li> <li> <p>больничный – 100% от заработной платы, включая полную оплату отпуска по беременности и родам (140 дней), программа отпуска по уходу за ребенком до 3 недель для вторичных опекунов (отцов) со 100% оплатой;</p> </li> <li> <p>3 дополнительных дня отпуска в год;</p> </li> <li> <p>высокая корпоративная культура: регулярные тимбилдинги и корпоративы, ежемесячные командные обеды;</p> </li> <li> <p>культура непрерывного обучения: сертификация, онлайн- и офлайн-обучение, занятия английским языком, наставничество в профессиональном развитии.</p> </li> </ul>",https://hh.ru/vacancy/67972439,67972439
Инженер-программист АСУ ТП,,,"['C/C++', 'Схемотехника электронного оборудования', 'AVR', 'Разработка электросхем', 'Программирование микроконтроллеров', 'АСУ', 'Командная работа']",50000,150000,RUR,Невский,moreThan6,fullDay,2022-08-31T17:45:01+0300,"<strong>Обязанности:</strong> <ul> <li>Разработка и программирование промышленных контроллеров и составных частей АСУ ТП котельных установок;</li> <li>Совместная работа с инженерами-схемотехниками по разработке топологии новых устройств/приборов. Конфигурирование аппаратной части обвязки микроконтроллера;</li> <li>Разработка и отладка управляющих программ микроконтроллеров семейства AVR/STM. Тестирование устройств в рамках разработанного программного обеспечения;</li> <li>Сопровождение и поддержка разработанного программного обеспечения.</li> </ul> <strong>Требования:</strong> <ul> <li>Опыт работы с микроконтроллерами семейства AVR/STM не менее 5-ти лет. Уверенная работа с интерфейсами UART, RS-485 SPI, I2C, SDIO, USB, PWM;</li> <li>Высокий уровень владения языком C/C++. Умение писать высокопроизводительный код, с обеспечением возможности его сопровождения Заказчиком, а также разбираться и работать с кодом, предоставленным Заказчиком;</li> <li>знание аналоговой и цифровой схемотехники, практический опыт в цифровой обработке сигналов (навыки работы с устройствами релейной автоматики приветствуются);</li> <li>знание ЕСКД (умение работать со схемами электрическими принципиальными);</li> <li>уверенная работа с измерительными приборами: мультиметры, осциллографы, генераторы сигналов, в рамках отладки разработанных узлов АСУ ТП.</li> </ul> <strong>Условия:</strong> <ul> <li>Работа сдельная, условия оговариваются при собеседовании;</li> <li>График работы гибкий, занятость частичная;</li> <li>Трудоустройство согласно ТК РФ;</li> <li>Достойная оплата результатов работы.</li> </ul>",https://hh.ru/vacancy/68979220,68979220
Senior Gameplay Programmer (UE4),,,"['C++', 'Unreal Engine', 'Игровое ПО']",,,,Lesta Games,moreThan6,fullDay,2022-09-01T13:29:56+0300,"<p>Мы в <strong>Lesta Studio St.Petersburg</strong>, помимо флагманской игры World of Warships, ведем разработку новых игровых проектов в различных жанрах и для разных платформ, а также экспериментируем с инструментами и технологиями. Одна из команд в нашей студии занимается прототипированием <strong>нового кроссплатформенного ММО шутера</strong> в Sci-Fi сеттинге, в разработке которого используются движок Unreal Engine 4, С++ и Java. У нас амбициозные планы по дальнейшему развитию проекта, с чем нам может помочь <strong>Senior</strong> <strong>Gameplay Programmer</strong>.</p> <p> </p> <p><strong>Чем предстоит заниматься:</strong></p> <ul> <li>Реализация игровой логики для многопользовательской сессионной игры на базе Unreal Engine 4 с преимущественным использованием C++ (core геймплей, клиент-серверное взаимодействие, ИИ ботов и пр.);</li> <li>Поддержка и рефакторинг существующего кода с целью сохранения его простоты и сопровождаемости;</li> <li>Профилирование и оптимизация как по производительности, так и по сетевому трафику;</li> <li>Ревью кода других разработчиков;</li> <li>Взаимодействие с другими отделами (гейм дизайн, техарт, UI, бекэнд, анимации, эффекты).</li> </ul> <p> </p> <p><strong>Что для нас важно:</strong></p> <ul> <li>Хорошее знание и опыт программирования на C++;</li> <li>Понимание принципов реализации игровых механик и построения кода игровой логики;</li> <li>Большой опыт работы с Unreal Engine 4 и знание принципов его внутреннего устройства;</li> <li>Опыт разработки сетевых игр;</li> <li>Желание создавать игры и инициативность в плане привнесения своих идей, коммуникативность и открытость.</li> </ul> <p><strong>Приветствуется:</strong></p> <ul> <li>Увлечённость играми и богатый игровой опыт;</li> <li>Опыт работы с системами ИИ, анимации, звука, физики, интерфейсов;</li> <li>Опыт разработки игр для PC и консолей;</li> <li>Хорошее владение английским языком.</li> </ul> <p> </p> <p><strong>Что предлагаем:</strong></p> <ul> <li> <p>Заработную плату, которая учитывает официальный курс доллара США.</p> </li> <li> <p>Работу в аккредитованной IT – компании.</p> </li> <li>Работа в офисе в г. Санкт-Петербург. Мы поможем вам в релокации (проживание в корп.квартире, релокационный бонус).</li> <li>Расширенный полис ДМС.</li> <li>Спортзал и душевые в офисе, компенсация большей части стоимости годового абонемента сети спортклубов.</li> <li>Обучение: уроки английского языка в офисе; внутренние и внешние конференции, тренинги.</li> <li>Бесплатные завтраки и ужины, компенсация обедов.</li> <li>Релакс-зоны с массажными креслами Yamaguchi и топовыми кофемашинами.</li> <li>Мы тестируем наши продукты в игровых с мощным железом и приставками. Но если хотите размяться в офлайне, у нас есть настольный теннис, хоккей, баскетбол и кикер.</li> <li>Work-life balance: начало работы - с 9 до 10, окончание - с 18 до 19.</li> </ul> <p> </p>",https://hh.ru/vacancy/54876079,54876079
