name,city,address,key_skills,sal_from,sal_to,currency,company,experience,schedule,published_at,description,alternate_url,id
Team Lead C++,,,"['C/C++', 'Win32 Api', 'CMake', 'Git', 'Управление командой']",,,,Контур,moreThan6,fullDay,2022-08-24T08:58:42+0300,"<p><strong>О нас</strong></p> <p>Контур — экосистема продуктов для бизнеса. Мы создаем решения, которые сохраняют время, деньги и нервные клетки бизнесменам и их сотрудникам по всей стране.</p> <p>В группу компаний СКБ Контур входит «Атом Безопасность» — разработчик программ для защиты данных. Компания на рынке более 10 лет, является резидентом технопарка «Сколково».</p> <p>Флагманский продукт «Атом Безопасность» — платформа StaffCop.</p> <p>StaffCop обнаруживает угрозы и предотвращает утечку корпоративных данных, помогает расследовать инциденты с оборотом данных, стоит на страже коммерческой тайны и интеллектуальной собственности. StaffCop используют 11 000 компаний в 26 странах мира.</p> <p>Штаб-квартира расположена в новосибирском Академгородке.</p> <p>В компании работает более 60 человек. Отдел разработки состоит из нескольких команд, сейчас мы ищем C++-разработчика уровня Lead в команду Windows Агента.</p> <p><strong>О продукте</strong></p> <p>StaffCop Windows Агент — это системная служба, которая устанавливается на рабочие машины и фиксирует все действия, совершаемые пользователями. Например, пересылка файлов, отправка различных сообщений, посещения сайтов и т. п. Вся подобная телеметрия отправляется на серверы StaffCop.</p> <p>Кроме сбора телеметрии, агент реализует некоторые возможности DLP (data leak prevention) системы — блокировка USB-устройства, посещение сайтов, копирования файлов. Есть поддержка удаленного управления.</p> <p>Сам агент написан на C++, DLP-модуль на Rust.</p> <p><strong>Технологический стек</strong></p> <p>C/C++, WinAPI, CMake, git. Используем C++17.</p> <p><strong>Команда и процессы</strong></p> <p>Команда из 6 человек, распределенная. Сейчас ей управляет CTO.</p> <p>Раз в неделю — общий митинг на 1,5–2 часа.</p> <p>2 раза в год — релиз.</p> <p>Есть выделенная команда тестирования, а также планируем поиск системного аналитика.</p> <p><strong>Чем предстоит заниматься</strong></p> <ul> <li>Участвовать в развитии проекта:</li> </ul> <p>— Писать код: исправлять баги, реализовывать новые фичи.</p> <p>— Помогать с оценкой разработки новых фич, которые будут влиять на стратегию развития продукта.</p> <p>— Обеспечивать техническое качество.</p> <ul> <li>Управлять командой C++-разработчиков:</li> </ul> <p>— Поддерживать и развивать устоявшиеся процессы, а также внедрять новые.</p> <p>— Декомпозировать крупные задачи, распределять их между членами команды, контролировать выполнение.</p> <p>— Помогать команде в профессиональном развитии: периодически давать обратную связь по результатам работы, проводить оценку.</p> <p>— Участвовать в процессе найма и адаптации новых сотрудников.</p> <strong>Наши ожидания</strong> <ul> <li>Опыт разработки на C++ от 5 лет.</li> <li>Опыт управления командой от 1 года или готовность развиваться как тимлид.</li> <li>Опыт декомпозиции крупных задач.</li> <li>Понимание работы ОС Windows (процессы, файловая система, реестр, службы и т. д.).</li> <li>Широкий технический кругозор:</li> <li>Навыки CI/CD.</li> <li>Навыки автоматизации тестирования.</li> <li>Навыки разработки на других языках программирования.</li> </ul> <p><strong>Дополнительным плюсом будет</strong></p> <ul> <li>Опыт разработки в kernel-mode.</li> <li>Навыки reverse engineering.</li> <li>Знание языка Rust.</li> </ul> <p><em>Если ваш опыт не в полной мере соответствует нашим требованиям — некритично. Для нас важна готовность учиться:)</em></p> <strong>Условия работы</strong> <ul> <li>Трудоустройство в штат компании «Атом Безопасность».</li> <li>Оформление по ТК, полностью белая заработная плата.</li> <li>Уровень зарплаты зависит от ваших технических знаний и навыков.</li> <li>Можно выбрать офисный, гибридный или удаленный формат работы. Большая часть команды находится в московском часовом поясе. Готовы к удаленному сотрудничеству. Офис — г. Новосибирск, Академгородок, Технопарк.</li> <li>Гибкие рабочие часы (нам важна выполненная задача, а не работа с 09:00 до 18:00).</li> <li>ДМС и частичная компенсация занятий спортом после испытательного срока.</li> <li>Чай, кофе, сладости, фрукты для сотрудников.</li> <li>Новогодние подарки для детей сотрудников и сотрудников.</li> <li>Корпоративные мероприятия.</li> </ul> <p>Присоединяйтесь:)</p>",https://hh.ru/vacancy/69114916,69114916
Senior C++ Browser Engineer (relocation to EU),,,"['Chromium', 'C++']",,,,Hunt For You,moreThan6,fullDay,2022-08-29T16:07:40+0300,"<p><strong>About the product:</strong></p> <ul> <li>Chromium-based desktop and Android browser with privacy protection</li> <li>Other services include search, VPN and second phone apps with data security</li> </ul> <p><strong>About the team:</strong></p> <ul> <li>Professional team of experienced developers</li> <li>International team: <ul> <li>Head office - US</li> <li>Developers - EU (Germany, France, Ireland)</li> </ul> </li> </ul> <p><strong>The technologies:</strong></p> <ul> <li>Chromium, C++, Javascript, Python</li> <li>Windows, MacOS, Android, Jenkins, AWS</li> </ul> <p><strong>Responsibilities:</strong></p> <ul> <li>Develop features and improvements to the core browser product</li> <li>Improve anti-fingerprinting functions, synchronization features</li> <li>RnD tasks to research new features added to Chromium</li> <li>Be ready to work on different parts of the product</li> </ul> <p><strong>Requirements:</strong></p> <ul> <li>5+ years of experience in desktop application development (C++)</li> <li>Commercial experience with Chromium</li> <li>Experience working with large codebase</li> <li>B.Sc. or M.Sc. in Computer Science</li> <li>Fluent English</li> </ul> <p><strong>We offer</strong></p> <ul> <li>Official employment contract in Germany/France/Ireland</li> <li>Remote or hybrid format of work in these countries</li> <li>Relocation support: 2 months of rent</li> <li>Flexible work schedule</li> <li>Annual offsite teambuilding</li> </ul>",https://hh.ru/vacancy/69271492,69271492
Senior C++ developer/Старший инженер-программист С++,,,"['Linux', 'C/C++', 'Algorithms', 'Data Structures', 'multithreading']",,,,YADRO,moreThan6,remote,2022-08-05T17:43:10+0300,"<p>Мы активно расширяемся и в связи с этим открываем поиск <strong>Senior C++ developer</strong> в Департамент разработки подсистем обработки данных (СХД) TATLIN.</p> <p>СХД TATLIN - это программно-аппаратные комплексы, спроектированные и произведенные в России. За достаточно короткое время (с момента создания компании прошло всего 8 лет) СХД TATLIN составили достойную конкуренцию крупным мировым производителям СХД. Безусловно это было бы невозможно без активного использования open-source решений. Но в отличии от многих других компаний мы не только их используем, но и сами активно контрибьютим.</p> <p><strong><em>Чем Вам предстоит заниматься:</em></strong></p> <ul> <li>Разработкой высокопроизводительных data path, control/management path, уровня data protection и кластерных компонентов для системы хранения данных;</li> <li>Разработкой эффективных алгоритмов и структур данных для симметричного active-active кластера;</li> <li>Разработкой высокопроизводительных алгоритмов преобразования данных и алгоритмов уменьшения избыточности данных;</li> <li>Исследованием и решением проблем, связанных с производительностью и стабильностью;</li> <li>Разработкой механизмов репликации данных.</li> <li>Настройкой и доработкой различных подсистем ядра Linux, продвижением наработок в mainline ядра.</li> </ul> <p><strong><em>Мы ожидаем от будущего члена команды:</em></strong></p> <ul> <li>Понимание устройства современных компьютеров и операционных систем в целом;</li> <li>Знание С и C++11/14/17;</li> <li>Отличное понимание как устроен Linux и Linux/POSIX API;</li> <li>Опыт анализа производительности отдельных приложений и системы в целом;</li> <li>Умение тестировать собственный код;</li> <li>Опыт написания многопоточных и/или асинхронных программ.</li> </ul> <p>Также необходимо быть знакомым с классическими алгоритмами и структурами данных.</p> <p><strong><em>Будет плюсом:</em></strong></p> <ul> <li>Наличие опыта разработки модулей ядра или опыт системного программирования.</li> </ul> <p><em><strong>Мы предлагаем:</strong></em></p> <ul> <li>Стать частью амбициозной продуктовой компании, вносящей вклад в мировое инженерное сообщество, а также ежегодно увеличивающей долю рынка и финансовые показатели;</li> <li>Гибридный формат работы: рабочее место в комфортном лофт-офисе на территории БП «Полюстрово» в 10-15 минутах от ст. метро Площадь Ленина/Новочеркасская + удалённая работа из дома на корпоративном ноутбуке;</li> <li>Конкурентный уровень заработной платы (готовы по достоинству оценить ваши знания и опыт) + премирование по результатам работы.</li> </ul>",https://hh.ru/vacancy/66636229,66636229
Software engineer (C/C++)/ Инженер-разработчик C/C++ (Network OS),Санкт-Петербург,Свердловская набережная,"['Linux', 'Python', 'C/C++', 'Unix']",,,,YADRO,moreThan6,fullDay,2022-08-08T00:15:48+0300,"<p>R&amp;D центры YADRO находятся в Москве, Санкт-Петербурге и Нижнем Новгороде, производственная площадка расположена в Московской области и строится завод полного цикла. На текущий момент нас уже более 1200 человек, и мы продолжаем активно расти и расширять команду.</p> <p>Недавно мы запустили новое продуктовое направление, а именно собственную разработку полного цикла ethernet-коммутаторов промышленного назначения и в связи с этим открываем поиск Software engineer (C/C++) в Департамент сетевых технологий.</p> <p><em><strong>Чем предстоит заниматься:</strong></em></p> <ul> <li>Разработкой встроенного программного обеспечения сетевых коммутаторов;</li> <li>Проводить анализ программных решений с открытым кодом из предметной области.</li> </ul> <p>Подразумевается совместная работа с командами: разработчиков NOS, командой аппаратной разработки.</p> <p><em><strong>Мы ожидаем от будущего члена команды:</strong></em></p> <ul> <li>C, C++ (1998/2003);*</li> <li>Python;</li> <li>Знание Linux и опыт разработки приложений под неё;</li> <li>Опыт работы с Docker контейнерами.</li> </ul> <p><em>* </em>разработка в проекте идёт на этом стандарте</p> <p><em><strong>Дополнительно приветствуем:</strong></em></p> <ul> <li>Курсы/сертификация Cisco CCNA/Avaya APDS/Juniper JNCIA/etc.;</li> <li>Практический опыт работы с сетевым оборудованием Cisco/Avaya/Juniper/Arista;</li> <li>Знание p4 language;</li> <li>Опыт работы с SONiC NOS;</li> <li>Знание сетевых протоколов;</li> <li>Знание и практическое использование инструментов тестирования/диагностики сетевых устройств: ping, traceroute, tcpdump, wireshark, iperf и т.д.;</li> <li>Знание и/или опыт работы: с адресацией/маршрутизацией трафика, включая протоколы динамической маршрутизации, фильтрацией трафика (ACL), управления трафиком (SDN, OpenFlow).</li> </ul> <p><em><strong>Будем рады предложить:</strong></em></p> <ul> <li>Конкурентный уровень заработной платы (готовы по достоинству оценить ваши знания и опыт) + премирование по результатам работы;</li> <li>Гибридный формат работы: рабочее место в комфортном лофт-офисе на территории БП «Полюстрово» в 10-15 минутах от ст. метро Площадь Ленина/Новочеркасская + удалённая работа из дома на корпоративном ноутбуке;</li> <li>Возможность расти горизонтально и вертикально, а также в зависимости от результатов и интересов перемещаться между проектами и командами.</li> </ul>",https://hh.ru/vacancy/67623283,67623283
C++ Team Lead,,,"['Golang', 'Python', 'Git', 'Linux', 'Английский язык']",,,,Scalable Solutions,moreThan6,fullDay,2022-08-08T16:49:44+0300,"<p><em>Scalable Solutions – международная технологическая компания, которая разрабатывает глобальные финтех решения и биржевые продукты с 2013 года. За это время мы собрали сильную команду из 160 инженеров, чемпионов мира по программированию и разработчиков высоконагруженных систем, став ведущим технологическим провайдером в отрасли.</em></p> <p><em>Наши продукты ежедневно используют миллионы пользователей из 200+ стран, а центры разработки Scalable Solutions находятся в России, Швейцарии, Великобритании, США, Испании, Грузии, Индонезии, на Кипре и в других странах.</em></p> <p><em>Присоединяйтесь к сильной команде в самой драйвовой из высокотехнологичных отраслей.</em></p> <p><strong>Обязанности:</strong></p> <ol> <li> <p>Организация работ по выполнению продуктовых фичей</p> <ol> <li> <p>разработка новых торговых инструментов для спотовой и деривативной торговли</p> </li> <li> <p>развитие моделей оценки биржевых рисков</p> </li> <li> <p>сопровождение и рефакторинг существующих решений</p> </li> </ol> </li> <li> <p>Написание детальных технических требований на разработку в Jira и распределение задач внутри команды</p> </li> <li> <p>Ревью архитектурных решений и кросс командное ревью кода</p> </li> <li> <p>Развитие команды и повышения ее КПД</p> </li> <li> <p>Проведение собеседований и онбординг новых сотрудников</p> </li> <li> <p>Написание кода на С++, Go и Python</p> </li> </ol> <p> </p> <p><strong>Требования:</strong></p> <ol> <li> <p>Профессиональное владение С++ не менее 14-го стандарта</p> </li> <li> <p>Знание современных паттернов проектирования многокомпонентных систем.</p> </li> <li> <p>Опыт проектирования и разработки распределенных и высоконагруженных систем.</p> </li> <li> <p>Опыт применения асинхронного и многопоточного программирования.</p> </li> <li> <p>Опыт коммерческой разработки ПО от 7-ми лет</p> </li> <li> <p>Опыт работы с Linux</p> </li> <li> <p>Опыт использования реляционных баз данных</p> </li> <li> <p>Опыт использования Git</p> </li> <li> <p>Уровень английского языка - не ниже Intermediate (предстоит руководить интернациональной командой)</p> </li> </ol> <p> </p> <p><strong>Дополнительные плюсы:</strong></p> <ol> <li> <p>Понимание механизмов биржевой торговли, в т.ч. торговли фьючерсами и опционами</p> </li> <li> <p>Опыт программирования на Python и GoLang</p> </li> <li> <p>Навыки анализа сетевого трафика</p> </li> </ol>",https://hh.ru/vacancy/55557189,55557189
"Senior С++/UE Game Developer (remote, USD)",,,"['C++', 'Unreal Engine']",,,,Hunt For You,moreThan6,remote,2022-08-05T12:48:12+0300,"<p><strong>Что за компания?</strong></p> <ul> <li>команда ветеранов игровой индустрии, работавшая над такими хитами как League of Legends, Far Cry 5, Hunt: Showdown, Call of Duty: Modern Warfare</li> </ul> <p><strong>Что за продукт?</strong></p> <ul> <li>онлайн-шутер от первого лица для PC/Xbox/PS5 с P2P монетизацией (рынок - Европа/США)</li> </ul> <p><strong>Стек проекта:</strong></p> <ul> <li>C++, Unreal Engine</li> </ul> <p><strong>Что предстоит делать:</strong></p> <ul> <li>разработка клиентской и серверной частей игры</li> <li>интеграция UI и клиент-серверных коммуникаций</li> <li>реализация игровых механик</li> <li>поддержка и модернизация игровых утилит</li> </ul> <p><strong>Что мы предлагаем:</strong></p> <ul> <li>оформление контракта ИП с компанией (США), зп в USD</li> <li>удалённая работа в русскоязычной команде</li> <li>компенсация расходов на ДМС, оплачиваемые отпуска и больничные</li> <li>помощь с самостоятельной релокацией (релокационный бонус)</li> <li>гибкий график работы по календарю страны проживания</li> </ul> <p><strong>Что мы ожидаем:</strong></p> <ul> <li>опыт индустриальной разработки и оптимизации сетевых игр на С++ от 5 лет</li> <li>хорошее знание архитектуры Unreal Engine и принципов его работы</li> <li>понимание паттернов ООП</li> <li>опыт работы c реляционными базами данных</li> <li>знание английского</li> <li>опыт работы в распределенной команде</li> <li>любовь к играм</li> <li>наличие ИП с валютным счетом или готовность его оперативно открыть</li> <li>портфолио успешных проектов</li> </ul>",https://hh.ru/vacancy/68513010,68513010
C# Algorithm Developer,,,"['Python', 'Mathematical Statistics', 'C#', '.NET Framework', 'Fluent English', 'Multithread Programming', 'algo Trading']",1000,5000,USD,Thirdeye Incorporation,moreThan6,fullDay,2022-08-10T10:36:27+0300,"<strong>Responsibilities:</strong> <ul> <li>Ability to design and implement trading systems with low latency and high throughput</li> <li>Expertise developing scalable and performance-oriented applications</li> <li>Develop complex code based on functional specifications; complete logic and algorithm design in alignment</li> <li>Test code to verify it meets the technical specifications and is working as intended</li> <li>Create and apply automated tests and test principles to software changes, including (but not limited to) unit tests</li> <li>Understand business, application, and coding tasks to make recommendations for internal process improvements and product documentation</li> </ul> <strong>Requirements:</strong> <ul> <li> <p>Bachelor&#39;s degree Engineering or Computer Science</p> </li> <li> <p>3-10 yrs Experience of algorithm and software design</p> </li> <li> <p>Significant experience in Java/ C++, C#, Python.</p> </li> <li> <p>Knowledge of Statistics and quantitative Modeling.</p> </li> </ul> <p> </p>",https://hh.ru/vacancy/68639182,68639182
