name,city,address,key_skills,sal_from,sal_to,currency,company,experience,schedule,published_at,description,alternate_url,id
Ведущий инженер-электроник,Санкт-Петербург,Тихорецкий проспект,"['Altium Designer', 'Схемотехника электронного оборудования', 'ГОСТ', 'Проектирование', 'робототехника', 'системы управления', 'электропривод', 'STM32', 'Миландр', 'Keil', 'C/C++', 'CAN', 'RS-485', 'SPI', 'Ethernet']",100000,120000,RUR,ЦНИИ РТК,moreThan6,fullDay,2022-08-30T17:41:16+0300,"<p><strong>Обязанности:</strong></p> <ul> <li>Разработка электронных узлов робототехнических комплексов в САПР Altium Designer (схемы, трассировка плат)</li> <li>Взаимодействие с конструкторами, программистами, опытным производством, технологами, отделом нормоконтроля</li> <li>Сопровождение заказа компонентов и монтажа плат</li> <li>Макетирование, отладка, настройка электронных узлов</li> <li>Участие в написании инструкций, пояснительных записок, отчетов по НИР</li> <li>Оформление конструкторской документации (схемы Э3,Э4) по ГОСТ</li> <li>Разработка встраиваемого ПО</li> </ul> <p><strong>Требования:</strong></p> <ul> <li>ПО: Altium Designer, Keil, Linux, Git, MultiSIM, Ltspice,Pspice</li> <li>Опыт работы инженером-электроником от 5 лет</li> </ul> <p>Приветствуется:</p> <ul> <li>Опыт самостоятельной разработки электронных устройств</li> <li>Опыт работы с отечественной компонентной базой</li> <li>Опыт программирования микроконтроллеров Миландр, STM32</li> </ul> <p><strong>Условия:</strong></p> <ul> <li>График работы: пятидневка, с 9-18 ч.</li> <li>Оформление по ТК, социальный пакет (ДМС, участие в корпоративных мероприятиях</li> <li>Столовая на территории организации</li> <li>Стабильность</li> </ul> <p> </p>",https://hh.ru/vacancy/66517100,66517100
Инженер-программист (конструктор) микроконтроллеров,Санкт-Петербург,улица Ворошилова,"['C/C++', 'Altium Designer', 'ЕСКД']",,,,"ТАЙПИТ, Торгово-промышленная группа",moreThan6,fullDay,2022-08-29T17:59:56+0300,"<p>Одно из крупнейших наукоемких направлений холдинга - компания «ТАЙПИТ – ИЗМЕРИТЕЛЬНЫЕ ПРИБОРЫ» приглашает к сотрудничеству <strong>ИНЖЕНЕРА-ПРОГРАММИСТА (КОНСТРУКТОРА) МИКРОКОНТРОЛЛЕРОВ</strong></p> <p>ТАЙПИТ - ИЗМЕРИТЕЛЬНЫЕ ПРИБОРЫ - это ведущий разработчик и поставщик счётчиков электрической энергии для России и стран СНГ. Порядка 15 лет компания предлагает высокотехнологичные решения для управления и оптимизации потребления энергоресурсов.</p> <p>Уникальные разработки опытно-конструкторского бюро, собственная производственная база, отлаженная логистическая деятельность позволяют компании успешно реализовывать поставленные задачи по разработке и внедрению в области энергетического комплекса.</p> <p><strong>Задачи:</strong></p> <ul> <li>Разработка измерительных приборов, модемов на базе микроконтроллеров</li> <li>Разработка схем ЭП и ПО на языке C/C++</li> </ul> <strong>Наши ожидания:</strong> <ul> <li>Хорошие знания архитектуры микроконтроллеров (МК с ядром RISC V, Cortex)</li> <li>Знание электроники и требований ЕСКД</li> <li>Уверенное владение CAD Altium Designer, С/С++</li> <li>Навыки разработки ПО протоколов обмена по различным интерфейсам</li> </ul> <strong>Условия:</strong> <ul> <li>Трудоустройство и заработная плата с соблюдением всех норм ТК РФ</li> <li>Социальный пакет</li> <li>Интересные задачи и возможность профессионального развития</li> <li>Возможность обучения в рамках корпоративного университета</li> <li>Комфортный офис в районе ст. метро Проспект Большевиков</li> <li>График работы: 9.00-18.00 (будни)</li> </ul>",https://hh.ru/vacancy/68242154,68242154
Senior Golang developer Managed Kubernetes в Yandex Cloud,,,"['Linux', 'Kubernetes', 'Golang']",,,,Яндекс,moreThan6,fullDay,2022-08-29T09:49:16+0300,"<p>Наша команда разрабатывает инструменты и сервисы для экосистемы Kubernetes в Яндекс.Облаке: платформу для управления managed-кластерами Kubernetes и интеграции ресурсов Облака с моделью K8s. В первую очередь нам нужны люди, способные самостоятельно вникать в новые области, решать сложные инженерные задачи, придумывать и реализовывать идеи развития продукта. Работа над стеком Kubernetes — это возможность погрузиться в одну из самых динамично развивающихся на сегодняшний день opensource-систем, которая за несколько лет де-факто стала стандартом в области контейнеризации.</p> <p>Что нужно делать:</p> <ul> <li>работать над нашей платформой и улучшать ее;</li> <li>контрибьютить в ядро Kubernetes или в код opensource плагинов — интеграций с Yandex Coud.</li> </ul> <p>Мы ждем, что вы:</p> <ul> <li>работали с облачными технологиями;</li> <li>эксплуатировали или использовали Kubernetes;</li> <li>работали с сетевым стеком Linux и с технологиями контейнеризации в Linux (Docker, containerd, Rocket, LXC и пр.);</li> <li>знаете один или несколько компилируемых языков программирования (C++, Java, Kotlin, Go и др.);</li> <li>обслуживали большие сервисы.</li> </ul> <p> </p>",https://hh.ru/vacancy/68658749,68658749
Senior fullstack developer (Node.js),,,"['JavaScript', 'Node.js', 'TypeScript']",,,,Яндекс,moreThan6,flexible,2022-08-29T09:49:05+0300,"<p>Мы ищем специалиста, готового участвовать в создании инструментов и инфраструктуры для разработчиков интерфейсов Яндекса. Задача нашей команды — чтобы разработчикам было удобно заниматься своим главным делом и не приходилось отвлекаться.</p> <p>Например, мы настраиваем непрерывную интеграцию, разрабатываем инструменты для статического анализа кода и создаем новые инструменты тестирования. Наши основные языки разработки — это TypeScript/JavaScript (Node.js) и Python (в соотношении 9 : 1). Некоторые инструменты (например, hermione) мы разрабатываем в open source на GitHub. Их используют в том числе команды за пределами Яндекса. Инфраструктура для автоматизации сборки, тестирования и развертывания кода, которую мы создаем, работает на сотнях серверов под высокой нагрузкой. Например, мы умеем выполнять тысячи тестов верстки в свыше десяти браузеров (в том числе мобильных) за 5–10 минут.</p> <p>Рассмотрим и состоявшихся разработчиков на TypeScript/JavaScript и Python, и тех, кто готов освоить и профессионально использовать эти языки.</p> <p><strong>Что нужно делать:</strong></p> <ul> <li>создавать, поддерживать и развивать инструменты для разработчиков, тестировщиков и менеджеров;</li> <li>развивать систему непрерывной интеграции и непрерывного развертывания;</li> <li>развивать инфраструктуру для автоматизированного тестирования;</li> <li>заниматься поддержкой и оркестрацией серверов;</li> <li>создавать инструментарий для тестирования производительности сервисов.</li> </ul> <p><strong>Мы ждем, что вы:</strong></p> <ul> <li>занимались разработкой программного обеспечения не меньше двух лет;</li> <li>знаете TypeScript, JavaScript и Python или готовы их изучить;</li> <li>знаете классические алгоритмы и структуры данных;</li> <li>имеете представление об автоматизации процессов (например, умеете заметить в собственной работе повторяющиеся действия и написать инструмент для их автоматического выполнения);</li> <li>знаете английский язык на уровне чтения документации;</li> <li>владеете Unix shell и скриптовыми языками;</li> <li>стремитесь и умеете изучать новые технологии и языки;</li> <li>ответственны, самостоятельны, внимательны к деталям;</li> <li>способны и хотите работать в команде.</li> </ul> <p><strong>Будет плюсом, если вы:</strong></p> <ul> <li>имеете собственные разработки в open source;</li> <li>умеете работать с системами контроля версий (в первую очередь Git);</li> <li>знаете CSS, HTML;</li> <li>разрабатывали на одном из языков: C++, Python, Go, Java;</li> <li>знаете и применяете на практике паттерны проектирования;</li> <li>проектировали распределенные вычислительные системы.</li> </ul>",https://hh.ru/vacancy/68580928,68580928
Project Manager,Санкт-Петербург,Невский проспект,[],,,,МойОфис,moreThan6,fullDay,2022-08-24T17:23:58+0300,"<p>Мы делаем собственный продукт с нуля, следим за стандартами качества кода. В команде дружественная и демократичная атмосфера, мы поддерживаем традиции проектной взаимопомощи. Творческие навыки в принятии нестандартных решений — максимально приветствуются. Мы придерживаемся принципа — «хороший результат всегда важнее формальных правил».</p> <p><strong>Обязанности:</strong></p> <ul> <li>контроль и координация всех этапов реализации проекта;</li> <li>выработка процедуры взаимодействия между группами разработки;</li> <li>декомпозировать функциональность вместе с владельцем продукта и командой разработки, составлять ТЗ, управлять задачами в Jira;</li> <li>формирование плана релизов и процесса контроля их качества;</li> <li>планирование своей работы и работы команды, формирование и поддержка актуальности роадмапа, контроль сроков;</li> <li>налаживать процесс написания и поддержки актуальности проектной документации;</li> <li>общаться с другими отделами разработки и продуктовыми командами;</li> <li>управление командой разработки.</li> </ul> <p><strong>Требования:</strong></p> <ul> <li>понимание полного цикла разработки программного обеспечения;</li> <li>знание метрик оценки работы команды;</li> <li>опыт управления и мотивации команды от 10 человек;</li> <li>технический бэкграунд будет большим плюсом;</li> <li>умение брать ответственность на себя, планировать и соблюдать сроки;</li> <li>аналитический склад ума, умение структурировать и формализовать запросы;</li> <li>коммуникабельность, вежливость, доброжелательность;</li> <li>желательно в прошлом иметь личный опыт программирования на любом языке из С++/Java/Go (лично программировать на проекте не нужно, нужно общее понимание особенностей подобной разработки).</li> </ul> <p><strong>Условия:</strong></p> <ul> <li>возможность работать в стабильной продуктовой компании, крупном, постоянно развивающемся проекте с нетривиальными задачами;</li> <li>современные подходы к архитектуре и технологический стек;</li> <li>наличие сложных RnD проектов;</li> <li>гибкость процессов и разработка по Agile (Scrum);</li> <li>комфортная среда и экспертная команда - мы открыты к обсуждениям и обратной связи, ценим поддержку и деликатность в общении, а работа в команде профессионалов помогает постоянно наращивать свою экспертизу;</li> <li>возможность предлагать свои идеи и влиять на результат;</li> <li>профильные курсы, корпоративный английский, участие в конференциях (в том числе спикером, если есть желание и готовность);</li> <li>приятный социальный пакет – ДМС со стоматологией, оплачиваемое питание, завтраки и перекусы в офисе, скидки от партнеров, спортивное приложение для тренировок;</li> <li>офис в историческом центре города (5 мин. от ст. м. Маяковская);</li> <li>гибкий подход к организации дня, релокация.</li> </ul>",https://hh.ru/vacancy/69143926,69143926
Архитектор безопасности ОС Аврора,,,"['Linux', 'C/C++', 'C++', 'ARM', 'SE linux', 'penetration', 'fuzzing']",,,,Открытая мобильная платформа,moreThan6,fullDay,2022-08-24T13:51:27+0300,"<strong>Обязанности:</strong> <ul> <li> <p>Разработка архитектуры безопасности ОС Аврора</p> </li> <li> <p>Определение требований безопасности к компонентам ОС</p> </li> <li> <p>Участие в составлении дорожных карт продуктов</p> </li> <li> <p>Сопровождение полного цикла разработки ПО с целью выявления векторов атак и внесения предложений по их устранению</p> </li> <li> <p>Описание моделей угроз для продуктов, подсистем и компонентов</p> </li> <li> <p>Тестирование дистрибутива на наличие уязвимостей, обработка инцидентов безопасности</p> </li> <li> <p>Внедрение и контроль исполнения практик безопасной разработки</p> </li> <li> <p>Проектирование решений, связанных с аутентификацией, авторизацией и шифрованием</p> </li> <li> <p>Анализ трендов развития стандартов безопасности и внедрение новых подходов</p> </li> </ul> <strong>Требования:</strong> <ul> <li> <p>Знание механизмов безопасности современных мобильных операционных систем</p> </li> <li> <p>Понимание возможных векторов атак на мобильное устройство</p> </li> <li> <p>Знание механизмов изоляции и контейнеризации приложений (DAC, MAC, SELinux, firejail, seccomp и т.п.)</p> </li> <li> <p>Понимание механизма разграничения разрешений приложений (permissions)</p> </li> <li> <p>Знание механизмов защиты ядра Linux</p> </li> <li> <p>Понимание механизма доверенной загрузки ОС</p> </li> <li> <p>Знание аппаратных механизмов безопасности</p> </li> <li> <p>Понимание принципов работы механизмов аутентификации</p> </li> <li> <p>Базовые занния прикладной криптографии</p> </li> <li> <p>Опыт исправления и тестирования CVE</p> </li> <li> <p>Опыт статического и динамического анализа, fuzzing-тестирования кода</p> </li> <li> <p>Опыт системного программирования под Linux: от 5-ти лет.</p> </li> </ul> <p><strong>Будет плюсом: </strong></p> <ul> <li> <p>Знание средств защиты сетевего взаимодействия</p> </li> <li> <p>Понимание возможностей компилятора для противодействия эксплуатации уязвимостей в userspace</p> </li> <li> <p>Понимание принципов работы технологии ARM Trustzone</p> </li> <li> <p>Понимание принципов работы протоколов авторизации и аутентификации</p> </li> <li> <p>Опыт тестирования на проникновение (penetration testing)</p> </li> <li> <p>Опыт работы с Qt</p> </li> <li> <p>Опыт написания модулей безопасности Linux (LSM)</p> </li> </ul> <p><strong>Условия:</strong></p> <ul> <li>Конкурентный уровень заработной платы (обсуждается с успешным кандидатом)</li> <li>Современное оборудование рабочего места</li> <li>Работа в команде профессионалов высокого уровня с возможностью карьерного и профессионального роста</li> <li>Гибкий рабочий график 5/2</li> <li>ДМС</li> <li>Отсутствие дресс-кода</li> <li>Возможность влиять на проект хорошими идеями и видеть свой вклад в конечном продукте</li> <li>Возможность обучения за счёт компании</li> <li>Возможность участия в конференциях за счёт компании</li> </ul>",https://hh.ru/vacancy/69133091,69133091
