name,city,address,key_skills,sal_from,sal_to,currency,company,experience,schedule,published_at,description,alternate_url,id
Программист C (Linux),Санкт-Петербург,Петроградская наб.,"['Linux', 'embedded', 'C/C++', 'встроенное ПО', 'Multithread Programming', 'Embedded Linux']",,,,Супертел,moreThan6,fullDay,2022-09-01T14:15:19+0300,"<p><strong>ОАО &quot;СУПЕРТЕЛ&quot;</strong> - уникальное Российское предприятие, которое самостоятельно разрабатывает и производит современное оборудование проводной (оптической) связи по технологиям OTN, IP, SDH, DWDM; на сегодня в производстве находится порядка 20 типов оборудования.</p> <p>Для участия в разработке нового оборудования неспешно ищем <strong>опытного</strong> программиста.</p> <p><strong>Должностные обязанности:</strong></p> <ul> <li>Работа в команде опытных специалистов</li> <li>Участие в разработке современного и перспективного оборудования проводной (оптической) связи</li> <li>Разработка системного и прикладного ПО (Embedded Linux) для телекоммуникационного оборудования</li> <li>Сопровождение и отладка разработанного ПО</li> </ul> <p><strong>Обязательные требования:</strong></p> <ul> <li>Опыт разработки на C не менее 3-х лет</li> <li>Разработка многопоточных приложений и понимание применения объектов синхронизации (mutex, semaphores, etc.)</li> <li>Знание средств разработки и отладки (gcc, gdb, Makefile, CMake, Shell scripting, etc.)</li> <li>Знание систем контроля версий git или mercurial</li> <li>Умение разбираться в чужом коде</li> <li>Чтение технической документации на английском языке</li> <li>Желание самостоятельно решать сложные задачи</li> <li><strong>Дополнительным преимуществом для Вас будут:</strong></li> <li>Умение писать код с минимальной избыточностью</li> <li>Опыт разработки драйверов для Linux</li> <li>Опыт работы с системой сборки Yocto/OpenEmbedded</li> <li>Опыт работы с процессорами архитектуры PowerPC, ARM</li> <li>Опыт разработки ПО для микроконтроллеров</li> <li>Опыт работы с RTOS</li> <li>Опыт работы с аппаратными отладчиками JTAG</li> <li>Опыт работы с сетевым оборудованием (L2/L3) либо оборудованием связи</li> </ul> <p><strong>Мы предлагаем:</strong></p> <ul> <li>Достойную &quot;белую&quot; заработную плату (уточняется в зависимости от Ваших знаний и опыта по результатам собеседования)</li> <li>Оформление по трудовому кодексу</li> <li>Работу с использованием передовых технологий</li> <li>Карьерный и профессиональный рост</li> <li>Полис ДМС + льготное страхование для членов семьи</li> </ul> <p>Приветствуется Ваше резюме с описанием опыта работы и, если есть, примеры кода, разработанного Вами (либо ссылка на него, если он есть в открытом доступе).</p> <p>Поскольку работа сложная, а требования к соискателю высокие - перед собеседованием <strong>обязательно</strong> потребуется выполнить <em>тестовое задание</em>:</p> <p>Простите за последующий длинный текст - этот сайт перестал поддерживать ссылки на внешние ресурсы :(</p> <p><strong>Тестовое задание и условия его выполнения:</strong></p> <p>Тестовое задание должно быть выполнено на «голом» C под Linux.</p> <p>Технологии и языки, применяемые для web|desktop (типа python и CGI) использовать нельзя. По результатам, с одной стороны - Вы немного познакомитесь с нашими задачами, с другой стороны – мы познакомимся с Вашим стилем программирования. Прошу не стесняться обращаться, если текст задания вызывает вопросы.</p> <p>Реализацию задачи нужно выслать мне; по результатам анализа - либо мы договариваемся о дате/времени собеседования, либо Вы получаете отказ.</p> <p>Если Вас смущает передача 100% готового кода задания, то для предварительного просмотра достаточно ~70% исходников и исполняемого файла; остальное можно принести на собеседование.</p> <p>Объясню, почему так : задачи, которые будут перед Вами стоять, в случае, если мы договоримся о сотрудничестве, несколько сложнее приведённых в тесте и решать их надо будет самостоятельно. Если Вы не справляетесь с тестами – нет смысла говорить о большем. Желаю Вам успеха и надеюсь, что наша позиция будет правильно понята.</p> <p>Хотя, время, затраченное Вами на реализацию тестового задания для нас в общем-то некритично и не является главным при оценке результатов, нам бы хотелось получить решение первой задачи в течение двух недель. Разумеется, по объективным причинам, время на решение может быть продлено - пожалуйста, сообщите об этом.</p> <p><strong>Текст тестового задания:</strong></p> <p>Два типа блоков – «control block» и «client1», «client2», …. , «clientN» соединены в одноранговую локальную сеть.</p> <p><strong>control block</strong>, он же блок управления, он же «мастер-контроллер»; может быть в составе сети только в одном экземпляре</p> <p><strong>Блоки индикации</strong>, они же &quot;Client#&quot;, имеются в количестве от 3 до 200.</p> Все блоки распределены в пространстве и установлены на улице. Блоки объединены локальной сетью Ethernet. Каждый блок индикации имеет 2 датчика: датчик температуры и датчик освещенности. <p>Мастер-контроллер в произвольные моменты времени отправляет в блоки индикации данные для отображения; например: текст, температура, время и яркость. Так же, мастер-контроллер периодически (1 раз в 5 секунд) опрашивает все датчики с блоков индикации, рассчитывает среднее значение температуры и освещенности. Среднее значение температуры используется для отправки в блоки индикации в виде текста, а среднее значение освещенности используется для подстройки яркости отображаемой информации. Мастер-контроллер устанавливает значение яркости во все блоки индикации в соответствии с расчетным средним значением освещенности.</p> <p>Иногда случается так, что блок управления теряет связь с блоками индикации (как повезёт - может со всеми, а может только с частью), поэтому блоки индикации остаются без управления на время более 5 минут. В этом случае роль блока управления должен взять один из блоков индикации, до того момента пока основной блок управления снова станет доступен. Блок индикации, который взял роль мастер-контроллера, так же может потерять связь с блоками индикации (как повезёт - может со всеми, а может только с частью), после чего должен выбраться новый мастер-контроллер.</p> <p>Количество блоков индикации может меняться в процессе работы.</p> <p>До момента подключения к сети мастер-контроллер ничего не знает о клиентах.</p> <ol> <li> <p>Предложите и реализуйте в программе алгоритм выбора нового мастера между блоками индикации при потере соединения с блоком управления (основным блоком управления или блоком индикации, выполняющим функции мастер-контроллера). Описание алгоритма нужно представить в виде отдельного текстового файла.</p> </li> <li> <p>Напишите программу-эмулятор блока индикации, соответствующую описанию.</p> </li> <li> <p>Напишите программу-эмулятор блока управления, соответствующую описанию.</p> </li> </ol>",https://hh.ru/vacancy/68569246,68569246
Системный программист / Kernel Developer (Windows),,,"['C++', 'Assembler', 'Windows', 'C', 'SDK/WDK API', 'IDA', 'WinDBG', 'Kernel Mode', 'reverse-инжиниринг', 'Windows Performance Toolkit', 'ETW', 'WPP', 'Sysinternals Suite', 'руткит и анти-руткит технологии']",,,,Доктор Веб,moreThan6,flexible,2022-09-02T10:47:10+0300,"<p><strong>Обязанности:</strong></p> <ul> <li> <p>Исследование документированных и недокументированных способов для фильтрации событий (File System, Registry, Network, Native API, RPC и т.д.), разработка драйверов x86/x64 для их реализации;</p> </li> <li> <p>Поиск способов обезвреживания руткитов в режиме ядра.</p> </li> </ul> <p><strong>Требования:</strong></p> <ul> <li> <p>Знание C/C++, Assembler x86/x64;</p> </li> <li> <p>Опыт практического программирования;</p> </li> <li> <p>Глубокое знание архитектуры операционных систем семейства Windows, внутренних механизмов работы и недокументированных структур;</p> </li> <li> <p>Хорошее знание SDK/WDK API;</p> </li> <li> <p>Уверенное владение инструментами IDA и WinDBG;</p> </li> <li> <p>Опыт Kernel Mode отладки на физических и виртуальных машинах;</p> </li> <li> <p>Опыт анализа crash dump;</p> </li> <li> <p>Знание алгоритмов и методов оценки их сложности;</p> </li> <li> <p>Опыт разработки фильтров файловых систем.</p> </li> </ul> <p><strong>Желательно:</strong></p> <ul> <li> <p>Навыки reverse-инжиниринга, знание руткит и анти-руткит технологий;</p> </li> <li> <p>Знание недокументированных способов фильтрации событий в режиме ядра;</p> </li> <li> <p>Опыт работы с ETW, WPP, Windows Performance Toolkit;</p> </li> <li> <p>Знание набора инструменов Sysinternals Suite;</p> </li> <li> <p>Знакомство с книгой “Windows Internals” (Russinovich M., Solomon D., Ionescu A.).</p> </li> </ul> <p><strong>Мы предлагаем:</strong></p> <ul> <li> <p>Официальное трудоустройство;</p> </li> <li> <p>Гибкий график работы;</p> </li> <li> <p>Современный офис на Петроградской стороне;</p> </li> <li> <p>Конкурентоспособную заработную плату (обсуждается индивидуально, зависит от вашего опыта и квалификации);</p> </li> <li> <p>ДМС, включая стоматологию;</p> </li> <li> <p>Горячие обеды, фрукты, напитки;</p> </li> <li> <p>Зону отдыха, тренажеры, полезные для работы книги;</p> </li> <li> <p>Обучение (уроки английского).</p> </li> </ul>",https://hh.ru/vacancy/48913505,48913505
Ведущий специалист по разработке встраиваемого ПО (Embedded Linux),,,"['Atlassian Jira', 'Linux', 'Atlassian Confluence', 'Jenkins', 'Умение принимать решения']",,,,ПКФ Снарк,moreThan6,fullDay,2022-09-01T15:45:28+0300,"<p>ООО «ПКФ «СНАРК» является производственной и строительно-монтажной компанией, которая реализует комплексные проекты по энергетике для городского электрического транспорта в России и странах СНГ.</p> <p>Разработанная нами подвесная система на основе композитных материалов для контактной сети трамваев и троллейбусов является единственной сертифицированной в России.</p> <p>На данный момент выполнено более 100 объектов реконструкции и нового строительства тяговых подстанций, прокладка кабельных линий и строительство контактной сети на основе композитных материалов по всей России и странах СНГ.</p> <p>Одно из новых направлений компании является развитие инфраструктуры зарядных станций. Нами уже выполнено несколько успешных проектов в этой сфере, а также разработаны и изготовлены первые образцы зарядных станций собственного производства.</p> <p>На данный момент мы расширяем нашу команду разработчиков и ищем специалистов, желающих внести свой вклад в развитие электрического транспорта.</p> <p><strong>Обязанности:</strong></p> <p>- разработка ПО под Embedded Linux для зарядных станций электрических ТС (websocket, OCPP, CCS, Chademo, GB/T 27930);<br />- участие в разработке архитектуры и требований к ПО;<br />- разработка алгоритмов и структур данных;<br />- работа с сетевыми технологиями (TCP\IP), проводными (CAN, RS485, Ethernet, USB) и беспроводными (Wi-Fi, Bluetooth, 3G/4G) интерфейсами;<br />- разработка Unit-тестов;<br />- постановка задач и ревью кода, разработанного командой специалистов.<br />- участие в отладке и тестировании системы (ПО, интеграция с железом).<br />- анализ и повышение надежности и безопасности ПО.<br />- подготовка документации.</p> <strong>Требования:</strong> <p>- Отличное знание C/C++.<br />- Знание архитектуры ARM Cotrtex-A.<br />- Опыт разработки под Embedded Linux.<br />- Опыт работы с Yocto и/или BuildRoot.<br />- Опыт работы с интерфейсами USB, Ethernet.<br />- Опыт работы с системами контроля версии (git).<br />- Опыт работы с сетевыми технологиями и протоколами (TCP\IP).</p> <p>Будет здорово, если ты:</p> <p>- Знаешь какие-либо из стандaртов зарядки электромобилей (CCS, Chademo, GB/T 27930, OCPP).<br />- Имеешь опыт работы с RFID считывателями; интерфейсами CAN, RS485; продуктами командной разработки (Jira, Confluence и пр.); системами CI/CD (Jenkins).<br />- Имеешь опыт разработки Unit-тестов, HIL тестирования и отладки.</p> <strong>Условия:</strong> <ul> <li>Белую конкурентную заработную плату;</li> <li>ДМС после первого месяца работы;</li> <li>Обучение за счёт компании.</li> <li>Приятные традиционные мелочи в виде снеков, чая, кофе.</li> </ul>",https://hh.ru/vacancy/68522054,68522054
Senior QML Developer,,,"['Qt', 'ООП', 'C++', 'MS Visual Studio', 'Разработка компьютерных Игр', 'QML']",,,,EvenBet Gaming,moreThan6,flexible,2022-08-12T10:18:31+0300,"<p>EvenBet Gaming — международная IT-компания с 20-летним опытом.</p> <p>Мы разрабатываем уникальную онлайн-платформу для многопользовательских карточных игр и социального казино. Продукт получает высокие оценки на международных рынках.</p> <p>Наша команда — это более 100 IT - специалистов, находящихся в разных странах на разных континентах.</p> <p><strong>Сейчас ищем Senior разработчика на QML</strong>, для сотрудничества по темам:<br />- Ревью архитектуры нашего приложения - сессия(и) вопросов ответов с командой (обмен опытом);<br />- Код ревью (выборочный, ключевые места);<br />- Оптимизация и профилировка приложения(советы, подходы, анализ и т.п.).<br /><br />Все активности опциональные. Можно выбирать подходящие.<br /><br />Оплата почасовая</p>",https://hh.ru/vacancy/68373593,68373593
Ведущий программист,Санкт-Петербург,Тихорецкий проспект,"['Linux', 'Python', 'С/С++', 'CMake', 'Wireshark', 'candump', 'GtkTerm', 'Qt', 'умение работать с мультиметром', 'Умение разобраться в чужом коде', 'RS-232/485']",,,,ЦНИИ РТК,moreThan6,fullDay,2022-08-31T14:54:24+0300,"<p><strong>Обязанности:</strong></p> <ul> <li>Разработка систем управления робототехнических комплексов</li> <li>Техническое развитие продукта</li> <li>Сопровождение существующей кодовой базы</li> <li>Подготовка технологического и стендового оборудования к проведению испытаний</li> <li>Участие в стендовых и полигонных испытаниях</li> </ul> <p><strong>Требования:</strong></p> <ul> <li>Свободное владение C++ от 11 и выше, знание CMake</li> <li>Опыт разработки визуальных форм Qt Framework на языке QML</li> <li>Уверенное администрирование Linux</li> <li>Глубокое понимание принципов ООП и принципов разработки программ</li> <li>Хорошее знание алгоритмов и шаблонов проектирования</li> <li>Опыт разработки многопоточных приложений</li> <li>Опыт разработки сетевых приложений (TCP, UDP)</li> <li>Владение основными средствами разработки и контроля версий GIT</li> <li>Базовое администрирование сетей</li> <li>Понимание взаимодействия с интерфейсами Ethernet, CAN, RS-232/485</li> <li>Умение работы с документацией</li> </ul> <p>Приветствуется:</p> <ul> <li>Базовые знания электроники, умение работать с мультиметром</li> <li>Опыт написания bash скриптов</li> <li>Работа с Docker</li> <li>Опыт работы с программами Wireshark, candump, GtkTerm</li> <li>Умение разобраться в чужом коде</li> <li>Умение и желание работать в команде, аккуратность, ответственность</li> <li>Нацеленность на долгосрочное сотрудничество</li> </ul> <p><strong>Условия:</strong></p> <ul> <li>График работы: пятидневка, с 9-18 ч.</li> <li>Оформление по ТК, социальный пакет (ДМС, участие в корпоративных мероприятиях</li> <li>Столовая на территории организации</li> <li>Стабильность</li> <li>Размер заработной платы по договоренности</li> </ul>",https://hh.ru/vacancy/69345285,69345285
