name,city,address,key_skills,sal_from,sal_to,currency,company,experience,schedule,published_at,description,alternate_url,id
Senior Java Developer (Programmatic Advertising),Санкт-Петербург,улица Красного Курсанта,"['Java', 'Spring Framework']",,,,Murano Software,between3And6,remote,2022-08-24T13:34:12+0300,"<p>Since 2003, Murano has been developing software that simplifies and optimizes the customer&#39;s daily work and contributes to the digitalization of key US industries as well. Besides the client projects, the company maintains and develops its product based on the .NET platform: the world’s leading insurance submission, application, and policy management system, which is used by more than half of independent insurance agencies in the United States.<br />Murano&#39;s head office locates in Los Angeles, and its team works from different cities and countries worldwide.</p> <p>This vacancy is opened on our outsourcing project.</p> <p>Project of our client produces a complete view of the health customer, to unlock and activate health insights in order to revolutionize health decision-making in real time. Through machine learning and programmatic automation, the company interprets the hard-to-read signals of the health journey to understand the connection points between relevance and engagement. This is achieved by unifying real-time Digital Determinants of Health, offline and clinical data to create a unique and precise view of the health ecosystem that refines, improves and increases its view over time.</p> <p>The team is looking to add developers seeking technical challenges and empowerment to make decisions that really move the business forward. Some major projects is currently working on: continuing to scale our core exchange platform, honing the intelligence of our optimization, cutting feedback time for business intelligence, and aggressive automation.</p> <p><strong>Some tools we use:</strong></p> <ul> <li> <p>GIT, Maven, TeamCity, JIRA, Confluence, Crucible, Intellij, Redis</p> </li> <li> <p>Some practices we’ve adopted: TDD/unit-testing, continuous integration, code-reviews, Scrum</p> </li> <li> <p>Things we’re working on: cloud-computing, event-driven IO, self-healing systems, analytic databases</p> </li> <li> <p>We like open source: Spring, Hadoop (we run the NYC Hadoop Meetup), Jetty, Linux, Memcache.</p> </li> </ul> <p><strong>What we value as a team:</strong></p> <ul> <li> <p>Code built for Performance and Scale</p> </li> <li> <p>Solid engineering practices (e.g. design patterns, automated testing, fault-tolerant systems, KISS)</p> </li> <li> <p>Leveraging Open Source</p> </li> <li> <p>Agile development and tight interaction with business/operations</p> </li> <li> <p>Automated testing</p> </li> <li> <p>Developers who can navigate around a Linux box</p> </li> <li> <p>Passion, technical expertise, and personal accomplishment</p> </li> <li> <p>Rolling up your sleeves and getting things done</p> </li> </ul> <p><strong>Requirements:</strong></p> <ul> <li>Minimum of two years experience in Programmatic Advertising using Real-Time Bidding</li> <li>Experience in performance optimization (CPU, Memory, IO) and high-scale (up to 80K req per second per server)</li> <li>Excellent problem solving and critical thinking</li> <li>Strong Communication and interpersonal skills</li> <li>Mastery of algorithms, data structures and performance</li> <li>Independence and strong ownership of business problems and their technical solutions</li> <li>Experience with open source projects and tools (e.g. apache projects, maven, Spring, tomcat/glassfish)</li> <li>Experience with Agile, tight interaction with business and operations (DevOps)</li> <li>Experience with automated testing (TDD, Mocking, Unit/Functional/Integration)</li> <li>Expert Knowledge of Internet technologies/and protocols</li> <li>Expert knowledge of the Java language, platform, ecosystem and underlying concepts and constructs</li> <li>Knowledge of common design patterns (IoC, GoF – not J2EE Pattern Library)</li> </ul> <p><strong>We&#39;re offering:</strong></p> <ul> <li> <p>Ability to work remotely</p> </li> <li> <p>Competitive salary</p> </li> <li> <p>Flexible schedule</p> </li> <li> <p>Company sponsored events</p> </li> <li> <p>English classes.</p> </li> </ul> <p><strong>Waiting for your CV!</strong></p>",https://hh.ru/vacancy/68645097,68645097
Middle Java backend developer,,,"['Java', 'PostgreSQL', 'Kafka', 'Cassandra', 'Kubernetes', 'Docker', 'Spark', 'CI/CD', 'Spring Boot']",,,,ЕСН,between3And6,remote,2022-08-17T18:01:22+0300,"<p>ESN (Entertainment Social Network) – это современная IT компания, создающая цифровые продукты на стыке технологий и медиа. Мы запускаем аудио и видео контент-приложения, объединяющие миллионы пользователей через взаимодействие друг с другом. Для наших клиентов мы делаем сервисы, работающие с алгоритмами обработки естественного языка от OpenAI, обучаем нейросети делать релевантные рекомендации, а стримим контент с использованием CDN инфраструктуры, адаптированной для работы с видео.</p> <p>Мы – молодая амбициозная команда, без лишней бюрократии в процессах и строгой иерархии. Присоединяйся к нам и создавай уникальные решения, развивайся как профессионал и расти вместе с продуктом. У нас нет легаси, – мы используем новейшие технологии.</p> <p>В связи с расширением команды мы ищем Senior Java backend разработчика.</p> <p>Технологии/инструменты:</p> <p>Java 16, Spring 5, SpringBoot, Kafka, PostgreSQL, Cassandra, Gitlab CI/CD, Kubernetes &amp; Docker, Reactive WebFlux</p> <p><strong>Задачи:</strong></p> <ul> <li>Разработка отказоустойчивых масштабируемых высоконагруженных микросервисов на Java;</li> <li>Подготовка инструментария для организации нагрузочного тестирования;</li> <li>Участие в принятии архитектурных решений;</li> <li>Написание интеграций со смежными сервисами;</li> <li>Работа в контакте с data science командой, реализация инфраструктуры для ML;</li> <li>Взаимодействие с продуктовой командой, активное участие в развитии продукта;</li> <li>Построение социальной видео-контент платформы с нуля:</li> </ul> <p>- Медиа платформа для процессинга и обработки видео/аудио,</p> <p>- Рекомендательная система для ленты видео,</p> <p>- Система потоковой обработки пользовательских событий,</p> <p>- Работа с краудсорс платформами,</p> <p>- Система А/В экспериментов.</p> <p><strong>Чем предстоит заниматься:</strong></p> <ul> <li>Опыт работы с продуктовыми командами, желание принимать участие в проработке продуктовых фичей;</li> <li>Имеешь опыт работы с нашим технологическим стеком;</li> <li>Опыт разработки на Java от 3 лет;</li> <li>Готов к работе в быстро растущей, активно развивающейся компании.</li> </ul> <p>Для нас важно:</p> <ul> <li>Опыт командной разработки коммерческих приложений от 3 лет;</li> <li>Знание основных методологий разработки ПО, понимание принципов OOП, шаблонов проектирования;</li> <li>Уверенное знание Spring, Spring Boot, Java 11+;</li> <li>Опыт работы с инструментами Jira, Confluence, GitLab, Gradle;</li> <li>Знание и опыт работы с базами данных SQL (RDBMS, NoSQL), понимание принципов работы и особенностей, опыт проектирования и оптимизации;</li> <li>Опыт работы с распределенными очередями и брокерами сообщений (Apache Kafka);</li> <li>Опыт проектирования и разработки высоконагруженных, распределённых и отказоустойчивых систем.</li> </ul> <p><strong>Что мы предлагаем:</strong></p> <ul> <li>Оформление по ТК РФ;</li> <li>Конкурентная заработная плата, индивидуально обсуждается с кандидатом;</li> <li>Возможность удаленной работы;</li> <li>Современный офис в пределах Садового кольца;</li> <li>ДМС после прохождения испытательного срока;</li> <li>Техника для работы, ноутбук, монитор и т.д.;</li> <li>Оплачиваемые командировки;</li> <li>Проведение неформальных мероприятий – праздники, корпоративы.</li> </ul> <p> </p>",https://hh.ru/vacancy/68897340,68897340
Middle Java/Kotlin разработчик,,,"['Spring Framework', 'Java', 'Kotlin']",230000,300000,RUR,ProfiStaff,between1And3,remote,2022-08-15T11:02:03+0300,"<p>Наш клиент – фундаментальная ИТ-компания, которая более 20 лет занимается масштабными проектами по автоматизации в Сфере строительства, 3D-моделирования и тд. В числе разрабатываемых проектов: «Умный офис», «Управление строительной деятельностью», «BIM-экспертиза» и др.<br /><br />Сейчас мы ищем 2-х Senior и 2-х Middle Java/Kotlin разработчиков с опытом разработки Микросервисов от 1,5 лет, готовых присоединиться к небольшой команде Серверной разработки одного из новых проектов («Умный офис» или «BIM-экспертиза» и тд).<br /><br /><strong>ТРЕБОВАНИЯ:</strong><br />Опыт работы от 2-х лет;<br />Опыт работы с Java 8+;<br />Опыт работы с Kotlin от 1 года обязательно!<br />Опытный пользователь Maven, Spring (Spring Boot, Spring JPA), Hibernate, API, REST, JUnit;<br />Обязательно опыт разработки Микросервисной архитектуры;<br />Хороший опыт работы с PostgreSQL или Oracle;</p> <p><strong>Будет плюсом:</strong><br />Навыки работы с Spring Cloud; Kafka; Elasticsearch.</p> <p><strong>ОБЯЗАННОСТИ:</strong><br />Разработка WEB-приложений с нуля (участие в формировании архитектуры, выборе технологий);<br />Разработка на Java (70% времени) и сопровождение (написание и документирование кода, проектирование в рамках компетенции);<br />Доработка и расширение функционала существующих модулей;<br />Разработка проектов на Kotlin (20-30% времени).<br /><br /><strong>УСЛОВИЯ:</strong><br />Оформление по ТК РФ/ИП/ГПХ (по желанию);<br />Белая ЗП и приятный соцпакет;<br />Зарплата: до 250.000 руб net для Middle и до 500.000 руб net для Senior<br />Квартальная премия от 1,5 окладов;<br />Годовая премия от 2-х окладов;<br />ФОРМАТ РАБОТЫ: УДАЛЕНКА/офис/гибрид;<br />График: гибкий (важно быть половину времени на связи с командой);<br />Комфортабельный новый офис ЦАО;<br />Расширенный ДМС со стоматологией;<br />Условия по ипотеке/жилищному займу 5% (как сотруднику IT-компании);<br />Собственный тренажерный зал или оплата фитнеса<br />Работа в драйвовой IT-компании с современным стеком и приятным коллективом.<br /><br />Если Вы ищете стабильность, множество интересных проектов, достойную ЗП и современный стек – смело откликайтесь!</p>",https://hh.ru/vacancy/68778291,68778291
Java-разработчик,,,"['Java', 'HTML', 'CSS', 'JavaScript']",,,,"EGAR TECHNOLOGY, INC.",between3And6,remote,2022-08-08T15:17:35+0300,"<p>EGAR Technology - российская компания, специализирующаяся в областях:<br />- Разработки программного обеспечения для финансовых рынков - линейка продуктов под брендом EGAR;<br />- ИТ- аутсорсинга, заказной разработки и заказного тестирования для крупных компаний.</p> <p>EGAR сегодня - это:<br />- 20+ лет успешных разработок сложных программных продуктов для организаций различной специализации, прежде всего для участников финансового рынка;<br />- Исследования, активный поиск новых архитектурных и технологических решений для бизнес-заказчиков на стыке современных технологий и бизнеса – резидент Инновационного центра «Сколково»;<br />- 8 филиалов в РФ;<br />- Обширная и узнаваемая клиентская база.</p> <p><strong>В крупный банк, ТОР-5, открыты вакансии Java-разработчиков на проекты: </strong></p> <ul> <li>Реализация целевой архитектуры первичной продажи</li> <li>Единый брокерский счет 2.0.</li> <li>Дистанционное закрытие счетов</li> </ul> <p> </p> <p><strong>Требования:</strong></p> <p>Хорошие знания Java 8, HTML, CSS, JavaScript, API Jira</p> <ul> <li>Опыт работы более 3х лет</li> <li>Хороший уровень Java 8-14 (core);</li> <li>Знание Spring Framework, а также Spring Boot;</li> <li>Хороший уровень SQL (PostgreSQL/Oracle/MS SQL);</li> <li>Приветствуется опыт с разработкой плагинов для Jira.</li> </ul> <p><strong>Мы предлагаем:</strong></p> <ul> <li>Официальное оформление в стабильную и динамично развивающуюся ИТ компанию EGAR Technology;</li> <li>Удаленный формат работы;</li> <li>Конкурентный уровень заработной платы.</li> <li>Полноценную проектную команду с четким разделением ролей;</li> <li>Оперативное решение организационных вопросов;</li> <li>Возможность профессионального роста (вертикального или горизонтального);</li> <li>Компенсация на обучение для повышения квалификации (курсы, сертификация);</li> <li>Бонусы по реферальной программе;</li> <li>Дополнительно 4 дня в год по болезни без больничного листа (sick day);</li> <li>Расширенный пакет ДМС, включая стоматологию.</li> </ul>",https://hh.ru/vacancy/68572861,68572861
Middle Back-end разработчик (Java / Kotlin),,,"['Java', 'Kotlin', 'Postgres', 'Spring Boot', 'REST', 'SQL', 'Angular', 'Docker', 'Английский язык']",,,,Surf,between1And3,remote,2022-08-03T12:18:15+0300,"<p><strong>О нас:</strong></p> <p>В Surf уже 12 лет мы разрабатываем много разных проектов, начиная от простых<br />внутрикорпоративных аппов, заканчивая сложными ERP системами, видео-стримингом и свежими банкам. Работаем с крупным российским бизнесом и западными клиентами. Мы уже сделали немало хороших приложений для наших клиентов: Labelcom, TAG, KFC, Росбанк, Магнит, Додо Пицца, Delivery Club, Lamoda, Яндекс и других.</p> <p>Планируем вырастить отдел веб разработки до 100 человек. Нашей команде нужен разработчик с опытом, который умеет писать код быстро и качественно, готов работать в команде и при этом сможет продемонстрировать самостоятельность и автономность. Мы активно экспериментируем с новыми подходами и технологиями, и понимаем важность инвестирования в них.</p> <p><strong><em>О команде и процессах:</em></strong></p> <ul> <li>Бекенд команды зависит от сложности и объемов проекта: от 2-х человек. Внутри проекта обязательно проводится Code Review. Если есть возможность - пробуем Cross Project Code Review.</li> <li>Управление проектом, системный анализ, тестирование, разработка веб и мобильного фронта делает так же наша компания - вы всегда будете работать в компании &quot;своих&quot;.</li> <li>Сервисы: тасктрекер - Jira, код храним на GitHub, CI/CD - дженкинс + ArgoCD, деплоим в k8s. Есть свой DevOps, но поощряем тех, кому интересно покопаться в инфраструктуре</li> </ul> <p> </p> <p><strong>Стек типичного проекта:</strong><br />Java/Kotlin, PostgreSQL, Spring Boot, микросервисы</p> <p><strong>Что нужно делать:</strong></p> <ul> <li>Разрабатывать серверную часть веб приложений</li> <li>Работать на современных технологиях: Kafka, Kotlin, Kubernetes, микросервисы и т.д.</li> <li>Взаимодействовать с командой аналитиков, фронтэнд, дизайнеров, devops, мобильной разработки и QA</li> <li>Участвовать в построении архитектуры систем</li> </ul> <p><strong>Что нужно от тебя:</strong></p> <ul> <li>Опыт разработки на Java 8+ или Kotlin</li> <li>Умение писать аккуратный и читаемый код</li> <li>Опыт проектирования и разработки ПО с использованием Spring/Spring Boot фреймворка и его составляющих: Spring Security, — Spring MVC, Spring Data</li> <li>Опыт разработки веб-приложений, понимание REST</li> <li>Знание SQL и принципов работы реляционных БД</li> <li>Понимание ООП, GOF, SOLID, GRASP</li> <li>Написание юнит и интеграционных тестов</li> </ul> <p><em><strong>Будет плюсом:</strong></em></p> <ul> <li>Опыт работы на Linux</li> <li>Знание Docker, Kubernetes</li> <li>Знание Liquibase (или Flyway)</li> <li>Опыт работы с Apache Kafka</li> <li>Английский язык - В2 или выше</li> </ul> <p><strong>О том, почему у нас хорошо:</strong></p> <ul> <li>у тебя будет возможность жить в России и работать на западных проектах, качать английский;</li> <li>Surf - аккредитованная IT-компания;</li> <li>тебя ждет белая зарплата, оформление по ТК РФ и своевременный пересмотр каждые 6-8 месяцев;</li> <li>гибкий график, удалённая работа, гибрид или офис;</li> <li>ДМС со стоматологией, психологами, юристами;</li> <li>не приветствуем переработки, но если уж так случилось, то щедро их оплачиваем;</li> <li>обеспечим современной техникой: макбуками, телефонами и другими девайсами, которые понадобятся для работы;</li> <li>находим персональный рецепт быстрого профессионального роста: опытные коллеги подскажут и поддержат, менторы обозначат пути развития. В Surf можно расти вглубь или стать T-Shape специалистом: проектов, задач, возможностей много;</li> <li>предоставляем ежегодный бюджет на образование и конференции, помогаем развивать личный бренд и медиа-проекты, учим писать статьи и выступать, компенсируем затраты на участие в конференциях в качестве спикера;</li> <li>даем корпоративные скидки на фитнес;</li> <li>делаем посильный вклад в сообщество - оплачиваем разработку open-source в рабочее время;</li> <li>бережно храним Surf-культуру: минимум бюрократии, свобода в принятии решений, возможность создавать процессы и внедрять новые практики, поощрение ценных идей и выдающегося перформинга, человечность превыше всего;</li> <li><strong>Всего 1 этап интервью!</strong></li> </ul>",https://hh.ru/vacancy/66633422,66633422
