name,city,address,key_skills,sal_from,sal_to,currency,company,experience,schedule,published_at,description,alternate_url,id
Middle Java developer,,,"['Git', 'Spring Framework', 'Hibernate ORM', 'PostgreSQL', 'SQL', 'Java', 'Linux']",100000,190000,RUR,Ediweb,between3And6,remote,2022-08-23T15:22:27+0300,"<p>Ищем подкрепление в нашу команду разработки систем для автоматизации бизнеса. Работаем официально, есть удалёнка и возможность регулировать начало рабочего дня.</p> <p><em><strong>Наш стек:</strong></em></p> <ul> <li>Apache Tomcat</li> <li>Java 8</li> <li>Apache Camel</li> <li>Spring Framework (Core/MVC/Security/Data/)</li> <li>Hibernate</li> <li>PostgreSQL</li> <li>MongoDB</li> <li>ExtJs</li> </ul> <p><em><strong>Вам предстоит:</strong></em></p> <ul> <li>Анализ и оценка предстоящих задач</li> <li>Разработка и доработка функционала</li> <li>Написание Unit тестов</li> <li>Рефакторинг существующего кода</li> <li>Взаимодействие с командами других продуктов</li> </ul> <p><em><strong>Навыки и знания, которыми необходимо обладать:</strong></em></p> <ul> <li>Уверенный уровень владения Java 8 и Spring</li> <li>Опыт работы с SQL базами</li> <li>Использование систем контроля версий: Git</li> <li>Английский на уровне чтения технической литературы</li> </ul> <p><strong><em>Желательно:</em></strong></p> <ul> <li>Опыт работы с Linux</li> <li>Опыт работы с Apache Camel и JMS</li> <li>Опыт работы с системами автоматизации сборки и тестирования (Jenkins)</li> <li>Опыт разработки систем с использованием криптографии</li> </ul> <p><em><strong>Мы предлагаем:</strong></em></p> <ul> <li>Конкурентную заработную плату (оговаривается с итоговым кандидатом и напрямую зависит от опыта и знаний)</li> <li>Команду высоко квалифицированных коллег, системный подход к разработке продукта, возможности для профессионального и карьерного роста (мы регулярно разрабатываем новые продукты в сфере EDI и не только, востребованные на рынке)</li> <li>Обучение и повышение квалификации</li> <li>Возможность &quot;гибридного&quot; формата работы (офис, удалёнка)</li> <li>Возможность самостоятельно регулировать начало рабочего дня</li> <li>Корпоративную систему мотивации</li> </ul> <p><em>Откликаясь на вакансию в сопроводительном письме напишите о желаемом Вами уровне дохода</em></p>",https://hh.ru/vacancy/68436997,68436997
Flutter разработчик,Санкт-Петербург,Левашовский проспект,"['iOS', 'Android', 'Flutter', 'REST API']",200000,290000,RUR,Codex Optimus,between1And3,remote,2022-08-31T12:06:47+0300,"<p>Мы c 2007 года занимаемся продуктовой финтех-разработкой и запустили несколько собственных продуктов, в том числе и на европейском рынке. Сейчас наша команда разрабатывает новый цифровой банк для Узбекистана. Этот продукт наш, мы разрабатываем его с нуля. </p> <p>В нашей команде — разработчики с большим опытом в финтехе, высоконагруженных системах и кибербезопасности. С нами комфортно работать и отлично отдыхать!</p> <p>Мы активно расширяемся, поэтому мы в поиске <strong>Flutter-разработчика</strong> к нам в команду<strong>. </strong>Возможен как полностью удалённый, так и гибридный формат работы в Санкт-Петербурге.</p> <p><strong>Стек:</strong></p> <p>- Платформы: Android, iOS;<br />- Архитектура и управление состоянием: Clean Architecture, BLoC, своя реализация универсальных компонентов;<br />- Dependency Injection: Своя реализация, похожая на пакет Kiwi;<br />- Сеть: Dio, своя реализация DioClient, сокеты;<br />- База данных: Hive;<br />- UI: Своя реализация UIKit, своя реализация тем и стилей, Storybook;<br />- Локализация: Intl, IDE plugin;<br />- Пуши: Firebase Messaging, Huawei Push Kit;<br />- Тестирование: test, bloc_test, mockito, mocktail.</p> <p>Tooling: Android Studio, XCode, Fork, Proxyman, HTTP Toolkit, Flipper, Postman, Swagger, Firebase Console, Figma, Miro, CI/CD, собственные скрипты.</p> <p><strong>Опыт:</strong></p> <p>– опыт в коммерческой разработке на Flutter от 1 года;<br />– опыт в коммерческой разработке нативных приложений от 1 года;<br />– опыт разработки клиент-серверных приложений;<br />– понимание принципов разработки;<br />– понимание Clean Architecture и BLoC;<br />– понимание Dependency Injection;<br />– понимание REST API;<br />– опыт тестирования мобильных приложений;<br />– знание английского на уровне чтения технической документации.</p> <p>Плюсом будут навыки работы с Kotlin, Kotlin Multiplatform, Jetpack Compose, SwiftUI, Firebase, Huawei Mobile Services, Camera, Camera2 API, CameraX, AVFoundation, KeyStore, KeyChain, Realm, Android NDK, Java JNI, CoreData, OpenGL, Metal, Vulkan, Unity, Unreal Engine, Ruby, Ruby on Rails, NodeJS, Ktor, Netty, Jetty.</p> <p><strong>У нас:</strong></p> <p>— офис в шаговой доступности от м. Чкаловская или полная удалёнка;<br />— помощь с релокацией в Санкт-Петербург (при желании);<br />— возможность влиять на процессы и инициировать их: руководители всегда готовы к диалогу;<br />— гибкое начало дня: нам не важно, сова ты или жаворонок;<br />— оплачиваемые курсы и конференции;<br />— оплата больничного в полном размере;<br />— мама нашего СТО печет для нас печенье в промышленных масштабах;<br />— рабочая техника на macOS;<br />— оформление по ТК РФ с первого дня работы.</p>",https://hh.ru/vacancy/67115741,67115741
Data Engineer (Scala),,,"['SCALA', 'Java', 'Apache Spark']",,,,Самокат (ООО Умное пространство),between3And6,remote,2022-08-30T18:29:47+0300,"<p><strong>Самокат — сервис #1 в России по числу заказов в сфере быстрой доставки</strong></p> <p><em>Наша миссия — дарить людям время, которое они могут потратить на свои увлечения и близких. Мы создаем новый слой городской инфраструктуры с доставкой продуктов и товаров для дома за 15 минут.</em></p> <p>Позиция открыта в инфраструктурном продуктовом стриме - Data Platform.</p> <p>Data Platform отвечает за запуск data driven сервисов и продуктов, создание экосистемы и процессов по работе с данными в Самокате, а также за технологическое развитие платформы для решения новых задач компании.</p> <p><strong>Мы в поисках Data Engineer, которому предстоит выполнять следующий блок задач:</strong></p> <ul> <li> <p>реализация сервисов потоковой (near-realtime) обработки данных</p> </li> <li> <p>разработка компонентов ETL-фреймворка</p> </li> <li> <p>участие в развитии процессов и фрэймворков команды разработки</p> </li> </ul> <strong>Пожелания к кандидатам:</strong> <ul> <li> <p>опыт разработки с использованием Apache Spark</p> </li> <li> <p>опыт и навыки работы с реляционными базами данных</p> </li> <li> <p>знание базовых алгоритмов и структур данных</p> </li> <li> <p>опыт разработки на Java или Scala</p> </li> </ul> <p><strong>Мы заботимся о своих сотрудниках, поэтому создаем максимально комфортные условия для реализации профессиональных амбиций:</strong></p> <ul> <li> <p>Официальное трудоустройство</p> </li> <li> <p>Гибридный формат работы (в офисе или удаленно)</p> </li> <li> <p>ДМС со стоматологией</p> </li> <li> <p>Возможность участвовать в профильных конференциях в качестве спикера или участника</p> </li> <li> <p>Командообразующие мероприятия - дни рождения команд, митапы, презентации, неформальные встречи</p> </li> </ul> <p>Наш фокус это:</p> <ul> <li> <p>Работа в крутом проекте, востребованность которого уже очевидна и будет только увеличиваться</p> </li> <li> <p>Пул задач, у которых нет тривиальных решений</p> </li> <li> <p>Профессиональная команда, в которой ты сможешь реализовать свой потенциал</p> </li> </ul> <p><em>Если ты хочешь развивать продукт, который делает жизнь людей лучше и комфортнее – WELCOME!</em></p>",https://hh.ru/vacancy/68337692,68337692
Senior Scala Developer / Scala Developer,Санкт-Петербург,Уральская улица,"['Разработка ПО', 'SCALA', 'Python', 'Spark', 'Веб-программирование']",,,,Криптонит,between3And6,remote,2022-08-31T15:04:45+0300,"<p>«Криптонит» – технологическая, научно-исследовательская компания. Входит в структуру «ИКС Холдинга».</p> <p>Мы создаем продукты, которые решают актуальные задачи в области больших данных, информационной безопасности, телекоммуникаций и криптографии.</p> <p>В департаменте разработки открыта вакансия Scala Developer. Команда департамента разрабатывает аналитические системы на базе единой платформы, которые позволяют безопасно работать с данными независимо от их формата, метода хранения и эксплуатации. Платформа основана на концепции Infrastructure as Code (IAC) и состоит из нескольких независимых программных продуктов и сервисов на базе JVM/Scala и Kubernetes. Она обеспечивает высокий уровень потоковой обработки и хранения данных, управления доступом и метаданными, а также контролем их использования в периметре частных облачных сред.</p> <p><strong>Технологический стек:</strong></p> <ul> <li>Языки программирования: Scala.</li> <li>Обработка и хранение данных: Spark, Flink, Kafka, ClickHouse, Cassandra,ElasticSearch.</li> <li>Прочие технологии и фреймворки: Finagle, Jackson, ScalaTest, Docker.</li> </ul> <p><strong>Задачи:</strong></p> <ul> <li>Реализация серверной части веб-приложений, связанных с обработкой и отображением больших данных.</li> <li>Анализ и оптимизация производительности.</li> <li>Участие в разработке архитектуры платформы.</li> </ul> <p><strong>Наши ожидания:</strong></p> <ul> <li>Профильное образование: информационные технологии, статистика, математика.</li> <li>Опыт работы по специальности от 3 лет (для Senior Scala Developer - от 5 лет).</li> <li>Опыт разработки на Scala или Java от 1 года (для Senior Scala Developer - от 3-х лет).</li> <li>Знание особенностей реализации различных алгоритмов и структур данных.</li> <li>Опыт работы в команде.</li> </ul> <p><strong>Будет плюсом:</strong></p> <ul> <li>Опыт разработки высоконагруженных систем.</li> <li>Опыт работы с распределенными БД: Clickhouse, HBase, ElasticSearch, Cassandra и т.д.</li> <li>Глубокое понимание особенностей архитектуры JVM.</li> </ul> <p><strong>Что мы предлагаем:</strong></p> <ul> <li>Работу в развивающейся технологической компании.</li> <li>Комфортные рабочие места в современном офисе, зона отдыха.</li> <li>Оформление в соответствии с ТК РФ.</li> <li>Заработную плату на уровне лидеров индустрии.</li> <li>ДМС + стоматология. Тестирование на COVID в медцентрах, в офисе и на дому.</li> <li>Возможность участия в профессиональных конференциях.</li> <li>Спортивные активности.</li> <li>Релокационный пакет для специалистов из других регионов.</li> <li>Работу дистанционно, в офисе или комбинированный формат</li> </ul>",https://hh.ru/vacancy/39869598,39869598
Системный инженер,,,"['Linux', 'Git', 'Apache Tomcat', 'Nginx', 'Bash']",,,,EmDev,between1And3,remote,2022-09-02T10:56:19+0300,"<p><strong>Кто мы и что мы делаем?</strong></p> <p>Компания Emdev.ru — питерская компания, история которой началась в далеком 2005 г.</p> <p><strong>С 2009г.</strong> компания переключилась на разработку IT-решений на базе платформы Liferay.</p> <p><strong>Наша гордость:</strong></p> <ul> <li> <p>В 2016 присвоен статус партнера компании RedHat/JBoss, в 2017 г. - партнера WSO2.</p> </li> <li> <p>Компания является партнером Google.</p> </li> </ul> <p><strong>Наш продукт:</strong></p> <p>Интеграционная шина, предназначенная для работы в ней аналитиков. Основным отличием от существующих классических решений в том, что мы пытаемся минимизировать участие разработчиков при разработке интеграционных маршрутов. В основе этого продукта Apache Camel, Karaf, CXF.</p> <p><strong>Основные задачи:</strong></p> <p>- развёртывание и поддержка интеграционных приложений на Java и др.<br />- работа с исходным кодом продуктов</p> <p><strong>Обязанности:</strong></p> <p>• Администрирование прикладных решений на Java – Apache Karaf, Apache ActiveMQ Artemis, WSO2;<br />• Интеграция приложений;<br />• Подготовка и автоматизация подготовки инфраструктуры для сборки, развертывания и тестирования ПО<br />• Администрирование систем мониторинга на Zabbix и Prometheus;<br />• Администрирование систем логирования на ELK, Loki, Grafana;<br />• Участие в разворачивании новых сервисов и систем;<br />• Участие в проработке архитектуры – подготовка сайзинга, диаграммы развёртывания;<br />• Подготовка документации.</p> <p><strong>Требования и знания:</strong></p> <p>• Хорошее понимание работы приложений на Java и навыки их администрирования;<br />• Опыт внедрения и конфигурирования отказоустойчивых приложений;<br />• Умение и навыки работы с кодом – возможность залезть и внести правки;<br />• Опыт работы с решениями класса ESB;<br />• Опыт работы с решениями класса API Manager.</p> <p><br /><strong>Будет плюсом:</strong><br />• Опыт работы с Apache Karaf, WSO2 Enterprise Integrator;<br />• Опыт работы с брокерами сообщений Apache ActiveMQ Artemis, RabbitMQ, Kafka;<br />• Опыт работы с ELK/EFK стеком;<br />• Опыт работы с Docker;<br />• Опыт работы с Kubernetes, Openshift;<br />• Опыт администрирования различных СУБД: MS SQL, PostgreSQL;<br />• Опыт работы с системами мониторинга: Zabbix, Prometheus;<br />• Знание механизмов и технологий построения отказоустойчивых систем.</p> <p><strong>Что мы готовы дать тебе:</strong></p> <ul> <li> <p>гибкий график, удаленный формат работы;</p> </li> <li> <p>белая компания, высокая зарплата и премиальная часть по окончанию проекта;</p> </li> <li>возможность обучаться, посещать различные конференции</li> <li>отличная команда.</li> </ul>",https://hh.ru/vacancy/68598803,68598803
Frontend Developer,Санкт-Петербург,улица Маршала Тухачевского,"['JavaScript', 'React', 'TypeScript', 'Vue', 'Телефонные переговоры', 'AngularJS']",,,,Куб Три,between3And6,remote,2022-08-30T14:35:03+0300,"<p><em><strong>** Пожалуйста указывайте в сопроводительном письме Ваши контакты в </strong></em>Телеграм<em><strong> для более оперативной обратной связи</strong></em><br /><br /><strong><em>Приветствуем!</em></strong><br />Мы IT компания Куб3 - команда, всецело увлеченных своей работой специалистов.<br />Мы прекрасно обходимся без лишней бюрократии, сотни начальников и бесконечных согласований.<br />Приглашаем на работу талантливого <strong>Frontend Разработчика </strong>в нашу компанию!</p> <p><strong>О проекте: </strong></p> <p>Распределенная система поддержки процесса инженерного проектирования. Много бэкенда на микросервисах, немного фронта для инженеров и обслуживающего персонала. Строгий и минималистичный подход к разработке.<br />На бэкенде Java + Kotlin, на фронтэнде: React.</p> <p><strong>Какие задачи предстоят:</strong></p> <ul> <li> <p>Работа в команде над новыми фичами и поддержка имеющегося набора функциональных</p> <p>возможностей;</p> </li> <li> <p>Выполнение интересных задач на нетривиальный UX.</p> </li> </ul> <strong>Наши ожидания:</strong> <ul> <li> <p>Опыт работы на JavaScript 3+ года;</p> </li> <li> <p>Опыт на TypeScript приветствуется;</p> </li> <li> <p>Крайне желателен опыт работы с фреймворками React, Angular, Vue.</p> </li> </ul> <strong>Что мы предлагаем:</strong> <ul> <li> <p>Удаленная работа на full-time;</p> </li> <li> <p>Прозрачная и понятная оплата труда + годовые премии и индексация з\п. Рассматриваем разные варианты сотрудничества: оформление в штат по ТК, а также оформление по договорам с ИП или самозанятым;</p> </li> <li>По настоящему классная команда и адекватный человеческий подход к делу.<br /><br /><strong><em>*Как к нам попасть:</em></strong><br />Первичный телефонный контакт, запрос рекомендаций или ТЗ, назначение интервью, оффер по результатам с нашим официальным предложением.<br />Интервью проводим удаленно.<br /><br /><em><strong>** Пожалуйста указывайте в сопроводительном письме Ваши контакты в </strong></em>Телеграм<em><strong> для более оперативной обратной связи</strong></em>.</li> </ul>",https://hh.ru/vacancy/68793253,68793253
