name,city,address,key_skills,sal_from,sal_to,currency,company,experience,schedule,published_at,description,alternate_url,id
Fullstack Developer,,,[],,,,iFuture,between3And6,remote,2022-08-31T15:15:51+0300,"<p>Наша команда занимается собственной разработкой highload сервисов и серии приложений, в сфере спортивной аналитики. В компании решается полный спектр задач от проектирования архитектуры до разработки и дальнейшего сопровождения продукта. Мы стараемся всегда быть в курсе тенденций и новых технологий. Аудитория проекта – Европа, Азия, СНГ. Более 5 миллионов пользователей по всему миру.</p> <p><em>Проект:</em></p> <p>Высоконагруженный сайт-приложение, которое умеет отображаться по-разному в зависимости от страны. Работа приложения заключается в подготовке/доставке/обработке/отображении большого количества постоянно меняющихся данных в нужном порядке и нужном виде в зависимости от юрисдикции.</p> <p><em>Стек:</em></p> <p>Java, Spring, Javascript, Vue.js, Typescript, CSS(LESS), Multithreading, Profiling, Messaging, REST, RPC, gRPC, Webpack, Gulp, Maven, Ant, Git.</p> <p><strong>Круг интересных задач:</strong></p> <ul> <li>Участие в разработке высоконагруженного Web-приложения (backend/frontend);</li> <li>Оформление работы согласно принятым в компании стилям и требованиям к коду;</li> <li>Участие в разработке архитектурных решений;</li> <li>Взаимодействие с менеджерами проектов, заказчиками, билд-менеджерами, тестировщиками.</li> </ul> <p><strong>Для нас в кандидате важно:</strong></p> <ul> <li>Опыт работы с Java 8+, Spring;</li> <li>Знание Javascript;</li> <li>Знание CSS(LESS);</li> <li>Опыт написания Unit тестов.</li> </ul> <p><strong>Мы с радостью предложим:</strong></p> <ul> <li>Возможность работать в любом формате - <strong>удаленно (в т.ч. из других городов) </strong>или в <strong>офисе</strong> в 5 мин. ходьбы от ст.м. Старая деревня;</li> <li>Полностью белую, конкурентную зарплату (уровень дохода обсуждаем индивидуально), официальное трудоустройство с первого дня;</li> <li><strong>Гибкий график работы</strong>, присутственные часы с 11 до 17 по Московскому времени, 40-часовая рабочая неделя с выходными в субботу и воскресенье;</li> <li>Корпоративный ДМС + стоматология;</li> <li>Оплату профильного обучения (всегда рады поддержать ваше желание профессионального развития);</li> <li>Компенсацию занятий любым спортом / фитнесом, корпоративные скидки в сеть фитнес клубов;</li> <li>Возможность повышать / поддерживать свой уровень английского с нашим преподавателем (занятия как в офисе, так и онлайн);</li> <li>Ежегодные бонусы по итогам работы;</li> <li>Интересную корпоративную жизнь (даже в пандемию!);</li> <li>Полностью оборудованный комфортный офис (при желании работать из него) в двух шагах от крупных торговых центров и живописного парка на Елагином острове.</li> </ul>",https://hh.ru/vacancy/67503507,67503507
Java-разработчик (проект «VK Звонки»),,,"['Java', 'Spring Framework']",,,,VK,between3And6,remote,2022-08-23T19:27:29+0300,"<p>Наша команда занимается сервисом звонков — одним из самых востребованных продуктов ВКонтакте.</p> <p>VK Звонки — сервис для видео-конференц-связи на неограниченное количество участников, без лимита по времени и с широким набором функций. Звонки доступны в мобильном приложении (iOS и Android) и веб-версии социальной сети ВКонтакте, а в также отдельном десктопном приложении.</p> <p>Наша команда входит в состав направления VK Видео. Команда занимается full-stack разработкой: создаём технологичные продукты в области обработки и передачи видео, алгоритмы машинного обучения и компьютерного зрения, а также видеоконференцсвязь для пользователей.</p> <p>Став частью нашей команды, ты сможешь поработать с действительно большими нагрузками и объемами данных. Не просто работать с современными технологиями, а создавать их.</p> <p><strong>Твои задачи:</strong></p> <ul> <li> <p>участвовать в разработке новых фич и разработке видеоконференций;</p> </li> <li> <p>работать над бизнес логикой видеоконференции;</p> </li> <li> <p>развивать и улучшать существующие решения и технологии, обеспечивающие высокое качество видео/звука;</p> </li> <li> <p>проектировать и реализовывать новый API.</p> </li> </ul> <p><strong>Мы ожидаем, что ты:</strong></p> <ul> <li> <p>отлично знаешь Java, Spring, JMM, Concurrency;</p> </li> <li> <p>знаком с внутренним устройством JVM;</p> </li> <li> <p>знаешь сетевые технологии и протоколы передачи данных;</p> </li> <li> <p>разбираешься в классических алгоритмах и структурах данных;</p> </li> <li> <p>нацелен на результат и обладаешь самостоятельностью в решении задач;</p> </li> <li> <p>умеешь работать в команде.</p> </li> </ul> <p><strong>Будет плюсом: </strong></p> <ul> <li> <p>знание WebRTC;</p> </li> <li> <p>опыт работы с Zookeeper, Cassandra.</p> </li> </ul> <p><strong>Мы предлагаем:</strong></p> <ul> <li> <p>выбор: удаленка или уютный офис — в историческом центре Санкт-Петербурга или в небоскребе с шикарным видом на Москву;</p> </li> <li> <p>удобный график работы, который можно подстраивать под себя;</p> </li> <li> <p>минимум бюрократии;</p> </li> <li> <p>дополнительное обучение за счет компании, занятия английским языком, участие в профессиональных конференциях и форумах по всему миру;</p> </li> <li> <p>новый опыт: лучшие сотрудники преподают в наших образовательных проектах, выступают на российских и международных конференциях;</p> </li> <li> <p>полный социальный пакет (спорт, ДМС, английский) и комфортные условия для работы и творчества.<br /><br />Будьте уверены в своих силах, откликайтесь на вакансию — и ждём вас в нашей команде!</p> </li> </ul>",https://hh.ru/vacancy/67172081,67172081
Java Developer,Санкт-Петербург,9-я линия В.О.,"['Git', 'Spring Framework', 'Hibernate ORM', 'Java', 'REST', 'PostgreSQL', 'MySQL', 'Elastic', 'JVM', 'Алгоритмы', 'Структуры данных', 'Базы данных', 'JUnit', 'CI/CD']",200000,300000,RUR,JUG Ru Group,moreThan6,remote,2022-08-15T16:17:47+0300,"<p><strong>JUG Ru Group </strong>— крупнейший в России организатор конференций для разработчиков. Сейчас мы делаем более 15 конференций в год, среди которых Java-конференции Joker и JPoint, JavaScript-конференция HolyJS и Devops-конференция DevOops.</p> <p><em><strong>IT продукты</strong></em></p> <p>Компания в 2020 году проводит все свои конференции в ONLINE – https://live.jugru.org/</p> <p>Для этого мы самостоятельно разработали корпоративную систему трансляции полностью с нуля за 3 месяца.</p> <p>В нашей команде достаточно высококлассных специалистов, готовых сделать такую систему на платформах:</p> <ul> <li>Java 11 + Java Spring + Hazelcast + Rabbit.</li> <li>.NET Core.</li> <li>React + MobX + Next.js</li> <li>PostgreSQL, MongoDB.</li> <li>Kubernetes.</li> <li>И много много другого.</li> </ul> <p>Посмотрите интервью с командой разработки с конференции DevOops https://www.youtube.com/watch?v=PkXRfq0SXuo</p> <p>В этом проекте можно сильно прокачаться с сильной командой профессионалов.</p> <p>У нас также много других конференционных продуктов, состоящих из нескольких десятков различных сервисов. Сервисы, помогающие нам общаться с участниками конференций — <strong>Личный Кабинет</strong>, инструменты планирования и составлений расписаний, сайты конференций, различные сервисы для редактирования контента и работы со спикерами конференций.</p> <p>Эти проекты ведутся senior разработчиками – спикерами наших конференций, использующими весь свой опыт и последние технологии для достижения высокого качества конференций.</p> <p><em><strong>Пара слов о нас и наших процессах:</strong></em></p> <ul> <li>Наш отдел разработки сейчас состоит из нескольких небольших команд – общей численностью около десяти человек.</li> <li>Мы работаем по гибкой методологии разработки.</li> <li>У нас мало legacy, поэтому мы довольно свободны в выборе технологий. Если у вас есть какая-то любимая библиотека и хорошие аргументы в её пользу, вы без проблем сможете ее использовать.</li> <li>Команды разработки очень плотно взаимодействуют с конечными пользователями и заказчиками продукта и получают быструю обратную связь по результатам.</li> <li>Конечными пользователями и заказчиками являются: пользователи ONLINE, маркетинг, программный отдел, отдел продаж, партнерский отдел и отдел развития конференций.</li> </ul> <p><br /><em><strong>Что предстоит делать:</strong></em></p> <ul> <li>Разрабатывать бэкенд для онлайн-сервисов, Личного кабинета, системы аналитики.</li> <li>Проектировать БД для хранения данных.</li> <li>Продумывать архитектуру решений.</li> <li>Активно предлагать и участвовать в выборе оптимального и эффективного клиентского пути.</li> </ul> <p><em><strong>Технологии, которые мы используем:</strong></em></p> <ul> <li>Java 8 и 11.</li> <li>Spring (Core, Boot, Data, MVC, Security).</li> <li>JPA (Hibernate).</li> <li>Hazecast.</li> <li>Elastic (APM, Heartbeat, Filebeat, Search, Kibana).</li> <li>Юнит-тестирование, интеграционное тестирование.</li> <li>Kubernetes.</li> <li>PostgreSQL и MongoDB.</li> <li>Maven.</li> <li>GitLab (Git, CI/CD).</li> <li>Atlassian (JIRA, Confluence)</li> </ul> <p> </p> <p><em><strong>Что мы ожидаем от вас:</strong></em></p> <ul> <li>Опыт разработки приложений на Java от 5 лет.</li> <li>Опыт разработки приложений на Java Spring от 3 лет.</li> <li>Опыт разработки клиентов веб-сервисов.</li> <li>Понимание REST.</li> <li>Понимание: <ul> <li>алгоритмов и их сложности;</li> <li>структур данных (списки, хеш-таблицы, графы);</li> <li>баз данных (деревья, таблицы, индексы, нормализация);</li> <li>работы JVM и её компонентов (классы, класслоадеры, компилятор, куча, сборка мусора, многопоточность и т.п.)</li> </ul> </li> <li>Умение писать юнит-тесты.</li> <li>Знание JDBC.</li> <li>Профильное техническое образование.</li> <li><strong>Способность эффективно и дружелюбно общаться</strong> как с техническими специалистами, так и с коллегами из других отделов (программный отдел, маркетинг, поддержка пользователей и др.)</li> </ul> <p><em><strong>Плюсами будут:</strong></em></p> <ul> <li>Глубокое понимание алгоритмов и структур данных, принципов работы JVM, JPA и других технологий, с которыми придётся работать.</li> <li>Знакомство с NoSQL (MongoDB).</li> <li>Знание JavaScript.</li> <li>Желание делать и получать код-ревью.</li> <li>Опыт работы в Linux.</li> </ul> <p><em><strong>Что мы предлагаем:</strong></em></p> <ul> <li> <p>Гибридный формат работы: 95% удалёнки, 5% личное присутствие (возможна полная удалёнка — компания поможет оборудовать домашнее рабочее место).</p> </li> <li> <p>График 5/2 и гибкое начало рабочего дня (9–11).</p> </li> <li> <p>Комфортный офис рядом с метро «Василеостровская» (в офисе есть рабочие места с 4К-мониторами, кухня с кофе-машиной и печеньками, кондиционеры, книги и т. п.).</p> </li> <li> <p>Открытость в общении -– общаемся на «ты» друг с другом и большинством наших клиентов. Каждый член команды может предлагать свои идеи и влиять на продукты компании.</p> </li> <li> <p>Оформление с первого дня с оплачиваемым отпуском, оплачиваемым до 100% больничным и другими обязательными вещами.</p> </li> <li> <p>Техника для работы — MacBook.</p> </li> <li> <p>Возможность обучения за счет компании и доступ к проводимым компанией конференциям.</p> </li> <li> <p>ДМС после испытательного срока.</p> </li> </ul>",https://hh.ru/vacancy/50774718,50774718
Middle backend developer (Java),Новосибирск,"Советский район, микрорайон Академгородок, улица Лыкова",[],2000,,USD,Скайтек,between1And3,remote,2022-08-16T09:23:10+0300,"<p><strong>Предлагаем вам поучаствовать в разработке и поддержке сложных комплексных мультиплеерных игр, имеющих миллионы установок, большую пользовательскую базу и высокие оценки от игроков. Наши проекты быстро растут и развиваются, в связи с чем мы активно расширяем нашу команду перспективными сотрудниками.</strong></p> <p><strong>Чем нужно будет заниматься?</strong></p> <ul> <li> <p>Поддержка и доработка серверной части игр Android/iOS игр (в жанрах CCG, Online RPG Clicker и Action)</p> </li> <li> <p>Поддержка внутренней системы аналитики</p> </li> <li> <p>Выпуск обновлений, сопровождение боевых игровых серверов</p> </li> <li> <p>Участие в разработке новых проектов компании</p> </li> <li> <p>Работа в удаленном формате</p> </li> </ul> <p><strong>Необходимые навыки:</strong></p> <ul> <li> <p>Хорошее знание Java (SE, EE)</p> </li> <li> <p>Хорошее знание MySQL (сложные запросы, индексы, оптимизация)</p> </li> <li> <p>Опыт работы с memcached, nginx, apache, git, *nix;</p> </li> <li> <p>Умение быстро учиться и осваивать новое</p> </li> </ul> <p><strong>Будет плюсом</strong></p> <ul> <li> <p>Опыт работы с Highload</p> </li> <li> <p>Опыт работы над игровыми проектами</p> </li> <li> <p>Опыт решения DevOps-задач</p> </li> <li> <p>Знание PHP</p> </li> </ul> <p><strong>Работа в Skytec Games — это:</strong></p> <ul> <li>​​​Сложные и интересные задачи</li> <li>Возможность учиться у профессиональных коллег</li> <li>Контракт с американской компанией</li> <li>Гибкий график работы</li> <li>Компенсация посещения спортзалов</li> <li>Комфортный офис, собственное 2-этажное здание на огороженной территории, с деревьями, лавочками, площадкой для мангала и удобной парковкой</li> <li>Своя кухня, сладости, фрукты, чай и кофе. Теннис, настольный футбол и игровая комната с PS4</li> <li>Крутые корпоративы и тематические вечеринки</li> </ul> <p><strong>Мы ждем от Вас:</strong></p> <ul> <li> <p>Резюме</p> </li> <li> <p>Готовность выполнить тестовое задание</p> </li> </ul> <p><strong>Напишите нам прямо сейчас и кто знает, может быть мы вместе с вами создадим новый шедевр в игровой индустрии?</strong></p>",https://hh.ru/vacancy/68819628,68819628
Java Developer,,,"['Java SE', 'SQL', 'JDBC', 'Java', 'Zabbix', 'PostgreSQL', 'jQuery', 'CSS', 'Java Servlets', 'Solr']",,,,КОРУС Консалтинг,between3And6,remote,2022-08-22T15:44:29+0300,"<p><strong>«КОРУС Консалтинг» </strong>– российская ИТ компания, предоставляющая услуги по ИТ-консалтингу, оптимизации и автоматизации бизнес-процессов, созданию ИТ-инфраструктуры и ИТ-аутсорсингу. С 2000 года реализовано более 1100 проектов во всех отраслях экономики. Сегодня в офисах «КОРУС Консалтинг» в Москве, Санкт-Петербурге и Ярославле работают более 1000 сотрудников.</p> <p><strong>Департамент СЭД</strong> с 2004 года внедряет системы электронного документооборота.</p> <p>В 2017 году мы создали собственную платформу - Авандок, которую развиваем, используя Java-технологии.</p> <p>В связи с увеличением количества проектов и постоянно растущим функционалом, мы расширяем команду и находимся в поисках коллеги на должность <strong>Java Developer.</strong></p> <p><strong>Задачи:</strong></p> <ul> <li>Разработка новой и развитие существующей функциональности платформы.</li> </ul> <p><strong>Нам важно:</strong></p> <ul> <li>От 3 лет работы в J2SE;</li> <li>Знание стека: Java SE, Java Servlet, SQL, jdbc, JavaScript, JQuery, CSS, *nix, PostgreSQL, Zabbix, Solr, Tomcat, Zookeeper, REST.</li> <li>Знание и опыт работы с сетевыми технологиями/протоколами;</li> <li>Английский на уровне чтения документации.</li> </ul> <p><strong>Условия:</strong></p> <ul> <li>Оформление в соответствии с ТК РФ с первого дня;</li> <li>Все возможности для удаленной работы :)</li> <li>Работа в комфортном современном офисе в десяти минутах пешком от ст. метро «Старая деревня», а вообще мы можем работать удаленно;</li> <li>Однако в офисе есть спортивная зона, настольный теннис, мини-библиотека, вечера настольных игр, кухня со снек-автоматами и кофе :)</li> <li>Демократичное руководство, отсутствие дресс-кода и формализма в работе;</li> <li>ДМС после испытательного срока, льготные условия для страхования родственников,</li> <li>Изучение английского языка на корпоративных платформах,</li> <li>Помощь и поддержка на всех этапах работы.</li> </ul>",https://hh.ru/vacancy/68096099,68096099
