name,city,address,key_skills,sal_from,sal_to,currency,company,experience,schedule,published_at,description,alternate_url,id
Преподаватель направления «Программирование на Python» для школьников,Санкт-Петербург,улица Обручевых,"['Преподаватель', 'опыт разработки прикладных программ', 'Грамотная речь', 'Python']",,,,Санкт-Петербургский политехнический университет Петра Великого (ФГАОУ ВО СПбПУ),between1And3,fullDay,2022-08-19T18:45:36+0300,"<p><em><strong>Академия информатики для школьников</strong></em></p> <p>Программа «Академия информатики для школьников» (АИШ) разработана в Санкт-Петербургском государственном политехническом университете. В сентябре 2004 года был проведён первый набор школьников. Программа обучения рассчитана на школьников не младше 4 класса школы, направление «Программирование на Python» - с 8 класса. Курсы ветки языка Python:</p> <ul> <li>«Начала алгоритмизации и программирования на языке Python»</li> <li>«Структурное программирование на языке Python»</li> <li>«Практикум по программированию на языке Python»</li> </ul> <p>В данный момент АИШ заинтересована в сотрудничестве с преподавателем, обладающим знанием структурного программирования на Python и практическими опытом программирования на этом языке.</p> <p>Подробнее узнать о программах курсов можно на нашем сайте в разделе «Академия информатики для школьников» курсы направления «Программирование на Python».</p> <p>Приветствуется готовность преподавателя вести несколько курсов.</p> <p><em><strong>Квалификационные требования: </strong></em></p> <ul> <li>Высшее образование (техническое в сфере IT).</li> <li>Практический опыт разработки программного обеспечения на Python.</li> <li>Опыт публичных выступлений, грамотная выразительная речь, умение удерживать внимание аудитории.</li> <li>Опыт общения с подростками (15-17 лет) умение находить с ними общий язык, терпение и выдержка.</li> <li>Широкое поле внимания, умение быстро реагировать на изменение ситуации.</li> <li>Дисциплинированность, пунктуальность.</li> <li>Готовность повышать свою квалификацию, разрабатывать и совершенствовать методические материалы.</li> </ul> <p><strong><em>График работы:</em></strong></p> <ul> <li>Занятость минимум 1 семестр.</li> <li>Весенний семестр: с января по май.</li> <li>Осенний семестр: с сентября по декабрь.</li> <li>Количество рабочих дней в неделю обсуждается.</li> <li>Время работы: <ul> <li>Осенний и весенний семестры: <ul> <li>В будние дни и в субботу с 18:00 до 21:30.</li> <li>В воскресенье: с 10:00 до 13:30 и/или с 14:00 до 17:30 (возможны разные варианты временных диапазонов).</li> </ul> </li> </ul> </li> <li>Возможно оформление в штат (в том числе и внешним совместителем) на должность «педагог ДО».</li> </ul> <p>Оплачиваемый отпуск у штатных преподавателей 2 месяца: июль + август.</p>",https://hh.ru/vacancy/68980263,68980263
Junior Automation Test Engineer (Python),,,['Python'],,,,Лаборатория Касперского,between1And3,fullDay,2022-08-12T10:45:42+0300,"<strong>Обязанности:</strong> <ul> <li>Автоматизированное тестирование десктопного ПО под управлением MacOS(функциональное, системное, регрессивное, локализационное, приемочное, интеграционное);</li> <li>Разработка, отладка, поддержка автоматизированных тестов и соответствующей инфраструктуры;</li> <li>Разработка, отладка и поддержка инструментов автоматизации тестирования;</li> <li>Запуск и анализ результатов автоматизированных тестов;</li> <li>Документирование результатов тестирования: занесение дефектов в багтрекинговую систему, составление отчетов о тестировании;</li> <li>Взаимодействие с командами разработки и аналитики;</li> <li>Тест-дизайн и поддержание актуального состояния тестовых сценариев;</li> <li>Настройка и поддержка тестового окружения (подготовка тестовых данных, подготовка тестовых стендов).</li> </ul> <strong>Требования:</strong> <ul> <li>Высшее образование по направлению, связанному с ИТ/разработкой ПО/математикой</li> <li>Знание принципов построения и работы операционных систем (Windows/Linux/Unix/Mac): архитектура, загрузка ОС, файловые системы и их особенности, специфичные сетевые протоколы;</li> <li>Знание *nix на уровне продвинутого пользователя и выше;</li> <li>Знание файловых систем: организация, механизмы, особенности;</li> <li>Знание сетевых технологии, принципов построения сетей и протоколов;</li> <li>Опыт работы с БД;</li> <li>Знание Python;</li> <li>Знание принципов объектно-ориентированного программирования;</li> <li>Навыки работы с git или иными системами контроля версий;</li> <li>Способность и готовность изучать и усваивать большие объемы информации;</li> <li>Ответственность и умение выполнять задачи в соответствии со сроками и приоритетами;</li> <li>Умение самостоятельно исследовать и разбираться в нетривиальных задачах/проблемах.</li> </ul>",https://hh.ru/vacancy/68170108,68170108
Computer-Vision Инженер (Python),,,"['PyTorch', 'OpenCV', 'Python', 'Computer Vision', 'Git', 'Bash', 'Docker', 'Математическое моделирование', 'C++']",,,,Кама,between3And6,fullDay,2022-08-09T14:32:59+0300,"<p>Приглашаем <strong>CV-инженера </strong>в компанию по разработке автомобиля нового поколения и создания решений для беспилотного управления транспортом!</p> <p>Сейчас мы создаём <strong>собственную систему помощи водителю (ADAS) </strong>и подбираем <strong>сплочённую IT-команду для реализации наших планов.</strong></p> <p><strong>CV – это главная составляющая современной системы помощи водителю.</strong> Автомобиль должен иметь собственное зрение, чтобы детектировать обстановку на дороге (разметку, другие автомобили, пешеходов) и помогать достигнуть конечной точки назначения без происшествий.</p> <p>Мы ищем специалиста, который сможет заняться этим направлением.</p> <p>Если <strong>вы готовы к вызовам и решению нестандартных задач</strong>, применяя имеющие навыки, то <strong>внимательно ознакомьтесь с описанием вакансии и с предлагаемыми условиями и оставляйте отклик!</strong></p> <p><strong>Что нужно делать:</strong></p> <ul> <li>Имплементация и обучение моделей Perception блока ADAS (в последующем беспилотного автомобиля), таких как детекция, сегментация, треккинг и т.д.</li> <li>Имплементация и обучение трёхмерных моделей (3D-детекция, 3D-треккинг, TTC, Sensor-Fusion и т.д.)</li> <li>Оптимизация моделей</li> <li>Изучение SOTA</li> <li>Деплой в симулятор и оценка алгоритма</li> <li>Деплой в машину</li> <li>Кооперация с другими командами Self-Driving</li> </ul> <p><strong>Что от вас требуется:</strong></p> <ul> <li>Знание Python</li> <li>Знание CV классического (Opencv)</li> <li>Знание ML/DL (Pytorch)</li> <li>Хорошая математическая подготовка</li> <li>Работа с git, bash, docker,</li> <li>Умение реализовывать статьи</li> <li>Приветствуется постоянное обучение и развитие в рамках IT</li> <li>Будет плюсом: Знание C++, работа с 3D CV, с облаками точек (PCL), с MLOps</li> </ul> <p><strong>Условия:</strong></p> <ul> <li>Интересные задачи в большом и невероятно крутом инновационном продукте и возможность влиять на его развитие</li> <li>Возможность работать над решением амбициозных и комплексных задач в команде профессионалов</li> <li>Конкурентная заработная плата, которая обсуждается индивидуально</li> <li>Участие в развитии корпоративной жизни Компании</li> <li>Формат работы: удаленный / комбинированный (обсуждается индивидуально)</li> </ul> <p><em><strong>При отклике на вакансию просим указывать зарплатные ожидания в сопроводительном письме</strong></em></p>",https://hh.ru/vacancy/66913380,66913380
Fullstack Developer (remote),,,"['Английский язык', 'React', 'Python', 'Django Framework']",4000,6000,USD,LATOKEN,between1And3,fullDay,2022-08-04T16:29:59+0300,"<p><strong>LATOKEN is a crypto exchange leading startup tokens market with 250+ primary placements and 1000+ assets.</strong><br /><br />Our active users grew by 8x in 2021 to 3M+ accounts including 1.5M+ mobile with 30K+ 5 stars reviews.<br /><br />We have the top trust score in the global list of exchanges Coingecko and are rated top 20 among 588 other exchanges.</p> <p>We are building the next capital market - the “Amazon of Crypto” where it is easy to put an asset to the marketplace, discover, and buy or sell. In other words, we are opening the door for the next billion traders to the next million digital assets from cryptocurrencies to equity, commodity, and real estate markets.</p> <p>We are doing this to unite the global population for humankind&#39;s prosperity. Those who own tradable assets benefit from the growth of the global market. Their brainpower and investment decisions focus planetary resources to build a better future. The more people will become stakeholders of the future, the better it will be.</p> <p>This becomes possible today as blockchain tech solves the property rights problem without armies and political force. Thus people around the world can open an account as easily as in a social app and have their rights protected.</p> <p>Our culture is for champions living to change the world and are free to overdeliver toward the mission.<br />We are acknowledged by FORBES as one of the top 30 companies for remote jobs in 2022.</p> <p>We offer a generous stock options package, competitive pay, and stellar growth with the dawn of the web3 era.</p> <p><strong>Role:</strong> Fullstack Developer<br /><br /><strong>Mission:</strong> Bug-free user-friendly growth products</p> <p><br /><strong>Requirement skills and experience:</strong></p> <ul> <li>Critical skills: Python, Django, Django Rest Framework, Celery, Git, Problem-solving skills.</li> <li>React, Redux, HTML5, SCSS, SASS, Typescript, Docker, SQL (Postgresql), Skill to learn new libraries in a short period of time.</li> <li>Django and React experience 2+ years (middle / senior).</li> <li>Client-oriented.</li> <li>Wants to see how the story completed today will change teammates performance tomorrow.</li> <li>Eager to work with people with high-performance standards.</li> </ul> <p>Will be a strong plus:</p> <ul> <li>Experience in trading, payments, investments/audit or blockchain company.</li> <li>Finalist of a regional olympiad or MIPT, MIEF, VMK, NES graduate.</li> </ul> <p><br /><strong><em>Reward:</em></strong></p> <ul> <li>Competitive base and industry-leading incentives for performance, including potential options from any future Nasdaq listing</li> <li>Work from anywhere with a global team from both developed and emerging markets</li> <li>Opportunity to work with crypto industry leaders building the next breakthrough technology</li> <li>Gain experience in the fastest growing emerging markets targeted by our first-ever global digital exchange wallet</li> </ul> <p><br /><strong>Feel a great fit </strong>- apply now or forward to a great candidate.</p>",https://hh.ru/vacancy/68488290,68488290
Преподаватель курса Python,Санкт-Петербург,Биржевая линия,"['Python', 'Организация учебного процесса', 'Обучение', 'Обучение и развитие', 'Обработка изображений', 'OpenCV']",,,,Университет ИТМО,between1And3,fullDay,2022-08-04T14:58:16+0300,"<p>На Физико-техническом мегафакультете открывается новая магистерская программа “Техническое зрение”. Программа готовит специалистов в области обработки изображений и видеоанализа, которые решают любые задачи, связанные с обнаружением, распознаванием, измерением и визуализацией объектов по изображению и видеопотоку. Сейчас нам очень нужен в команду преподаватель курса Python.</p> <p><strong>Обязанности:</strong></p> <ul> <li>ведение лекций и лабораторных работ по курсу программирования на Python;</li> <li>разработка методических материалов по курсу (методические пособия, электронные методические пособия, видео-пособия и другие интересные Вам форматы)</li> <li>разработка и внедрение лабораторных работ;</li> <li>сопровождение курса в системе управления обучением LMS (обучение и техническая поддержка гарантируются);</li> <li>использование современных образовательных технологий и новых подходов в образовательном процессе.</li> </ul> <p><strong>Требования:</strong></p> <ul> <li>высшее профильное образование;</li> <li>опыт преподавания Python от одного года;</li> <li>практические навыки программирования;</li> <li>наличие кандидатской степени будет значительным преимуществом;</li> <li>приветствуется активная научная работа (публикации в индексируемых журналах с хорошим рейтингом);</li> <li>опыт использования Python в обработке изображений и знание OpenCV являются преимуществом;</li> <li>приветствуется знание английского языка на уровне Upper Intermediate и выше.</li> </ul> <p><strong>Условия работы:</strong></p> <ul> <li>поддерживающая среда для реализации амбициозных идей;</li> <li>объем учебной нагрузки по договоренности;</li> <li>возможность совместной научной работы с научными группами, публикующимися в высокорейтинговых журналах;</li> <li>возможность непрерывного повышения квалификации (семинары, стажировки и оплачиваемые тренинги);</li> <li>корпоративный английский язык для сотрудников;</li> <li>мероприятия и конференции мирового уровня;</li> <li>работа в историческом центре Санкт-Петербурга;</li> <li>ежегодный оплачиваемый отпуск;</li> <li>социальный пакет: официальное трудоустройство, отдых в корпоративном загородном оздоровительном центре, мероприятия для сотрудников и их детей и др.</li> </ul>",https://hh.ru/vacancy/67603795,67603795
Программист инструментария / Game Tools Developer,,,[],,,,Lesta Games,between1And3,fullDay,2022-09-01T10:39:37+0300,"<p>Мы в <strong>Lesta Studio</strong> одновременно ведем разработку нескольких проектов, но безусловным флагманом нашей студии является ММО-игра <strong>World of Warships</strong>. Мир Кораблей – это сессионная игра в военно-морской тематике, а также проект с вдохновляющей историей успеха, профессиональной командой разработчиков (более 300 человек) и многомиллионной аудиторией игроков по всему миру. В 2020 году World of Warships отметила пятилетие с момента релиза, что является большим достижением всей команды проекта, и это только начало.</p> <p>Мы продолжаем активно развивать игру – каждый месяц команда проекта выпускает свежее обновление. И для создания новых решений, а также участия в поддержке существующего функционала, мы находимся в поиске <strong>Game Tools Developer</strong>.</p> <p><strong>Чем предстоит заниматься:</strong></p> <ul> <li>Исследование процессов производства контента.</li> <li>Разработка решений, улучшающих процессы производства контента, и дальнейшей разработки.</li> <li>Внедрений созданных решений и их поддержка.</li> </ul> <p><strong>Области разработки:</strong></p> <ul> <li>Редакторы контента.</li> <li>Системы проверки контента.</li> <li>Сопутствующий инструментарий.</li> <li>Модификация игровых и движковых систем, для улучшения процесса производства контента.</li> </ul> <p><strong>Что для нас важно:</strong></p> <ul> <li>Programming Languages: C++, Python.</li> <li>SVN / Git.</li> <li>Опыт работы с Task/Bug tracking-ами.</li> <li>Опыт работы в команде (Agile).</li> </ul> <p><strong>Что предлагаем:</strong></p> <ul> <li>Заработную плату, которая учитывает официальный курс доллара США.</li> <li>Работу в аккредитованной IT-компании</li> <li>Если вы из другого города, поможем с переездом.</li> <li>Расширенный полис ДМС.</li> <li>Спортзал и душевые в офисе, компенсация большей части стоимости годового абонемента сети спортклубов.</li> <li>Обучение: уроки английского; внутренние и внешние семинары, тренинги.</li> <li>Бесплатное питание (завтраки, обеды, ужины).</li> <li>Релакс-зоны с массажными креслами Yamaguchi и топовыми кофемашинами.</li> <li>Мы тестируем наши продукты в игровых с мощным железом и приставками. Но если хотите размяться в офлайне, у нас есть настольный теннис, хоккей и кикер.</li> <li>Work-life balance: приходим в офис с 9 до 10, уходим с 18 до 19.</li> </ul>",https://hh.ru/vacancy/68381561,68381561
