name,city,address,key_skills,sal_from,sal_to,currency,company,experience,schedule,published_at,description,alternate_url,id
QA-инженер,Санкт-Петербург,проспект Стачек,"['SQL', 'Тестирование', 'Jmeter', 'Java', 'C#', 'Python', 'Selenium IDE', 'REST']",,,,Датаджайл,between1And3,flexible,2022-09-01T11:25:22+0300,"<p>В нашей линейке более 20 программных продуктов и за качеством наших продуктов мы следим тщательно! Поэтому мы не прекращаем набор специалистов в нашу команду.</p> <p>Технологии, которые используем в работе: C# Java Selenium JMeter Appium</p> <p><strong>Задачи:</strong></p> <ul> <li>Поиск дефектов в функционировании, логике работы и документации на ПО</li> <li>Разработка тестовых сценариев и тест-кейсов</li> <li>Разработка и поддержка в актуальном состоянии технической документации по тестированию</li> </ul> <p><strong>Для нас важно:</strong></p> <ul> <li>Знание методологии тестирования ПО</li> <li>Опыт коммерческой разработки от года</li> <li>Опыт самостоятельного тестирования на всем цикле разработки ПО</li> <li>Опыт тестирования клиент-серверных систем</li> <li>Опыт разработки тест-кейсов</li> <li>Опыт анализа требований и документации</li> <li>Навыки формализации требований с точки зрения тестирования (что проверять и как проверять)</li> </ul> <p><em>Желательно:</em></p> <ul> <li>Опыт автоматизации тестирования</li> <li>Опыт проведения нагрузочного тестирования</li> <li>Знание SQL и навыки работы с базами данных</li> </ul> <p><strong>Мы предлагаем:</strong></p> <ul> <li>Стабильную зарплату, официальное трудоустройство</li> <li>Ежеквартальные премии</li> <li>ДМС со стоматологией (+страховка путешественника)</li> <li>Гибридный график работы (с возможностью удаленной работы)</li> <li>Компенсируем расходы на спорт и иностранные языки</li> <li>В пятницу мы работаем на час короче</li> <li>Метро под окнами</li> <li>Зону отдыха (кофе/чай, игры)</li> </ul>",https://hh.ru/vacancy/50340780,50340780
Senior QA Automation Engineer,Санкт-Петербург,Лахтинская улица,"['Тестирование', 'Postman', 'Selenium', 'SQL', 'QA', 'Автоматизация']",,200000,RUR,МедиаСофт,between3And6,flexible,2022-09-01T17:23:02+0300,"<p>Привет, мы —<strong> MediaSoft.team!</strong></p> <p>Мы разрабатываем сложные веб-системы, бэкенды, мобильные приложения и highload-проекты для бизнеса с 2014 года. У нас в команде 250+ разработчиков по направлениям backend, frontend, mobile, qa и аналитика. Наши офисы находятся в Самаре, Ульяновске, Санкт-Петербурге, Москве и Ростове-на-дону (FIRECODE).</p> <p><strong>Задачи:</strong></p> <ul> <li> <p>Анализ требований (ТЗ), написание тестовой документации;</p> </li> <li> <p>Формирование отчетов о проведенном тестировании;</p> </li> <li> <p>Поддержка тестовой документации в актуальном состоянии;</p> </li> <li> <p>Разработка и поддержка существующих автоматизированных сценариев;</p> </li> <li> <p>Создание и поддержка тестовой среды.</p> </li> </ul> <p><strong>Мы ожидаем, что ты имеешь:</strong></p> <ul> <li> <p>Знания типов и принципов тестирования;</p> </li> <li> <p>Опыт анализа требований и написания тестовой документации (сценарии, чек-листы, планы);</p> </li> <li> <p>Опыт разработки автоматизированных тестов;</p> </li> <li> <p>Опыт работы с Selenium, Postman;</p> </li> <li> <p>Знания Python, Java или других языков на уровне написания средств автоматизации тестирования;</p> </li> <li> <p>Знания SQL;</p> </li> <li> <p>Понимание принципов ООП;</p> </li> <li> <p>Понимание и опыт использования систем контроля версий и управления разработкой.</p> </li> </ul> <p><strong>И еще лучше, </strong>если ты понимаешь принципы работы клиент-серверных приложений, сможешь участвовать во внедрении автоматизированных тестов в CI/CD, проектировал тестовые платформы для проведения автоматизированного тестирования.</p> <p><strong>Само собой, </strong>у нас белая зарплата, есть больничные и отпуска, мощная техника на рабочем месте с необходимыми характеристиками. В общем, все как положено.</p> <p><strong>От нас:</strong></p> <ul> <li> <p><em>Гибкий график</em> — учитываем режим сов, жаворонков, интровертов и социофобов.</p> </li> <li> <p><em>Пересмотр зарплаты</em> несколько раз в год.</p> </li> <li> <p><em>Мерч</em> — одеваем с ног до головы в корпоративную одежду и дарим подарки детям сотрудников к Новому году.</p> </li> <li> <p>Комфортная рабочая среда:</p> </li> <li> <p>Работаем и общаемся в уютном офисе с зоной отдыха и своей кухней.</p> </li> <li> <p>Грамотно руководим: <em>наши руководители</em> прошли путь в компании от разработчиков до управленцев — они знают, как построить эффективные и удобные рабочие процессы.</p> </li> <li> <p>Даем возможность работать с технологиями, которые интересны разработчику, и вкладываемся в обучение команды.</p> </li> <li> <p>Любим хорошо отдохнуть: громко шумим два раза в год на наших корпоративах и регулярно собираемся вместе на турбазе, лазертаге или в баре.</p> </li> <li> <p>Обучаем команду: <em>проводим образовательные лекции</em> и мастер-классы, <em>организуем занятия по английскому языку</em> в небольших группах, поддерживаем <em>библиотеку с технической литературой</em>.</p> </li> <li> <p><em>Открыты</em> к идеям, предложениям и творческим порывам.</p> </li> </ul> <p>Мы рады тем, кто разделяет наши ценности и хочет стать частью команды.<br /><strong>Давайте работать вместе!</strong></p>",https://hh.ru/vacancy/54563098,54563098
QA Engineer (to Germany),Санкт-Петербург,улица Красного Курсанта,"['Тестирование', 'HTML', 'Git', 'SQL', 'Английский язык', 'Atlassian Jira', 'Atlassian Confluence', 'Python', 'Test case', 'QA', 'Selenium WebDriver', 'Scrum', 'Ручное тестирование', 'English', 'Jira', 'Appium', 'Тестирование пользовательского интерфейса']",,,,ГЕТ Бизнес Консалтинг,between1And3,flexible,2022-08-31T11:05:52+0300,"<p><strong>GET Information Technology is an international product software development and business consulting company.</strong></p> <p><strong>Our goal:</strong> development of high-class Project &amp; Process Management software solutions designed to support product development, engineering, and business processes.</p> <p>We work for customers in various industries like, for example, nuclear and power, renewables, automotive, tourism, and construction.</p> <p><strong>Get acquainteed with us:</strong> myget-it.com</p> <p>We are looking for a <strong><em>QA Engineer for web&amp;mobile </em></strong>projects of our product lines<strong>:</strong></p> <ul> <li>Radar – a software for status-tracking and status-reporting of the projects (https://projects-radar.com/)</li> </ul> <ul> <li>GET Caesar – a platform that includes web and mobile products for project management, finance management, atomic and renewable power industries (https://myget-it.com/#OurSoftwareProducts)</li> </ul> <p><strong><em>Future tasks:</em></strong></p> <ul> <li>manual testing of web (90%) and mobile (10%) apps - the main pool of tasks;</li> <li>automation of testing web and mobile apps - perspectively;</li> <li>maintenance of test documentation: test cases, user scenarios, check-lists;</li> <li>localization and documentation of bugs;</li> <li>close cooperation with the development team.</li> </ul> <p>Automation test tools: Selenium WebDriver + Python, Appium + Python, Git (for version control).</p> <p><em><strong>We expect:</strong></em></p> <ul> <li>degree in IT or other related area;</li> <li>2+ years QA experience;</li> <li>experience in testing web applications;</li> <li><strong>English and German</strong> <strong>language: written and oral skills no less B1;</strong></li> <li>solid knowledge of QA methodologies, processes and tools;</li> <li>responsibility, structural approach, benevolence, independence and inquisitiveness.</li> </ul> <p><strong><em>Would be a plus, if you:</em></strong></p> <ul> <li>tried / know how to test mobile applications;</li> <li>know and use programming languages;</li> <li>have basic skills in software development and/or test automation.</li> </ul> <p><em><strong>We offer:</strong></em></p> <ul> <li><strong>relocation to German head office (Grevenbroich).</strong></li> </ul> <p><em>If you wish to pass a probation period in St. Petersburg office with further relocation:</em></p> <ul> <li>official employment according to the Labor Code of the Russian Federation;</li> <li>the competitive salary is quoted in EUR and paid twice a month;</li> <li>flexible schedule, 5/2 with core hours from 11 to 17;</li> <li>opportunity for a hybrid schedule;</li> <li>paid medical insurance (after probation period);</li> <li>100% sick pay refund;</li> <li>cozy modern office in the city center, free coffee &amp; tea, refreshments, fresh fruits, and snacks;</li> <li>dedicated workshop rooms with tools to inspire creativity and support design thinking;</li> <li>lounge zone and kicker to help clear the mind and recharge the batteries;</li> <li>office address: Saint Petersburg, Krasnogo Kursanta street, 25zh, IT Park.</li> </ul>",https://hh.ru/vacancy/67372856,67372856
Преподаватель в детскую школу программирования и цифрового дизайна,,,"['Преподаватель', 'Веб-программирование', 'Умение работать с детьми', 'Game Programming', 'Python']",15000,65000,RUR,Школа программирования для детей Coddy,noExperience,flexible,2022-08-30T16:33:43+0300,"<p>CODDY - школа, в которой дети учатся программировать, создавать сайты, игры, приложения и мультфильмы, обрабатывать графические изображения, а также развивают предпринимательские навыки и изучают английский язык.</p> <p>Преподаватели CODDY готовят детей к поступлению в ведущие вузы, созданию бизнеса, работе в российских или международных технологических компаниях. Через программирование они учатся думать самостоятельно и раскрывать свой потенциал.</p> <p><strong>Кого мы ищем?</strong></p> <p>Ключевые требования:</p> <ul> <li>Знания одного или нескольких языков программирования</li> <li>Желание работать с детьми</li> </ul> <p><strong>Кроме того, идеальный кандидат</strong><strong>:</strong></p> <ul> <li>Должен быть энергичный и активный человек, способный организовывать и мотивировать людей, неравнодушный к детскому образованию и имеющий время на работу парт‑тайм.</li> <li>Умеет выступать перед аудиторией, не теряется в общении с детьми</li> <li>Знает и любит компьютерные игры, программирование/дизайн в целом</li> <li>Умеет работать в команде</li> <li>Следит за трендами в IT и GameDev</li> </ul> <p><strong>Условия:</strong></p> <ul> <li>Занятия по выходным дням</li> <li>Гибкий график, возможность совмещения с основной работой</li> <li>Команда молодых и активных единомышленников, которые ценят то, что они делают</li> <li>Заработная плата, зависящая от учебной нагрузки и количества проведенных мероприятий</li> </ul> <p>Если вы готовы выкладываться на занятиях так, чтобы каждый ребёнок окончил ваш курс с мечтой стать программистом, то мы определенно ищем вас!</p> <p><strong>Нам важна ваша мотивация, поэтому, откликаясь на вакансию, напишите нам, что именно в этой работе вас заинтересовало.</strong></p>",https://hh.ru/vacancy/69312157,69312157
Senior Bioinformatics Scientist (Yerevan),,,"['Python', 'Английский язык', 'Data Analysis', 'NGS']",,,,БОСТОНДЖИН,between1And3,flexible,2022-08-31T13:57:16+0300,"<p>BostonGene Corporation is pioneering the use of biomedical software for advanced patient analysis and personalized therapy decision-making in the fight against cancer. Our unique solution continuously aggregates the latest cancer research and clinical information from around the world. BostonGene’s unique solution performs sophisticated analytics to aid clinicians in their evaluation of viable treatment options for each patient’s genetics, tumor and tumor microenvironment, clinical characteristics, and disease profile. BostonGene’s mission is to enable physicians to provide every patient with the highest probability of survival through optimal cancer treatments using advanced, personalized therapies via sophisticated analytics and the integration of scientific and clinical knowledge.</p> <p><strong>Responsibilities:</strong></p> <ul> <li>Participate in the research on oncogenesis and tumor properties integrating WES, WGS, RNAseq, scRNAseq, and Methyl-seq data analysis</li> <li>Develop algorithms and analyze NGS data (WES, WGS, RNAseq, scRNAseq, Methyl-seq)</li> <li>Study the basics of tumor oncogenesis, participate in projects aimed to discover personalized biomarkers of therapeutic efficacy</li> <li>Analyze tumor biology</li> <li>Analyze scientific literature and expand the BostonGene knowledge base on oncogenesis/tumor’s molecular and cellular characteristics</li> <li>Analyze the mechanism of action of drugs at the molecular and cellular level</li> <li>Participate in the development of a model to describe the molecular and cellular properties of a tumor.</li> </ul> <p><strong>Requirements:</strong></p> <ul> <li>Experience working with RNAseq data:</li> <li>identifying somatic mutations from genomic sequencing data;</li> <li>estimating changes in the copy number of genome elements and their structural rearrangements from sequencing data;</li> <li>evaluating gene expression using various metrics from transcriptome sequencing data and their normalization;</li> <li>analysis and interpretation of differential gene expression;</li> <li>analysis of the representation and the search for molecular pathways by molecular data of various types;</li> <li>knowledge of fundamentals of immunology/cell biology;</li> <li>knowledge of molecular biology and cell signaling;</li> <li>knowledge of the molecular basics of modern targeted and immune antitumor therapies is encouraged;</li> <li>experience with scientific literature and scientific databases;</li> <li>fluency in English sufficient for fluent reading and understanding of scientific articles;</li> <li>background in experimental work in biochemistry /molecular biology is a plus;</li> <li>experience with Python/pandas, R, GNU coreutils</li> </ul> <p><strong>We offer:</strong></p> <ul> <li>The office is located in Yerevan, Armenia, company supports relocation, we provide airplane tickets, hotel accommodation for two weeks, full support in official paperwork, and work permits in Armenia;</li> <li>Competitive salary and medical insurance<strong>;</strong></li> <li>Full-time position, permanent contract, flexible working hours;</li> <li>Versatile professional environment: bioinformatics, biologists, physicians, and software developers who united to save people’s lives.</li> </ul>",https://hh.ru/vacancy/69342076,69342076
Senior QA Engineer,Санкт-Петербург,улица Красного Курсанта,"['Тестирование', 'QA', 'Atlassian Jira', 'Atlassian Confluence', 'Git', 'SQL', 'Английский язык', 'Автоматизация', 'Python', 'Selenium IDE']",,,,ГЕТ Бизнес Консалтинг,between3And6,flexible,2022-08-31T11:11:36+0300,"<p><strong>GET</strong><strong> </strong><strong>Information</strong><strong> </strong><strong>Technology</strong><strong> </strong>- международная продуктовая компания по разработке и внедрению программного обеспечения для управления проектами.</p> <p>Мы помогаем нашим международным клиентам достичь операционного, стратегического и инновационного совершенства, принимать обоснованные бизнес-решения и увеличивать стоимость портфеля.</p> <p><strong>Познакомиться с нами:</strong> myget-it.com</p> <p>Мы приглашаем <strong><em>Senior QA Engineer </em></strong>в полнофункциональную команду контроля качества ПО<strong><em> </em></strong>на web&amp;mobile проекты наших продуктов:</p> <ul> <li>Radar – ПО для статус-трекинга и статус-репортинга крупных проектов (https://projects-radar.com/)</li> </ul> <ul> <li>GET Caesar – платформа, включающая в себя веб и мобильные продукты для project management, finance management, atomic and renewable power.</li> </ul> <p><strong><em>Будущие задачи:</em></strong></p> <ul> <li>развитие автоматизации тестирования WebUI и mobile apps;</li> <li>ведение тестовой документации: test cases, user scenarios, check-lists;</li> <li>локализация и документирование багов;</li> <li>тесное взаимодействие с командой разработки и PM.</li> </ul> <p><strong>Automation test tools:</strong> Selenium WebDriver + Python, Appium + Python, Git (for version control).</p> <p><strong>Mobile apps:</strong> Android - Java, Kotlin; iOS - Swift, Objective-c.</p> <p><strong><em>Что мы ожидаем?</em></strong></p> <ul> <li>высшее профильное образование;</li> <li>опыт в QA 3+ лет;</li> <li>опыт автоматизации тестирования web-приложений на Python/Java или др;</li> <li>английский язык: written skills no less B1 - мы описываем дефекты на английском языке;</li> <li>уверенное знание QA методологий, процессов и инструментов;</li> <li>ответственность, структурный подход, доброжелательность, самостоятельность и пытливость.</li> </ul> <p><strong><em>Будет здорово, если:</em></strong></p> <ul> <li>умеете/пробовали тестировать мобильные приложения;</li> <li>развивали автоматизацию и процессы с нуля;</li> <li>имеете опыт менторства и обучения.</li> </ul> <p><strong><em>Мы предлагаем:</em></strong></p> <ul> <li><strong>возможность релокации в головной офис в Германии (г. Гревенбройх)</strong>;</li> <li>оформление согласно ТК РФ и &quot;белая&quot; конкурентоспособная заработная плата в EUR (конвертация в рубли);</li> <li>график работы: 5/2, гибкое начало рабочего дня до 11 часов;</li> <li>гибридный формат работы;</li> <li>возможность профессионального и карьерного роста;</li> <li>компенсация больничного листа 100% от компании вне зависимости от стажа;</li> <li>ДМС (уровень бизнес+) после прохождения испытательного срока, включая полис путешественника;</li> <li>кухня со всеми удобствами: кофе/чай, фруктовые и дни сэндвичей в офисе;</li> <li>прекрасная lounge комната с кикером и турниками для перезарядки;</li> <li>адрес офиса: м. Чкаловская, ул. Красного Курсанта, д.25ж.</li> </ul>",https://hh.ru/vacancy/43122932,43122932
