name,city,address,key_skills,sal_from,sal_to,currency,company,experience,schedule,published_at,description,alternate_url,id
Разработчик облачных решений (ориентированных под МО),Санкт-Петербург,Биржевая линия,"['Python', 'Git', 'PostgreSQL', 'SQL', 'MySQL', 'NoSQL', 'Kubernetes', 'Kafka', 'REST', 'Docker', 'Design Patterns', 'Технический английский']",160000,,RUR,Университет ИТМО,between1And3,flexible,2022-08-31T10:32:25+0300,"<p>В молодежную научную группу, занимающуюся исследованиями и разработкой в области инфраструктуры больших данных и анализа социальных медиа на базе НЦКР при Университете ИТМО, ищем амбициозного разработчика с желанием создавать что-то новое и полезное. Группа занимается выполнением высокотехнологичных проектов в области Computer Science, реализуя свои собственные продукты и продукты с крупными корпоративными партнерами. Проекты связаны с областью разработки распределенных систем с интегрированными технологиями обработки больших данных и областью применения машинного обучения для анализа социальных медиа.</p> <p>Эта вакансия рассчитана на амбициозного человека, желающего развиваться в данных направлениях, с опытом работы в области промышленной разработки ПО. Разрабатываемые нами программные решения, зачастую не имеют шаблонных решений, что требует от разработчика выходить за рамки стандартных подходов.</p> <p>Если Вам надоело работать в рамках шаблонных решений для бизнес-проектов, и Вы хотите создавать что-то принципиально новое и не имеющее аналогов, то мы будем рады с Вами двигаться в исследованиях вместе!</p> <p> </p> <p><strong>Обязанности:</strong></p> <ul> <li> <p>Участие в выполнении проектов от корпоративных партнеров (в том числе иностранных), а также проектах, нацеленных на грантовые НИР;</p> </li> <li> <p>Проектирование и разработка модулей программных систем в области хранения, обработки и управления большими данными (Big Data) в распределенных средах;</p> </li> <li> <p>Разработка распределенных решений в области машинного обучения и искусственного интеллекта;</p> </li> <li> <p>Разработка системного ПО для автоматизации вычислительных экспериментов, а также обработки, анализа и визуализации данных<strong>.</strong></p> </li> </ul> <strong>Требования:</strong> <ul> <li> <p>Высшее образование в области математики или информатики (магистр или специалист);</p> </li> <li> <p>Уверенное владение Python;</p> </li> <li> <p>Опыт использования multithreading, multiprocessing, asyncio;</p> </li> <li> <p>Знание и опыт использования базовых шаблонов проектирования (Design Patterns);</p> </li> <li> <p>Основы использования систем контроля версий (Git, SVN и пр.);</p> </li> <li> <p>Опыт разработки с использованием REST/gRPC;</p> </li> <li> <p>Опыт работы с Docker/Podman;</p> </li> <li> <p>Опыт работы с реляционными СУБД (PostgreSQL, MySQL);</p> </li> <li> <p>Умение адаптироваться и изучать технологии в сжатые сроки;</p> </li> <li> <p>Умение работать в команде;</p> </li> <li> <p>Желание работать над решением нетривиальных задач.</p> </li> </ul> <p><strong>Будет плюсом:</strong></p> <ul> <li>Опыт проектирования распределенного ПО (микросервисная архитектура);</li> <li>Опыт работы с NoSQL базами данных;</li> <li>Опыт работы с Kubernetes;</li> <li>Опыт использования брокеров сообщений (Kafka, RabbitMQ);</li> <li>Опыт разработки в проектах, связанных с машинным обучением.</li> </ul> <strong>Условия:</strong> <ul> <li> <p>Комфортабельный офис на В.О.;</p> </li> <li> <p>Дружный молодой коллектив;</p> </li> <li> <p>Испытательный срок от 1 до 2 месяцев:</p> </li> <li> <p>Гибкий график работы, ежегодное премирование;</p> </li> <li> <p>Применение современных технологий разработки и фреймворков;</p> </li> <li> <p>Возможно участие в исследовательской деятельности, проводимой коллективом, в том числе, ежегодные поездки на международные конференции;</p> </li> <li> <p>Доступ к вычислительным распределенным кластерам общей производительностью более 4 ПФлопс.</p> </li> </ul>",https://hh.ru/vacancy/52161189,52161189
QA Automation Engineer (Java),Санкт-Петербург,Литовская улица,"['Ручное тестирование', 'Автоматизация тестирования', 'Postman', 'Swagger', 'Docker', 'REST API', 'Java']",,,,Каури,between1And3,flexible,2022-08-31T17:02:19+0300,"<p>Будущему сотруднику предстоит работать в команде молодых специалистов над амбициозным проектом - разработкой универсальной системы, поддерживающей работу со множеством протоколов IoT и предоставляющей единый интерфейс. Вам предстоит узнать, какой путь проделывают данные от измерительного сенсора до мобильного приложения, разобраться в устройстве сложной системы с микросервисной архитектурой и выполнять как автоматизированное тестирование REST API и мобильного/веб приложения так и ручное, включающее взаимодействие с реальными IoT устройствами.</p> <p><strong>Обязанности:</strong></p> <ul> <li>Автоматизация тестирования Backend/Frontend</li> <li>Ручное тестирование (Postman, Swagger, etc) не более 30%</li> <li>Разработка тестовых сценариев и планов, чек-листов, тест-кейсов</li> <li>Проверка на соответствие продукта функциональным и нагрузочным требованиям</li> <li>Сплит-тестирование; интеграционное тестирование</li> <li>Регистрация найденных дефектов в баг-трекере и контроль их исправления</li> <li>Взаимодействие с командой разработки, чтобы улучшить конечный продукт</li> </ul> <p><strong>Обязательные требования:</strong></p> <ul> <li>Владение техниками тест-дизайна, знание методологий тестирования, уровней тестирования, жизненного цикла тестирования</li> <li>Опыт проектирования тестовой модели и создания набора тестовых случаев, обеспечивающих оптимальное тестовое покрытие приложения</li> <li>Знания Java 8+</li> <li>Уверенные знания Junit 5</li> <li>Знание основных инструментов тестирования API (Postman, SoapUI и т. д.)</li> <li>Опыт тестирования REST API, понимание структуры запросов/ответов REST API, HTTP заголовков и статусов</li> <li>Знание Docker, представление о сетевом взаимодействии между контейнерами</li> <li>Опыт работы с ОС Linux</li> <li>Опыт работы с баг-трекинговыми системами (Jira, GitLab и др.)</li> <li>Умение анализировать логи</li> <li>Практический опыт работы по Agile (SCRUM)</li> </ul> <p><strong>Будет плюсом:</strong></p> <ul> <li> <p>понимание микросервисной архитектуры</p> </li> <li> <p>знание одного или нескольких из следующих языков (C/С++, Python, Javascript/Typescript, Dart)</p> </li> <li> <p>представление о Spring Framework (Data/Security/Web), опыт тестирования Spring Boot приложений</p> </li> <li> <p>знание протоколов авторизации OAuth2/OpenID Connect</p> </li> <li><strong>Будем рады, если у Вас есть опыт:</strong></li> <li>работы с платформенными сервисами, интерфейсами и знание протоколов ZigBee, MQTT, LoRa</li> <li>хорошее представление о построении индустриальных платформ интернета вещей, индустриальной автоматизации</li> </ul> <p><strong>Мы предлагаем:</strong></p> <ul> <li>оформление по ТК РФ и достойная зарплата - размер обсудим на собеседовании;</li> <li> <p>возможность работать в гибридном графике: дом/офис - решать вам;</p> </li> <li> <p>карьерный рост - от специалиста по тестированию до руководителя отдела;</p> </li> <li> <p>льготы в соответствии с государственной поддержкой для аккредитованных IT-компаний.</p> </li> </ul>",https://hh.ru/vacancy/68851960,68851960
С++ разработчик в Мессенджер,,,"['Linux', 'Python', 'Деловое общение', 'Деловая переписка', 'PostgreSQL', 'C/C++', 'C++', 'Алгоритмы и структуры данных', 'Алгоритмы']",,,,Яндекс,between3And6,flexible,2022-08-30T15:33:32+0300,"Мы разрабатываем мессенджер для корпоративного общения в рамках продукта Яндекс 360 и платформу для организации чатов на сервисах Яндекса. Поставляем нативные приложения, встраиваемые клиентские SDK, поддерживаем и развиваем высоконагруженный бэкенд, обслуживающий все чаты. Если вам интересно превращать туманные идеи в работающие механизмы, которые будут радовать пользователей, присоединяйтесь к нашей команде. <p> </p> <p>Основной язык разработки — C++17, стек технологий включает как общеизвестные технологии (PostgreSQL, gRPC, WebSocket), так и внутренние разработки Яндекса, среди которых есть своя база данных класса NewSQL, своя персистентная очередь, MapReduce-система и др.</p> <p><strong>Что нужно делать:</strong></p> <ul> <li>Работать над производительностью и горизонтальной масштабируемостью серверной части, которая обеспечивает передачу, обработку, чтение и сохранение сообщений;</li> <li>Участвовать в продуктовой разработке Мессенджера.</li> </ul> <p><strong>Мы ждем, что вы:</strong></p> <ul> <li>Хорошо знаете C++;</li> <li>Хорошо знаете алгоритмы и структуры данных;</li> <li>Разрабатывали для Linux;</li> <li>Писали многопоточные программы;</li> </ul> <p>Разрабатывали распределённые, высоконагруженные и отказоустойчивые системы.<br /><br /><strong>Будет плюсом, если вы:</strong></p> <ul> <li>Знаете сети и протоколы;</li> <li>Работали с базами данных;</li> <li>Уверенно работаете с командной строкой Unix;</li> <li>Применяли скриптовые языки, особенно Python.</li> </ul> <strong>Условия:</strong> <ul> <li>Высокий совокупный доход и премии каждые полгода по итогам работы;</li> <li>Сильная команда, с которой можно расти;</li> <li>Сложные задачи для сервисов с миллионами пользователей в день;</li> <li>Возможность влиять на процесс и результат;</li> <li>Иногородним сотрудникам помогаем с переездом;</li> <li>Расширенная программа ДМС: стоматология, обследования, вызов врача на дом и многое другое, оплата 80% стоимости ДМС для супругов и детей;</li> <li>Компенсация оплаты питания;</li> <li>Корпоративные скидки в бассейнах, фитнес-центрах и магазинах;</li> <li>Курсы, тренинги, участие в конференциях;</li> <li>Гибкий график работы;</li> <li>Парковка.</li> </ul>",https://hh.ru/vacancy/67086601,67086601
DevOps Engineer,,,"['Git', 'Linux', 'Docker', 'Atlassian', 'Zabbix', 'TeamCity', 'ELK', 'Kibana', 'Ansible', 'AWS']",,,,Saber Interactive,between1And3,flexible,2022-09-01T17:49:12+0300,"<p>Привет!<br />Наша игровая студия Saber Interactive была основана в 2001 году и на текущий день стала одним из крупнейших разработчиков компьютерных игр с офисами по всему миру: Нью-Йорк, Санкт-Петербург, Мадрид, Минск, Порто, Сундсвалль...</p> <p>Даже если вы далеки от GameDev, скорее всего слышали о наших проектах: Quake Champions, серия игр Halo, TimeShift, World War Z, NBA Playgrounds, SnowRunner, Space Marine 2.<br /><br />У нас миллионы игроков, и их количество постоянно растет.</p> <p>Предлагаем вам стать частью нашей команды!</p> <p><strong>Что предстоит делать:</strong></p> <ul> <li>Поддержка и развитие текущей инфраструктуры</li> <li>Автоматизация развертывания и обновление сервисов и всех необходимых для них зависимостей</li> <li>Работа с системами контейнеризации (Docker), в том числе проектирование и деплой собственных контейнеров для внутренних сервисов</li> <li>Поддержка продуктовых и тестовых стендов</li> <li>Разрешение возможных инцидентов и предоставление обратной связь разработчикам</li> </ul> <p><strong>Наши пожелания:</strong></p> <ul> <li>Знание операционной системы Linux</li> <li>Уверенное знание Git</li> <li>Опыт работы с Atlassian Stack: JIRA, Bitbucket</li> <li>Навыки CI\CD: TeamCity</li> <li>Опыт работы с Docker</li> <li>Опыт работы с Amazon Web Services</li> <li>Опыт работы с системами сбора метрик и логирования: Zabbix, ELK Stack</li> </ul> <p><strong>Будет плюсом:</strong></p> <ul> <li>Опыт с Ansible, Kibana, Artifactory</li> <li>Знание Bash или Python</li> </ul> <p><strong>Мы предлагаем:</strong></p> <ul> <li>Интересную позицию в крупной международной компании, создающий игры мирового уровня</li> <li>Активные и гибко развивающийся проекты</li> <li>Возможность улучшать существующие и внедрять новые системы без бюрократии</li> <li>Возможность удаленной работы</li> <li>Гибкое начало/окончание рабочего дня</li> <li>Корпоративную скидку в фитнес-клуб/бассейн</li> <li>Бесплатное обучение английскому языку</li> <li>ДМС</li> <li>Отсутствие дресс-кода</li> <li>Помощь при переезде из других городов</li> <li>Официальное оформление</li> <li>Оплата больничных в 100% размере</li> </ul>",https://hh.ru/vacancy/69389555,69389555
Embedded программист С++,Санкт-Петербург,улица Шателена,"['C/C++', 'Embedded', 'STM32', 'ARM', 'Linux', 'Микроконтроллеры', 'Cortex', 'Git', 'ООП', 'Python']",,,,Геоскан,between1And3,flexible,2022-08-31T10:26:45+0300,"<p>Мы создаем беспилотные летательные аппараты и программное обеспечение для промышленности, образования и индустрии развлечений. Наше оборудование используют для цифрового картографирования, автоматизации контроля строительства, геологоразведки и точного земледелия. Мы устраиваем соревнования по образовательной робототехнике и запускаем красочные шоу дронов по всему миру.</p> <p>В связи с увеличением количества проектов, мы расширяем отдел разработки ПО для РЭА и ищем <strong>Embedded программистов (С++).</strong></p> <p><strong>Чем предстоит заниматься:</strong></p> <ul> <li>разрабатывать программное обеспечение для встраиваемых вычислительных систем на базе микроконтроллеров с ядрами ARM Cortex-M (полный цикл разработки, начиная с составления ТЗ, заканчивая сопровождением изделий в процессе испытаний и серийного производства);</li> <li>документировать создаваемое программное обеспечение (cоставление ТЗ на разработку, графической схемы алгоритма работы, временных диаграмм работы).</li> </ul> <p><strong>Мы ожидаем, что вы:</strong></p> <ul> <li>имеете профильное высшее образование;</li> <li>хорошо знаете С/С++, умеете применять объектно-ориентированный подход при разработке встраиваемого ПО;</li> <li>имеете опыт разработки для контроллеров с ядрами ARM Cortex-M;</li> <li>разрабатывали многопоточные приложения;</li> <li>имеете опыт разработки драйверов периферии;</li> <li>знакомы с интерфейсами UART, SPI, I2C, SDIO;</li> <li>владеете английским языком на уровне чтения технической документации.</li> <li>имеете опыт работы с системами контроля версий.</li> </ul> <p><strong>Будет плюсом, если вы:</strong></p> <ul> <li>разрабатывали под Linux с использованием GCC;</li> <li>знакомы с интерпретируемыми языками, например: Lua, Python, JavaScript;</li> <li>работали с интерфейсом CAN;</li> <li>имеете опыт отладки устройств, умеете работать с современными приборами.</li> </ul> <p><strong>Что мы предлагаем:</strong></p> <ul> <li>оформление в соответствии с ТК РФ и полностью белую заработную плату;</li> <li>молодой коллектив, с большим количеством специалистов из разных сфер, у которых можно многому научиться;</li> <li>гибкий график работы;</li> <li>современный комфортный офис с пуфиками и капучино;</li> <li>еженедельный спорт (футбол, волейбол, баскетбол), корпоративные выезды на природу;</li> <li>полис ДМС после 6 месяцев работы;</li> <li>изучение английского языка в офисе с 50% компенсацией от компании;</li> <li>корпоративную библиотеку с бестселлерами из разных областей знаний.</li> </ul>",https://hh.ru/vacancy/68638592,68638592
