name,city,address,key_skills,sal_from,sal_to,currency,company,experience,schedule,published_at,description,alternate_url,id
Python Back-end Разработчик / Python Back-end Developer,,,"['Python', 'Linux', 'PostgreSQL', 'Flask', 'Redis', 'Docker']",,,,Доктор Веб,between1And3,flexible,2022-08-05T17:25:42+0300,"<p>«Доктор Веб» создает различные решения и сервисы для защиты от компьютерных угроз. Мы предлагаем вам поучаствовать в их разработке. Сейчас мы ищем талантливого Python-разработчика в команду, которая занимается разработкой сервиса для проверки подозрительных файлов и обнаружения угроз.</p> <p><strong>Обязанности:</strong></p> <ul> <li>Разработка back-end части веб-сервиса.</li> </ul> <strong>Требования:</strong> <ul> <li>Уверенное владение Python 3.x (2.x);</li> <li>Опыт профессиональной командной разработки проектов на Python от 1 года;</li> <li>Опыт работы с Flask, AIOHTTP;</li> <li>Опыт работы с Postgresql, Redis, Celery, RabbitMQ;</li> <li>Знание операционных систем Unix/Linux.</li> </ul> <p><strong>Желательно:</strong></p> <ul> <li>Понимание особенностей работы высоконагруженных, отказоустойчивых и распределенных сервисов;</li> <li>Опыт работы с контейнерами Docker.</li> </ul> <p><strong>Мы предлагаем:</strong></p> <ul> <li>Официальное трудоустройство;</li> <li>Современный офис на Петроградской стороне;</li> <li>Гибкий график работы;</li> <li>Конкурентоспособную заработную плату (обсуждается индивидуально, зависит от вашего опыта и квалификации);</li> <li>Горячие обеды, фрукты, напитки;</li> <li>ДМС, включая стоматологию;</li> <li>Зону отдыха, тренажеры, полезные для работы книги.</li> </ul>",https://hh.ru/vacancy/46823861,46823861
"Программист Python, Middle",Санкт-Петербург,проспект Непокоренных,"['Git', 'Python', 'Linux', 'PostgreSQL']",,,,Специальный Технологический Центр (ООО СТЦ),between1And3,flexible,2022-08-08T11:56:48+0300,"<p>Приглашаем Python-разработчика в отдел исследований и разработки ПО.</p> <p><strong>Задачи:</strong></p> <ul> <li>Разработка backend (сервисы сбора, обработки и хранения данных, системы мониторинга и агрегации информации, системы формирования отчетов);</li> <li>Проекты в таких областях как Data Mining, Big Data, Natural Language Processing, Machine Learning.</li> </ul> <p><strong>Стек наших технологий:</strong></p> <ul> <li>На рабочих станциях Windows, Linux;</li> <li>На серверах CentOS;</li> <li>Микросервисная архитектура;</li> <li>PostgreSQL;</li> <li>ElasticSearch;</li> <li>Cassandra;</li> <li>Kafka;</li> <li>Docker, Kubernetes, Ansible;</li> <li>Kibana/Grafana/Prometheus.</li> </ul> <p><strong> Требования к кандидату:</strong></p> <ul> <li>Опыт разработки на Python;</li> <li>Опыт работы с REST, умение разрабатывать API;</li> <li>Опыт работы с Git.</li> </ul> <p><strong>Наши преимущества:</strong></p> <ul> <li>Гибкое начало рабочего дня, работа в офисе (ст. м. пл. Мужества);</li> <li>Возможность проходить обучение по техническим направлениям (программирование на разных ЯП);</li> <li>ДМС;</li> <li>Всем сотрудникам выплачивается годовая премия (13-я заработная плата);</li> <li>Корпоративный командный спорт, компенсация фитнеса.</li> <li>Отсутствие формализма и бюрократии. Мы поощряем творческий подход в работе, не ограничиваем сотрудников в принятии самостоятельных решений;</li> <li>Свободный выбор инструментов для реализации продуктов.</li> <li>Актуальный стек технологий. Используем open-source. Мало легаси-кода.</li> </ul>",https://hh.ru/vacancy/67339028,67339028
Senior Python developer,Санкт-Петербург,Лахтинская улица,"['Python', 'Django Framework', 'Английский язык', 'ООП', 'Go']",,,,МедиаСофт,between3And6,flexible,2022-08-04T18:33:36+0300,"<p>Привет, мы —<strong> MediaSoft.team!</strong></p> <p>Мы разрабатываем сложные веб-системы, бэкенды, мобильные приложения и highload-проекты для бизнеса с 2014 года. У нас в команде 250+ разработчиков по направлениям backend, frontend, mobile, qa и аналитика. Наши офисы находятся в Санкт-Петербурге, Ульяновске, Самаре, Москве и Ростове-на-дону (FIRECODE).</p> <p><strong>У нас точно хватит задач, которые покажутся тебе интересными. А в коллективе точно найдутся эксперты, которые знают больше. Мы предоставим тебе возможность развиваться в той области и писать на тех языках, которые тебе нравятся.</strong></p> <p>Чтобы было понятнее, какие задачи решаются нашей командой, на сайте mediasoft.team есть кейсы с Хабра.</p> <p><strong>Мы уверены</strong>, что ты каждый день работаешь с ООП, принципами SOLID, паттернами проектирования, Python 2.7/3+ или Go, SQL и системами контроля версий.</p> <p><strong>Здорово, если ты знаешь:</strong></p> <ul> <li>Django, Flask, Tornado, Celery, Django Rest Framework, RabbitMQ, Redis, PostgreSQL, Docker, unittest, doctest, mock;</li> <li>Любой другой язык программирования;</li> <li>Как разбираться в чужом коде и вносить в него изменения, работать с легаси;</li> <li>Английский язык.</li> </ul> <p><strong>И еще лучше</strong>, если ты можешь и хочешь участвовать в выстраивании процессов, проводить Code Review и быть наставником.</p> <p><strong>Само собой,</strong> у нас белая зарплата, есть больничные и отпуска, офис с кухней, релакс-зоной, кофемашиной и снеками. В общем, все как положено.</p> <p><strong>От нас:</strong></p> <ul> <li> <p><em>Техника Apple</em><strong> </strong>или другой мощный компьютер на рабочем месте.</p> </li> <li> <p><em>Пересмотр зарплаты</em><strong> </strong>несколько раз в год.</p> </li> <li> <p><em>Гибкий график</em><strong> </strong>— учитываем режим сов, жаворонков, интровертов и социофобов.</p> </li> <li> <p><em>Мерч</em><strong> </strong>— одеваем с ног до головы в корпоративную одежду и дарим подарки детям сотрудников к Новому году.</p> </li> <li> <p>Комфортная рабочая среда:</p> </li> </ul> <ul> <li> <p>Работаем и общаемся в уютном офисе с зоной отдыха и своей кухней. </p> </li> <li> <p>Грамотно управляем: <em>руководители компании<strong> </strong>— разработчики</em>, они знают, как построить эффективные и удобные рабочие процессы.</p> </li> <li> <p>Даем возможность работать с технологиями, которые интересны разработчику.</p> </li> <li> <p>Обучаем команду: <em>проводим образовательные лекции и мастер-классы</em> по технологиям, <em>организуем занятия по английскому языку</em> в небольших группах, поддерживаем <em>библиотеку с технической литературой.</em></p> </li> <li> <p>Любим хорошо отдохнуть: громко шумим два раза в год на наших корпоративах и регулярно собираемся вместе в офисе или на турбазе, в боулинге, баре.</p> </li> <li> <p><em>Открыты</em> к идеям, предложениям и творческим порывам.</p> </li> </ul> <p>Мы рады тем, кто разделяет наши ценности и хочет стать частью команды.<br /><strong>Давайте работать вместе!</strong></p>",https://hh.ru/vacancy/40379537,40379537
DevOps Engineer,,,"['CI/CD', 'PostgreSQL', 'Python', 'Linux', 'Kubernetes']",,300000,RUR,Cindicator,between3And6,flexible,2022-08-30T15:04:39+0300,"<p>Stoic — флагманский продукт финтех компании Cindicator (запущена в 2015 на основе извлечения ценности из феномена мудрости толпы для инвестиционных продуктов) предоставляет услугу автоматизации трейдинга и управления крипто-активами для десятков тысяч клиентов. Stoic помогает развивать финансовый интеллект клиента, убирая эмоции и трату времени от ручного непрофессионального трейдинга.</p> <p>У нас небольшая команда 60+ крутых профессионалов (математики, разработчики с опытом финтеха мирового уровня – WorldQuant, Bloomberg, Deutsche Bank).</p> <p>Мы стараемся сделать удаленную работу распределенной команды максимально комфортной:</p> <ul> <li>медицинская страховка в той стране, в которой ты находишься, специальная помощь в случае COVID-19, полная оплата анализов на COVID-19 и антитела;</li> <li>удобный способ получения зарплаты, рассчитанной в долларах;</li> <li>компенсация спорта, психотерапии, обучения и профессиональных инструментов;</li> <li>коворкинги и офисы для наших сотрудников в разных локациях.</li> </ul> <p>Сейчас есть редкая возможность одновременно и в революционную команду попасть, и крутой продукт на рынок доставить, да и развиться как финансово, так и лично, и профессионально.</p> <p><strong>Стек:<br />Linux, Azure, Kubernetes, Docker, Gitlab-CI, Flux-CD, Helm, RabbitMQ, ClickHouse, PostgreSQL, MongoDB, SaltStack, Terraform, Vault, Prometheus, ELK Stack, Grafana, Bash, Python</strong></p> <p><strong>Роль:</strong></p> <ul> <li>Разработка и внедрение процессов CI/CD.</li> <li>Автоматизация процессов администрирования информационных систем.</li> <li>Диагностика и устранение проблем программной инфраструктуры.</li> <li>Диагностика и устранение проблем производительности информационных систем.</li> <li>Участие в разработке и поддержке продуктов компании вместе с командами разработки.</li> <li>Обеспечение безопасности инфраструктуры с применением DevSecOps практик.</li> </ul> <p><strong>Мы ожидаем от тебя:</strong></p> <ul> <li>Опыт администрирования Linux (Ubuntu) от 3-х лет (поддержка prod)</li> <li>Опыт разработки приложений и сервисов на Python</li> <li>Опыт работы с облачными платформами Azure/AWS</li> <li>Контейнеризация (docker) и оркестрация (Kubernetes)</li> <li>Опыт настройки и кластеризации баз данных PostgreSQL, MongoDB, ClickHouse</li> <li>Опыт настройки CI/CD (Gitlab)</li> <li>Опыт использования систем управления конфигурациями и понимание подхода IaC (FluxCD, SaltStack, Ansible, Terraform).</li> <li>Понимание основ информационной безопасности, основных видов угроз</li> <li>Опыт работы с Hashicorp Vault</li> <li>Опыт работы c helm/flux-cd</li> <li>Опыт работы с инструментами мониторинга: Prometheus, Grafana, ELK/EFK Stack, auditd, osquery</li> </ul> <p><strong>Будет плюсом:</strong></p> <ul> <li>Опыт разработки приложений и сервисов на Python (использование API Kubernetes).</li> <li>Опыт разработки и поддержки сервисов и систем, работающих в режиме 24/7.</li> </ul> <p><strong>Cindicator Benefits:</strong></p> <ul> <li>Команда с международным опытом разработки и поддержки торговых платформ —&gt; отличное поле для профессионального роста в работе со сложными финтех продуктами;</li> <li>Дружеская атмосфера;</li> <li>Гибкий график - сейчас удаленная работа, но есть и отличный оборудованный по всем стандартам безопасности, удобный для работы, а также игры в кикер, гольф, преферанс, шахматы и гонок на скейтах офис в самом центре Петербурга;</li> <li>Корпоративный английский;</li> <li>Компенсация занятий с психологами или психотерапевтами(мы считаем, что ментальное здоровье не менее важно, чем физическое);</li> <li>ДМС, корпоративный спорт.</li> </ul> <p> </p>",https://hh.ru/vacancy/69137072,69137072
Team Lead Python разработчик (платформа V) в СберТех,,,"['PostgreSQL', 'Python', 'Git', 'Docker', 'Teamleading']",,,,SberTech,moreThan6,flexible,2022-09-01T11:22:53+0300,"<p><strong>Team Lead Python разработчик (платформа V) в СберТех</strong></p> <p><strong>О проекте:</strong></p> <p>Целью проекта является создание и развитие единой система управления СУБД с наличием графического пользовательского интерфейса. Данное ПО призвано помочь в разработке, отслеживании кластеров баз данных, а так же автоматизации рутинных задач обслуживания СУБД.</p> <p>Дружная, позитивная и растущая команда инженеров, разработчики и архитекторы всегда готовы ответить на любой вопрос. Подходы к решению задач обсуждаем совместно, решение обычно – результат работы всей команды. Качеству кода и технических решений у нас уделяется первостепенное внимание. Строгий quality gate.</p> <p> </p> <p><strong>Основные функции и задачи:</strong></p> <ul> <li>Организация работы команды разработчиков: распределение задач, планирование, контроль качества выполнения задач</li> <li>Оптимизация процесса, обеспечение соблюдения SLA/OLA</li> <li>Обеспечение поддержки 3го уровня (поиск и решение проблем)</li> <li>Участие, совместно с командой, принятии архитектурных и технических решений</li> <li>Участие в code review</li> <li>Найм и обучение команды</li> </ul> <p> </p> <p><strong>Мы ждём, что вы имеете:</strong></p> <ul> <li>Опыт программирования на Python 3, asyncio</li> <li>Опыт работы в роли Team Lead от 2-х лет</li> <li>Знание и понимание основ построения высоконагруженных web приложений</li> <li>Умение привести свой код в соответствие со стандартами, задокументировать, покрыть регрессионными тестами</li> <li>Высокая инженерная дисциплина и ответственное отношение к качеству кода</li> <li>Понимание что такое heap dump и thread dump</li> </ul> <p> </p> <p><strong>Приветствуется:</strong></p> <ul> <li>Понимание принципов работы PostgreSQL</li> <li>Опыт разработки Go</li> <li>Опыт работы с docker, Kubernetes</li> <li>Опыт разработки open source решений</li> <li>Опыт разработки распределенных и многопоточных систем</li> <li>Опыт разработки по гибкой методологии (agile) и другим методикам XP</li> <li>Опыт работы со средствами автоматизации разработки/сборки/доставки программных решений (CI/CD)</li> </ul> <p><strong>Мы предлагаем:</strong></p> <ul> <li>Условия работы: пятидневная рабочая неделя, отсутствие строгого дресс-кода</li> <li>Уровень заработной платы, который зависит от ваших технических знаний и навыков, состоит из оклада и годового премирования</li> <li>Команда профессионалов, готовых поддержать ваши инициативы</li> <li>Мощное железо, и все что нужно для продуктивной работы</li> <li>Формат работы: гибридный (3 дня офис и 2 дня удаленно)</li> <li>Офис: Санкт-Петербург, ул.Якорная, д.7, Бизнес-центр &quot;Анкор&quot; (ст.метро Новочеркасская или Ладожская)</li> <li>Заботу о здоровье: корпоративную программу ДМС (включает стоматологию, обследования, лечение заболеваний и т.д.), бесплатный тренажерный зал, страхование жизни;</li> <li>Социальные выплаты сотрудникам по различным жизненным ситуациям;</li> <li>Льготная ипотека;</li> <li>Огромные возможности для саморазвития и обучения – электронная библиотека, Виртуальная школа с онлайн-курсами, участие в конференциях, Корпоративный университет Сбера;</li> </ul>",https://hh.ru/vacancy/69369666,69369666
